43,"(Bloomberg) -- The first companies developing medical treatments from psychedelic drugs like LSD, ketamine and the active ingredient in magic mushrooms are g...",Frida Ghitis writes that President Trump is downplaying the seriousness of the threat of the coronavirus -- a sudden and powerful factor affecting the global economy -- because an economic downfall would be bad for him going into the 2020 election.,0.0,138,23,2,10,2,23.0,6.0,0,50.0,0.0,8.695652173913043,0.0,23,0,0,0,0,0,0,0,0,23,0,0,0,-70.0,-18.0,-5.0,-1.0,0.0,-18.0,0.93,0.0,21.43,0.0,6.26,-9.76,-9.0,0.0,-1.0,0.0,-1.0,0.0,-1.0,0.0,0.0,-9.0,0.0,0.0,-1.0,6.21,1.63,0.64,1.02,-0.0,-5.24,-0.09,0.0,1.11,0.0,0.75,-0.52,2.22,-0.03,0.05,0.0,-0.07,0.07,-0.06,-0.04,0.0,2.22,0.09,-0.05,-0.06
44,"HILLSIDE, Ill. -- Hardis White, 78, could hardly wait to break out of suburbia.He dressed in a flannel shirt, jeans and a Bears cap, strode out of the rectan...","China has spent decades nurturing its tech sector. Now, faced with a massive public health crisis, Beijing is pushing its tech companies to join the fight against the novel coronavirus.",0.0,132,29,5,11,4,10.0,4.551724137931035,0,0.0,0.0,0.0,3.4482758620689653,23,0,0,0,1,0,0,0,0,23,0,0,0,-24.0,-1.0,-2.0,0.0,1.0,-5.0,-0.65,0.0,-14.29,0.0,-3.33,0.11,-1.0,0.0,0.0,0.0,1.0,0.0,-2.0,0.0,0.0,-1.0,0.0,0.0,-2.0,5.22,1.51,0.6,0.98,0.03,-5.48,-0.1,0.0,0.71,0.0,0.7,-0.52,2.09,-0.03,0.05,-0.0,-0.06,0.07,-0.08,-0.04,0.0,2.09,0.09,-0.05,-0.08
45,"Woman who posed as baby photographer in court ABC News Woman who posed as baby photographer charged after drugging a mother and planning to steal her child, prosecutors say CNN 'Something is wrong': chilling 911 call captures mom drugged in baby kidnap attemp…","Michael Bloomberg unveiled a suite of proposals on Tuesday aimed at addressing racial disparities in the criminal justice system, reducing the prison population and investing in reintegration initiatives.",0.0,218,43,11,18,1,43.0,5.069767441860465,0,9.090909090909092,0.0,0.0,4.651162790697675,28,0,0,0,1,0,2,0,0,28,0,0,2,41.0,15.0,6.0,6.0,-1.0,15.0,-1.25,0.0,9.09,0.0,0.0,-2.49,4.0,0.0,0.0,0.0,1.0,0.0,2.0,0.0,0.0,4.0,0.0,0.0,2.0,6.15,1.7,0.7,1.1,0.01,-5.0,-0.1,0.0,0.52,0.0,0.66,-0.5,2.08,-0.03,0.05,-0.0,-0.05,0.07,-0.05,-0.04,0.0,2.08,0.09,-0.05,-0.05
46,How two uniquely American issues could make the coronavirus worse Yahoo Money Lack of Paid Sick Days and Large Numbers of Uninsured in US Increase Risks of Spreading the Coronavirus Common Dreams Avoiding Coronavirus May Be a Luxury Some Workers Can’t Afford …,"When the President tweeted his objection to the sentencing recommendation for his Roger Stone, and Attorney General William Barr then quickly reversed the recommendation, they were following along a well-trod path across history, writes Frida Ghitis.",0.0,218,43,6,24,1,43.0,5.069767441860465,0,0.0,0.0,0.0,4.651162790697675,36,0,0,0,1,0,0,0,0,36,0,0,0,3.0,7.0,0.0,10.0,-1.0,7.0,-0.9,0.0,-16.67,0.0,-5.56,1.87,5.0,0.0,0.0,0.0,1.0,0.0,-2.0,0.0,0.0,5.0,0.0,0.0,-2.0,7.03,1.88,0.69,1.34,-0.02,-4.53,-0.1,0.0,0.15,0.0,0.62,-0.48,2.24,-0.03,0.05,-0.0,-0.04,0.06,-0.06,-0.04,0.0,2.24,0.09,-0.05,-0.06
47,"The number of new cases of the coronavirus in China dropped for a second straight day, health officials said Wednesday in a possible glimmer of hope amid the outbreak that has infected over 45,000 people worldwide and killed more than 1,100.  Dr. Mike Ryan, t…","The number of deaths from the novel coronavirus has risen to 1,770, with an additional 100 deaths reported Sunday in Hubei, the Chinese province at the center of the outbreak.",0.0,215,45,5,16,3,15.0,4.777777777777778,0,0.0,0.0,2.2222222222222223,6.666666666666667,37,0,0,0,2,0,0,0,0,37,0,0,0,69.0,15.0,2.0,6.0,1.0,-15.0,-0.09,0.0,0.0,0.0,2.22,3.33,15.0,0.0,0.0,0.0,0.0,0.0,0.0,0.0,0.0,15.0,0.0,0.0,0.0,7.82,2.09,0.65,1.4,-0.0,-4.67,-0.11,0.0,-0.2,0.0,0.62,-0.42,2.41,-0.03,0.04,-0.01,-0.01,0.06,-0.07,-0.04,0.0,2.41,0.08,-0.05,-0.07
48,"Three prescription drugs have been approved to move to over-the-counter status, the U.S. Food and Drug Administration announced Friday.",Accidental drug overdoses can be life threatening but for two women who took massive hits of LSD the experience was life changing -- in a good way.,0.0,117,19,5,8,4,6.666666666666667,6.157894736842105,0,20.0,0.0,0.0,0.0,17,0,0,0,1,0,0,0,0,17,0,0,0,-4.0,-8.0,0.0,-2.0,2.0,-20.33,1.68,0.0,-20.0,0.0,-3.7,-3.7,-8.0,0.0,0.0,0.0,0.0,0.0,0.0,0.0,0.0,-8.0,0.0,0.0,0.0,6.58,1.76,0.62,1.29,0.03,-4.97,-0.09,0.0,-0.13,0.0,0.58,-0.49,2.17,-0.03,0.04,-0.01,-0.01,0.06,-0.09,-0.04,0.0,2.17,0.08,-0.05,-0.09
49,Company’s shares up 70% just days after public offering Continue reading...,"In Calhoun, Georgia, a city of around 16,000 residents 70 miles outside of Atlanta, Walmart is testing out a new health center. If successful, Walmart may expand its initiative across the United States, potentially upending the way millions of Americans recei…",0.0,65,11,1,7,2,11.0,5.909090909090909,0,0.0,0.0,0.0,0.0,11,0,0,0,1,0,0,0,0,11,0,0,0,-155.0,-30.0,-5.0,-8.0,0.0,-9.5,0.54,0.0,-16.67,0.0,-2.44,0.0,-21.0,0.0,0.0,0.0,-1.0,0.0,-1.0,0.0,0.0,-21.0,0.0,0.0,-1.0,4.34,1.29,0.51,1.17,0.03,-5.17,-0.07,0.0,-0.47,0.0,0.54,-0.56,1.82,-0.03,0.04,-0.01,-0.0,0.06,-0.1,-0.04,0.0,1.82,0.08,-0.05,-0.1
50,"Fentanyl in the form of a highly lethal, synthetic opioid that’s been making its way through the U.S. over the last decade. The largest source of this illicit drug is China.","Jeffrey Sachs writes that HHS Secretary Alex Azar appears to suggest that a coronavirus vaccine, once it is developed, will be left to the private marketplace rather than to government procurement. This is the wrong approach.",0.0,143,31,4,9,5,8.0,4.612903225806452,0,50.0,0.0,0.0,6.451612903225806,26,0,0,0,0,0,1,0,0,26,0,0,1,-47.0,-5.0,-5.0,-3.0,2.0,-10.0,-0.66,0.0,16.67,0.0,0.0,3.67,-1.0,0.0,0.0,0.0,0.0,0.0,0.0,0.0,0.0,-1.0,0.0,0.0,0.0,3.72,1.23,0.46,1.09,0.08,-5.43,-0.08,0.0,0.19,0.0,0.51,-0.51,1.77,-0.03,0.04,-0.01,-0.01,0.06,-0.09,-0.04,0.0,1.77,0.08,-0.05,-0.09
51,"The outbreak could have an impact on the company's manufacturing, supply chain and clinical trial operations, Pfizer said under the risk factors section of a regulatory filing. The outbreak that began in Wuhan at the end of last year has killed over 2,700 in …","The US Food and Drug Administration is aware of ""spot shortages,"" but nothing widespread yet, of medical devices due to the coronavirus epidemic. Of particular concern are personal protective equipment such as masks, respirators, gloves and surgical gowns.",0.0,216,45,6,18,2,22.5,4.8,0,0.0,0.0,0.0,8.88888888888889,34,0,0,0,1,0,0,0,0,34,0,0,0,-3.0,7.0,4.0,3.0,-1.0,3.5,-0.96,0.0,-100.0,0.0,-2.63,3.63,0.0,0.0,0.0,0.0,1.0,0.0,0.0,0.0,0.0,0.0,0.0,0.0,0.0,4.53,1.44,0.46,1.19,0.08,-5.39,-0.09,0.0,-0.14,0.0,0.47,-0.41,1.88,-0.03,0.04,-0.01,-0.01,0.06,-0.1,-0.04,0.0,1.88,0.08,-0.05,-0.1
52,"The coronavirus’ grip on the market continues. Since the beginning of February, the S&P 500 has shed 8.5% of its value, a reflection of the effect the outbreak is having on the global economy. Amidst the bloodbath, one specific group of stocks is holding up. …","We've reached the phase of the Democratic primary where the early states have had their say. (The last one, South Carolina, is on Saturday.) Now comes Super Tuesday, when large numbers of people all around the US will start casting their votes in the Democrat…",0.0,215,46,8,18,5,9.4,4.673913043478261,0,25.0,0.0,0.0,2.1739130434782608,31,0,0,0,3,0,1,0,0,31,0,0,1,-1.0,1.0,-1.0,4.0,2.0,-5.93,-0.13,0.0,13.89,0.0,0.0,2.17,-5.0,0.0,0.0,-1.0,2.0,0.0,-1.0,0.0,0.0,-5.0,0.0,0.0,-1.0,5.29,1.66,0.49,1.29,0.13,-5.61,-0.1,0.0,0.01,0.0,0.44,-0.44,1.93,-0.03,0.04,-0.01,0.04,0.06,-0.09,-0.04,0.0,1.93,0.08,-0.05,-0.09
53,"The U.S. Food and Drug Administration on Thursday approved Biohaven Pharmaceutical Holding Co Ltd's oral pill for relieving pain after the onset of migraine headaches, the drug developer said.  Nurtec ODT, chemically known as rimegepant, belongs to an emergin…","Heavyweight champion Tyson Fury is no stranger to adversity. He's a member of a persecuted ethnic minority group known as ""Irish Travellers.""",0.0,221,39,5,21,4,10.0,5.666666666666667,0,0.0,0.0,0.0,5.128205128205128,38,0,0,0,0,0,0,0,0,38,0,0,0,101.0,17.0,1.0,11.0,1.0,2.33,0.21,0.0,-25.0,0.0,-4.55,-3.96,18.0,0.0,0.0,0.0,0.0,0.0,0.0,0.0,0.0,18.0,0.0,0.0,0.0,6.14,1.74,0.46,1.44,0.16,-5.8,-0.09,0.0,-0.3,0.0,0.41,-0.41,2.11,-0.04,0.04,-0.02,0.02,0.06,-0.1,-0.04,0.0,2.11,0.07,-0.05,-0.1
54,"With shares down more than 80%, is there opportunity with Acasti Pharma (NASDAQ:ACST) stock? Don't bet on it! Shares have been hammered since January due to poor Phase 3 results for its prospective hypertriglyceridema treatment CaPre. Like with many biotech s…","President Donald Trump made 31 false claims last week and 55 the week before, including 22 at a campaign rally in Des Moines, Iowa, in late January and 13 in an official speech at a community college in Charlotte, North Carolina, in early February.",0.0,220,41,7,16,2,10.25,5.365853658536586,1,28.57142857142857,0.0,0.0,2.4390243902439024,39,0,0,1,2,0,1,0,1,39,0,0,1,15.0,-3.0,5.0,-3.0,0.0,-33.75,0.71,1.0,28.57,0.0,0.0,0.17,8.0,0.0,0.0,1.0,-2.0,0.0,1.0,0.0,1.0,8.0,0.0,0.0,1.0,6.93,1.85,0.47,1.49,0.15,-5.98,-0.08,0.02,-0.08,0.0,0.38,-0.43,2.3,-0.04,0.04,0.0,0.05,0.05,-0.1,-0.04,0.02,2.3,0.07,-0.05,-0.1
55,"Larry Dean Harmon, CEO of crypto wallet provider DropBit, has been indicted for allegedly laundering $311 million in bitcoin for darknet transactions.The post US authorities charge DropBit CEO for allegedly laundering $311M in bitcoin appeared first on The Bl…","Drugs, gambling, and spying -- no, this isn't a James Bond movie, it's professional sports.",0.0,222,39,7,17,2,20.0,5.6923076923076925,0,14.285714285714285,0.0,0.0,0.0,26,0,0,0,3,0,0,0,0,26,0,0,0,145.0,24.0,4.0,11.0,0.0,5.0,0.56,0.0,14.29,0.0,0.0,0.0,11.0,0.0,0.0,0.0,3.0,0.0,0.0,0.0,0.0,11.0,0.0,0.0,0.0,7.73,1.93,0.48,1.55,0.14,-5.99,-0.07,0.02,-0.13,0.0,0.35,-0.5,2.25,-0.04,0.04,0.0,0.09,0.05,-0.11,-0.04,0.02,2.25,0.07,-0.05,-0.11
