10,"Ruling party lawmakers have proposed legalizing marijuana in Nepal, where it has been used for generations and was famed during the counterculture '60s. Forty-six members of the ruling Communist Party of Nepal filed the proposal in Parliament to legalize the …","Italians who attempt to flee the lockdown in the country's north, set up to try and stop the spread of the novel coronavirus, may face three months' imprisonment, Italy's interior minister has said.",0.0,220,41,12,13,2,20.5,5.365853658536586,0,16.666666666666664,0.0,2.4390243902439024,0.0,33,0,0,0,0,0,1,0,0,33,0,0,1,54.0,8.0,3.0,4.0,0.0,-12.5,0.34,0.0,16.67,0.0,2.44,-6.06,6.0,0.0,0.0,0.0,-1.0,0.0,1.0,0.0,0.0,6.0,0.0,0.0,1.0,-4.27,-1.37,0.44,-0.02,-0.05,-5.37,0.06,0.0,-2.34,0.0,1.57,-1.58,-0.1,-0.05,0.07,0.18,-0.57,0.09,-0.31,-0.04,0.0,-0.1,0.0,0.02,-0.31
11,"A man who had been given a last-minute stay of execution by the Supreme Court has now been put to death after his final appeals were refused.Nathaniel Woods was due to be executed by the state of Alabama on Thursday, but just 30 minutes before the lethal inje…","Days after an Atlanta prosecutor said he would consider opening a formal investigation into James Brown's death, Brown's longtime attorney said he would have no objection if authorities wanted to examine the singer's remains.",0.0,213,48,10,14,2,24.5,4.4375,0,50.0,0.0,0.0,4.166666666666666,37,0,0,0,1,0,1,0,0,37,0,0,1,21.0,14.0,1.0,1.0,0.0,-9.5,-1.21,0.0,50.0,0.0,0.0,-1.72,11.0,0.0,0.0,0.0,1.0,0.0,-1.0,0.0,0.0,11.0,0.0,0.0,-1.0,-0.35,0.01,0.74,0.17,-0.07,-5.05,-0.01,0.0,0.61,0.0,1.33,-1.45,0.79,-0.05,0.07,0.16,-0.49,0.08,-0.26,-0.04,0.0,0.79,0.0,0.01,-0.26
12,"China's coronavirus outbreak poses a ""very grave threat for the rest of the world"" and should be viewed as ""Public Enemy Number 1"", the head of the World Health Organization (WHO) said on Tuesday. WHO director-general Tedros Adhanom Ghebreyesus urged countrie…","President Donald Trump made 56 false claims last week -- repeating one of his conspiracy theories about the 2016 election, promoting new fiction about impeachment witness Lt. Col. Alexander Vindman, and inflating his accomplishments and his standing in the po…",0.0,220,41,6,19,2,20.5,5.365853658536586,0,16.666666666666664,0.0,0.0,4.878048780487805,35,0,0,0,1,0,0,0,0,35,0,0,0,-1.0,1.0,2.0,2.0,-1.0,7.17,-0.16,0.0,16.67,0.0,-2.5,-2.62,4.0,0.0,0.0,0.0,-2.0,0.0,-3.0,0.0,0.0,4.0,0.0,0.0,-3.0,3.51,0.63,0.69,0.71,-0.08,-5.1,0.0,0.0,0.55,0.0,1.13,-1.28,1.38,-0.05,0.06,0.14,-0.43,0.08,-0.29,-0.04,0.0,1.38,0.0,0.01,-0.29
13,"Donald Trump on Wednesday used various adjectives to contend his administration responded swiftly to the coronavirus amid a wave of criticisms from Democrats about a snail-like federal effort.The president, who will tour US Centers for Disease Control and Pre…","Las sobredosis de drogas pueden poner en peligro la vida, pero para dos mujeres que accidentalmente recibieron fuertes cantidades de LSD, la experiencia les cambió la vida, y en el buen sentido.",0.0,222,39,5,16,2,20.0,5.6923076923076925,0,0.0,0.0,0.0,5.128205128205128,35,0,0,0,0,0,1,0,0,35,0,0,1,59.0,7.0,2.0,-2.0,0.0,-12.0,0.6,0.0,0.0,0.0,0.0,5.13,12.0,-3.0,0.0,0.0,0.0,0.0,1.0,0.0,0.0,12.0,0.0,0.0,1.0,6.96,1.02,0.57,0.96,-0.09,-5.17,0.04,0.0,-0.7,0.0,0.95,-1.12,1.89,-0.05,0.05,0.12,-0.45,0.07,-0.25,-0.04,0.0,1.89,0.0,0.0,-0.25
14,"Donald Trump said Wednesday he was considering travel restrictions on Italy and South Korea over coronavirus fears, as he sought to reassure Americans worried about the epidemic. ""I think that there's a chance that it could get worse, a chance it could get fa…","Although physicians still have no vaccine or cure for the novel coronavirus, health officials and pharmaceutical companies around the world are working hard to develop them.",0.0,217,44,12,14,2,22.0,4.931818181818182,0,8.333333333333332,0.0,2.272727272727273,9.090909090909092,30,0,0,0,0,0,4,0,0,30,0,0,4,69.0,18.0,8.0,6.0,0.0,-4.0,-0.76,0.0,-16.67,0.0,-1.57,5.24,6.0,0.0,0.0,0.0,0.0,0.0,4.0,0.0,0.0,6.0,0.0,0.0,4.0,9.62,1.69,0.94,1.05,-0.1,-5.1,0.02,0.0,-1.23,0.0,0.95,-0.71,2.0,-0.05,0.05,0.11,-0.46,0.07,-0.01,-0.04,0.0,2.0,0.0,-0.0,-0.01
15,"The Chinese province at the epicenter of the coronavirus outbreak reported a record rise in the death toll on Thursday, as global health experts warned the epidemic could get far worse before it is brought under control. Health officials in Hubei province sai…","Michael Bloomberg unveiled a suite of proposals on Tuesday aimed at addressing racial disparities in the criminal justice system, reducing the prison population and investing in reintegration initiatives.",0.0,218,43,6,18,2,21.5,5.069767441860465,0,16.666666666666664,0.0,0.0,13.953488372093023,35,0,0,0,0,0,1,0,0,35,0,0,1,41.0,15.0,1.0,6.0,0.0,-6.5,-1.25,0.0,16.67,0.0,0.0,6.81,11.0,0.0,0.0,0.0,0.0,0.0,1.0,0.0,0.0,11.0,0.0,0.0,1.0,12.01,2.21,0.88,1.38,-0.11,-5.07,0.01,0.0,-1.16,0.0,0.81,-0.06,2.41,-0.05,0.04,0.1,-0.47,0.06,0.01,-0.04,0.0,2.41,0.0,-0.01,0.01
16,"The notorious crime boss James “Whitey” Bulger terrorized Boston from the 1970s into the 1990s with a campaign of murder, extortion, and drug trafficking, then spent 16 years on the lam after he was tipped to his pending arrest. In 2013, Janet Uhlar was one o…",Some police departments are putting out fake warnings that illicit drugs could be contaminated with coronavirus in an effort to make drug arrests.,0.0,215,46,6,19,2,23.0,4.673913043478261,0,33.33333333333333,0.0,0.0,8.695652173913043,41,0,0,0,5,0,2,0,0,41,0,0,2,91.0,23.0,-1.0,11.0,0.0,0.0,-0.72,0.0,4.76,0.0,0.0,-4.35,18.0,0.0,0.0,0.0,5.0,0.0,2.0,0.0,0.0,18.0,0.0,0.0,2.0,13.94,2.85,0.84,1.72,-0.11,-4.95,-0.02,0.0,-0.13,0.0,0.69,0.21,3.12,-0.05,0.04,0.09,-0.19,0.06,0.09,-0.04,0.0,3.12,0.0,-0.01,0.09
17,An Arizona Senate hearing on an effort to enshrine an existing ban on “sanctuary cities” in the state constitution erupted in shouting as immigrant rights ac...,The US Food and Drug Administration has asked the maker of Belviq and Belviq XR to take the weight loss drugs off the market after clinical trials showed an increased incidence of cancer among users.,0.0,135,26,5,11,2,26.0,5.1923076923076925,0,0.0,0.0,0.0,0.0,20,0,0,0,0,0,0,0,0,20,0,0,0,-30.0,-9.0,0.0,-5.0,0.0,-9.0,0.48,0.0,0.0,0.0,0.0,-5.71,-6.0,0.0,0.0,0.0,0.0,0.0,0.0,0.0,0.0,-6.0,0.0,0.0,0.0,11.21,2.31,0.74,1.58,-0.12,-4.68,-0.02,0.0,-1.06,0.0,0.58,-0.03,2.59,-0.05,0.04,0.08,-0.22,0.06,0.04,-0.04,0.0,2.59,0.0,-0.02,0.04
18,"Joe Biden’s chances of becoming president took a big hit with his fifth place finish in New Hampshire. At that moment, Sen. Amy Klobuchar’s chances were revived. The candidate who could, but didn’t until now, Klobuchar finished a strong third, crowding the bo…","More than 5 tons of drugs were seized off the coast of Panama after authorities spotted what appeared to be a semi-submersible vessel, the country's ministry of public security said.",0.0,218,43,9,22,4,10.75,5.069767441860465,0,11.11111111111111,0.0,2.3255813953488373,0.0,39,0,0,0,0,0,1,0,0,39,0,0,1,65.0,13.0,3.0,13.0,2.0,-19.25,-0.03,0.0,-22.22,0.0,2.33,0.0,14.0,0.0,0.0,0.0,-1.0,0.0,1.0,0.0,0.0,14.0,0.0,0.0,1.0,13.14,2.72,0.86,2.04,-0.02,-5.24,-0.03,0.0,-1.31,0.0,0.6,-0.24,3.11,-0.05,0.03,0.07,-0.24,0.05,0.06,-0.04,0.0,3.11,0.0,-0.02,0.06
19,Efforts to address the outbreak risk are being undermined by an exodus of scientists and a leader who regularly distorts factsThe Trump administration’s jettisoning of scientific expertise and the president’s habit of spreading misinformation means the US is …,"A federal judge has paved the way for a facility to open in Philadelphia that would allow and supervise the injection of illegal drugs, an arrangement that would be the first of its kind in the United States.",0.0,222,39,10,16,1,39.0,5.6923076923076925,0,20.0,0.0,0.0,10.256410256410255,31,0,0,0,0,0,0,0,0,31,0,0,0,51.0,1.0,2.0,6.0,-1.0,1.0,1.19,0.0,7.5,0.0,0.0,7.62,5.0,0.0,0.0,0.0,0.0,0.0,-1.0,0.0,0.0,5.0,0.0,0.0,-1.0,15.07,2.89,1.02,2.15,-0.08,-4.34,-0.0,0.0,-1.09,0.0,0.51,0.07,3.19,-0.05,0.03,0.06,-0.26,0.05,0.02,-0.04,0.0,3.19,0.0,-0.02,0.02
20,Nathaniel Woods is scheduled to die Thursday amid questions about his culpability in the deaths of three police officers in 2004 and the wounding of a fourth...,"Oklahoma state officials announced Thursday that the state will resume executions by lethal injection, having found a ""reliable supply.""",0.0,134,27,3,9,2,27.0,4.962962962962963,0,33.33333333333333,0.0,0.0,3.7037037037037033,21,0,0,0,2,0,1,0,0,21,0,0,1,16.0,8.0,-2.0,1.0,0.0,17.0,-1.25,0.0,33.33,0.0,-5.26,-1.56,4.0,0.0,0.0,0.0,2.0,0.0,1.0,0.0,0.0,4.0,0.0,0.0,1.0,12.63,2.47,0.83,1.92,-0.09,-4.09,-0.01,0.0,-0.26,0.0,0.42,0.05,2.77,-0.05,0.03,0.05,-0.18,0.05,0.04,-0.04,0.0,2.77,0.0,-0.02,0.04
21,Nathaniel Woods was put to death amid a storm of appeals and protests from supporters who noted that Woods did not actually kill the officers.,"No drug manufacturers have reported that they anticipate shortages of particular drugs due to the novel coronavirus, according to the US Food and Drug Administration, but the agency and experts in the pharmaceutical industry are paying close attention to the …",0.0,118,25,5,9,2,25.0,4.72,0,20.0,0.0,0.0,12.0,23,0,0,0,0,0,0,0,0,23,0,0,0,-102.0,-16.0,-1.0,-5.0,1.0,-16.0,-0.65,0.0,3.33,0.0,0.0,12.0,-8.0,0.0,0.0,0.0,0.0,0.0,0.0,0.0,0.0,-8.0,0.0,0.0,0.0,9.69,2.0,0.75,1.7,-0.1,-3.95,-0.03,0.0,-0.1,0.0,0.34,0.41,2.49,-0.05,0.03,0.05,-0.21,0.05,0.0,-0.04,0.0,2.49,0.0,-0.03,0.0
22,"COVID-19, the disease caused by the novel coronavirus that first emerged in China, is now spreading in certain communities in the U.S. Some people are trying to limit their contact with crowds by...","The United States has its first novel coronavirus-related drug shortage, according to the US Food and Drug Administration. The maker of an unnamed drug that has recently been added to the FDA Drug Shortages list told the agency that the shortage is due to the…",0.0,166,33,7,9,4,11.333333333333334,5.03030303030303,0,28.57142857142857,0.0,0.0,3.0303030303030303,27,0,1,0,0,0,1,0,0,27,0,0,1,-50.0,-12.0,-1.0,-7.0,2.0,-11.17,0.23,0.0,3.57,0.0,0.0,-1.41,-1.0,0.0,1.0,0.0,0.0,0.0,0.0,0.0,0.0,-1.0,0.0,0.0,0.0,9.08,1.92,0.77,1.51,-0.01,-4.42,-0.04,0.0,0.41,0.0,0.27,0.34,2.41,-0.05,0.07,0.04,-0.23,0.04,0.02,-0.04,0.0,2.41,0.0,-0.03,0.02
23,"Here's what the US could face in the coming months if the coronavirus spreads, according to the CDC.","A young mother limps toward a desk in the booking area of a Massachusetts police department one evening in late September 2018, holding her chest and repeatedly saying she is in pain.",0.0,83,18,4,5,2,18.0,4.611111111111111,0,0.0,0.0,0.0,0.0,14,0,0,0,0,0,0,0,0,14,0,0,0,-69.0,-14.0,0.0,-5.0,0.0,-14.0,-0.14,0.0,-25.0,0.0,0.0,-3.12,-13.0,0.0,0.0,0.0,-2.0,0.0,-3.0,0.0,0.0,-13.0,0.0,0.0,-3.0,5.07,1.21,0.65,1.17,-0.02,-4.58,-0.06,0.0,-0.31,0.0,0.2,0.15,1.79,-0.05,0.07,0.04,-0.24,0.04,-0.01,-0.04,0.0,1.79,0.0,-0.03,-0.01
24,"For decades, the cliché about American political parties has gone that ""Republicans fall in line, while Democrats fall in love."" But for a significant portion of today's Democratic electorate, that is not the case. Joe Biden's campaign came back from the brin…","A man drove his Jeep off the top of a six-level parking garage and landed across the street on a McDonald's in Santa Monica, California, authorities said Sunday.",0.0,219,42,6,15,3,14.333333333333334,5.214285714285714,0,16.666666666666664,0.0,4.761904761904762,4.761904761904762,33,0,0,0,0,0,0,0,0,33,0,0,0,85.0,14.0,3.0,3.0,1.0,-13.67,0.43,0.0,16.67,0.0,1.19,4.76,9.0,0.0,0.0,0.0,0.0,0.0,-1.0,0.0,0.0,9.0,0.0,0.0,-1.0,6.82,1.53,0.63,1.25,0.01,-4.87,-0.06,0.0,-0.31,0.0,0.33,0.17,1.98,-0.05,0.06,0.03,-0.26,0.04,-0.04,-0.04,0.0,1.98,0.0,-0.03,-0.04
25,"""There wasn't really much I wouldn't do. I was really upset, man."" View Entire Post ›","Cleveland Browns player Gregory Robinson was arrested after US Border Patrol agents found 157 pounds or marijuana in a car, officials said.",0.0,70,16,4,5,3,5.666666666666667,4.375,0,25.0,0.0,0.0,6.25,12,0,0,0,0,2,0,0,0,12,2,0,0,-48.0,-6.0,0.0,-8.0,1.0,-16.33,-0.99,0.0,0.0,0.0,0.0,6.25,-10.0,0.0,0.0,0.0,-1.0,2.0,0.0,0.0,0.0,-10.0,2.0,0.0,0.0,2.71,0.82,0.53,0.94,0.04,-5.46,-0.09,0.0,0.01,0.0,0.27,0.25,1.34,-0.05,0.06,0.03,-0.28,0.12,-0.06,-0.04,0.0,1.34,0.08,-0.03,-0.06
26,"Myanmar soldiers swooped on several illicit drugs labs to seize nearly $27 million of narcotics, chemicals and equipment, military newspaper The Myawady said Monday, the biggest bust so far this year. Troops raided several sites over the weekend in Kutkai tow…","An associate of the drug cartel once run by El Chapo was charged with participating in an international drug conspiracy in federal court in Brooklyn, New York, according to a press release from the US Attorney's Office for the Eastern District of New York.",0.0,220,41,5,16,2,20.5,5.365853658536586,0,0.0,0.0,0.0,4.878048780487805,37,0,1,0,2,0,0,0,0,37,0,0,0,7.0,-3.0,0.0,-4.0,0.0,-23.5,0.52,0.0,-20.0,0.0,0.0,2.61,5.0,0.0,1.0,0.0,2.0,0.0,0.0,0.0,0.0,5.0,0.0,0.0,0.0,4.45,1.09,0.48,1.06,0.03,-5.47,-0.08,0.0,-0.61,0.0,0.21,0.26,1.68,-0.05,0.09,0.02,-0.22,0.11,-0.09,-0.04,0.0,1.68,0.07,-0.03,-0.09
27,"Police in Costa Rica have found almost 6 tonnes of cocaine in a shipping container, leading to the country’s biggest ever drug seizure.The drugs, which weighed 5,800kg, were discovered on Friday evening in Limón in a container of flowers due to be sent to Rot…","Another horse has died at Santa Anita Park, becoming at least the fifth to die at the Southern California thoroughbred racetrack this year.",0.0,216,45,9,18,2,23.0,4.8,0,22.22222222222222,0.0,2.2222222222222223,0.0,34,0,0,0,2,0,0,0,0,34,0,0,0,99.0,22.0,4.0,9.0,0.0,0.0,-0.29,0.0,22.22,0.0,2.22,-8.7,16.0,0.0,0.0,0.0,2.0,0.0,0.0,0.0,0.0,16.0,0.0,0.0,0.0,5.93,1.48,0.57,1.25,0.02,-5.39,-0.09,0.0,-0.4,0.0,0.24,0.11,1.89,-0.05,0.09,0.02,-0.16,0.11,-0.11,-0.04,0.0,1.89,0.07,-0.04,-0.11
28,"U.S. prosecutors are asking a judge Friday to deny bail for an elected Hawaii councilman accused of running a drug-trafficking organization, supplying guns, conspiring with a gang leader, requesting sexual favors as payment for drugs and assaulting a law enfo…","Coronavirus jitters have paralyzed investors around the world. Chinese stocks might actually be close to bottoming out even as the disease spreads to other countries, sparking global pandemic and market correction fears.",0.0,221,40,9,16,3,13.666666666666666,5.525,0,11.11111111111111,0.0,0.0,2.5,34,0,0,0,0,0,0,0,0,34,0,0,0,32.0,8.0,3.0,5.0,0.0,-2.33,-0.38,0.0,-5.56,0.0,0.0,-6.88,6.0,0.0,0.0,0.0,0.0,0.0,0.0,0.0,0.0,6.0,0.0,0.0,0.0,7.48,1.68,0.66,1.35,0.04,-5.63,-0.08,0.0,-0.59,0.0,0.18,0.05,2.09,-0.05,0.09,0.01,-0.18,0.1,-0.13,-0.04,0.0,2.09,0.07,-0.04,-0.13
29,"South Carolina once had one of the county's highest rates of execution, even putting two prisoners to death in one night. Some lawmakers are pushing to give the state an option to start executing prisoners again by giving them no choice but to go to the elect…","Nearly 66,000 marijuana convictions in Los Angeles County will be dismissed thanks in part to state laws that paved the way for the action, the county district attorney said Thursday.",0.0,214,47,9,14,2,23.5,4.553191489361702,0,11.11111111111111,0.0,0.0,2.127659574468085,33,0,0,0,3,0,1,0,0,33,0,0,1,60.0,17.0,4.0,0.0,0.0,-6.5,-0.58,0.0,-8.89,0.0,0.0,2.13,8.0,0.0,0.0,0.0,2.0,0.0,1.0,0.0,0.0,8.0,0.0,0.0,1.0,8.69,2.09,0.74,1.38,0.03,-5.53,-0.1,0.0,-0.76,0.0,0.13,-0.02,2.24,-0.05,0.08,0.01,-0.09,0.1,-0.11,-0.04,0.0,2.24,0.07,-0.04,-0.11
30,Ethan Kollie bought parts for the assault-style rifle used by Connor Betts in last year's mass shooting in Dayton.,"The US Preventive Services Task Force now recommends screening for hepatitis C infection in all adults ages 18 to 79 without known liver disease, regardless of their risk.",0.0,96,19,2,10,2,19.0,5.052631578947368,0,0.0,0.0,0.0,0.0,17,0,0,0,0,0,0,0,0,17,0,0,0,-48.0,-9.0,-2.0,-2.0,0.0,-9.0,-0.09,0.0,0.0,0.0,0.0,-7.14,-11.0,0.0,0.0,-1.0,-2.0,0.0,-1.0,-1.0,0.0,-11.0,0.0,0.0,-1.0,6.01,1.57,0.59,1.28,0.03,-5.58,-0.1,0.0,-1.28,0.0,0.09,-0.15,1.86,-0.05,0.08,0.01,-0.11,0.1,-0.13,-0.04,0.0,1.86,0.06,-0.04,-0.13
31,"(Bloomberg) -- Leer en españolFor 10 years, it was pretty much like clockwork at the Mexico City clinic where Paquito Barrera picks up his HIV drugs every month. Then, in October, he left empty-handed. Ever since, he has had unnervingly uneven success in gett…","New York Governor Andrew Cuomo says this will be the year that his state legalizes recreational cannabis. If those efforts prove successful, New York would become the 12th state to put cannabis laws in place and could quickly become home to the second-biggest…",0.0,217,44,5,16,3,14.666666666666666,4.931818181818182,0,20.0,0.0,6.8181818181818175,4.545454545454546,40,1,0,0,1,0,4,0,0,40,0,0,4,-1.0,1.0,-5.0,0.0,1.0,-6.83,-0.14,0.0,10.0,0.0,4.49,4.55,10.0,1.0,0.0,0.0,0.0,0.0,3.0,0.0,0.0,10.0,0.0,0.0,3.0,7.29,1.87,0.54,1.38,0.05,-5.76,-0.1,0.0,-1.15,0.0,0.26,-0.14,2.22,-0.02,0.08,0.0,-0.1,0.09,-0.02,-0.04,0.0,2.22,0.06,-0.04,-0.02
32,"A man charged with driving a van into a tent where local Republicans were registering voters worked as a stagehand and had lived in northeast Florida for two years, according to jail records and an arrest report. Gregory Timm, 27, had been referred work throu…","The flu season is still in full swing and it's likely to continue for several more weeks, and if you haven't gotten a flu shot yet, you should, according to the US Centers for Disease Control and Prevention.",0.0,216,45,11,16,2,22.5,4.8,0,18.181818181818183,0.0,4.444444444444445,0.0,38,0,0,0,2,0,0,0,0,38,0,0,0,46.0,7.0,4.0,5.0,0.0,-15.5,0.33,0.0,3.9,0.0,4.44,0.0,11.0,0.0,0.0,0.0,2.0,0.0,-2.0,0.0,0.0,11.0,0.0,0.0,-2.0,8.46,2.18,0.68,1.46,0.04,-5.7,-0.11,0.0,-1.07,0.0,0.34,-0.26,2.51,-0.02,0.07,0.0,-0.05,0.09,-0.04,-0.04,0.0,2.51,0.06,-0.04,-0.04
33,"According to the Chicago Police Department, there were a total of 15 shooting incidents over the weekend but that number could go up as the final numbers will be released tomorrow.","Global fashion mogul Peter Nygard has been accused of allegedly sexually assaulting 10 unnamed women and girls, some under the age of 18 at the time of the alleged incidents,  according to new federal lawsuit.",0.0,150,31,8,9,2,31.0,4.838709677419355,0,25.0,0.0,0.0,0.0,28,0,0,0,1,0,0,0,0,28,0,0,0,-24.0,-4.0,3.0,-1.0,0.0,-4.0,-0.13,0.0,5.0,0.0,0.0,0.0,-2.0,0.0,0.0,-1.0,-1.0,0.0,0.0,0.0,0.0,-2.0,0.0,0.0,0.0,7.62,2.06,0.72,1.34,0.03,-5.39,-0.12,0.0,-0.8,0.0,0.3,-0.37,2.48,-0.02,0.07,-0.0,-0.04,0.09,-0.06,-0.04,0.0,2.48,0.06,-0.04,-0.06
34,"The total number of known coronavirus cases in India rose sharply to 29 on Wednesday, including 16 Italian tourists who had tested positive for the disease as well as an employee of a digital payments company who had traveled to Italy. On Monday, the world's …","Chicago's weekend began with a girl reportedly shooting her 11-year-old brother, who had to be rushed to the hospital. By the time Monday morning rolled around, 25 people had been shot, 11 of them minors, police said.",0.0,215,46,7,14,2,23.0,4.673913043478261,0,0.0,0.0,4.3478260869565215,2.1739130434782608,34,0,0,0,2,0,0,0,0,34,0,0,0,34.0,9.0,-3.0,3.0,-1.0,4.5,-0.22,0.0,-20.0,0.0,4.35,2.17,3.0,0.0,0.0,0.0,0.0,0.0,-3.0,0.0,0.0,3.0,0.0,0.0,-3.0,8.68,2.38,0.73,1.36,0.03,-5.32,-0.13,0.0,-1.26,0.0,0.37,-0.42,2.62,-0.03,0.07,-0.0,-0.0,0.09,-0.08,-0.04,0.0,2.62,0.06,-0.04,-0.08
35,"During weeks holed up in her grandmother's apartment with 10 relatives and eating a restricted diet, Chinese teenager Li Yuxuan says tempers have frayed. Li and her family are among the millions of people across China's Hubei province, epicenter of the corona…","An Alabama man convicted of killing three police officers is lending his voice to defenders of Nathaniel Woods, a co-defendant who is scheduled to be executed Thursday for the same crime despite questions about his culpability.",0.0,219,42,7,18,2,21.0,5.214285714285714,0,14.285714285714285,0.0,0.0,2.380952380952381,32,0,0,0,1,0,4,0,0,32,0,0,4,27.0,6.0,-1.0,5.0,0.0,-15.0,-0.12,0.0,-23.21,0.0,0.0,-3.17,4.0,0.0,0.0,0.0,0.0,0.0,2.0,0.0,0.0,4.0,0.0,0.0,2.0,9.79,2.56,0.74,1.5,0.02,-5.31,-0.13,0.0,-1.3,0.0,0.33,-0.45,2.7,-0.03,0.07,-0.01,0.01,0.08,0.02,-0.04,0.0,2.7,0.06,-0.04,0.02
36,It was difficult for me to move my support from Joe Biden. But Amy Klobuchar is simply a better candidate for the 2020 race against Donald Trump.,"Cardiovascular disease was, and still is, our No. 1 killer. It's a major source of our health care costs, and causes disability and related economic loss. At its peak, in the 1960s, among people over age 35, 1 in 100 died of heart disease every year -- a rate…",0.0,119,27,3,9,3,13.5,4.407407407407407,0,66.66666666666666,0.0,7.4074074074074066,3.7037037037037033,25,0,0,0,1,0,0,0,0,25,2,0,0,-93.0,-22.0,-1.0,-9.0,-1.0,1.25,0.08,0.0,66.67,0.0,7.41,-2.42,-9.0,0.0,0.0,0.0,-3.0,0.0,-1.0,0.0,0.0,-9.0,2.0,-2.0,-1.0,8.15,2.33,0.64,1.39,0.04,-5.51,-0.15,0.0,0.08,0.0,0.48,-0.45,2.59,-0.03,0.06,-0.01,0.01,0.08,-0.0,-0.04,0.0,2.59,0.11,-0.04,-0.0
37,"The death toll from China's coronavirus epidemic has soared past 1,000, the government said on Tuesday, as worry grew that the extent of economic disruption to the world's second-largest economy was greater than estimated. Layoffs also began, despite assuranc…",Scientists are still examining how loneliness affects our bodies. Here are some findings over the years.,0.0,222,39,7,14,2,19.5,5.6923076923076925,0,14.285714285714285,0.0,0.0,12.82051282051282,36,0,0,0,1,0,0,0,0,36,0,0,0,133.0,23.0,3.0,10.0,-1.0,11.5,0.13,0.0,-35.71,0.0,0.0,6.57,22.0,0.0,0.0,-1.0,1.0,0.0,0.0,0.0,0.0,22.0,0.0,-1.0,0.0,9.3,2.43,0.65,1.41,0.03,-5.54,-0.13,0.0,0.01,0.0,0.44,-0.21,2.77,-0.03,0.06,-0.01,0.02,0.08,-0.02,-0.04,0.0,2.77,0.11,-0.05,-0.02
38,President Donald Trump and his officials are falsely asserting that they’ve accelerated coronavirus testing by easing a restrictive policy introduced by the Obama administration. Trump also appeared to suggest that people with the infectious disease should go…,The novel coronavirus has infected tens of thousands of people around the world since the outbreak first began in China in late 2019. The virus has now been reported on every continent except Antarctica.,0.0,224,37,11,11,2,18.5,6.054054054054054,0,9.090909090909092,0.0,2.7027027027027026,5.405405405405405,29,0,0,0,0,0,1,0,0,29,0,0,1,54.0,3.0,5.0,0.0,-1.0,1.5,1.05,0.0,-7.58,0.0,2.7,-3.42,5.0,0.0,0.0,0.0,-1.0,0.0,1.0,-1.0,0.0,5.0,0.0,0.0,1.0,10.44,2.47,0.76,1.35,0.02,-5.59,-0.1,0.0,-0.19,0.0,0.46,-0.18,2.77,-0.03,0.06,-0.01,0.01,0.08,-0.01,-0.04,0.0,2.77,0.1,-0.05,-0.01
39,The amount of land in Colombia being used to harvest coca — the plant used to make cocaine — is still at a record high despite a renewed campaign to manually...,"A new study found that smartphone users were more likely to use added pain medication but find less relief, compared to those who didn't use the devices.",0.0,130,31,7,9,2,31.0,4.193548387096774,0,14.285714285714285,0.0,3.225806451612903,0.0,22,0,0,0,0,0,0,0,0,22,0,0,0,3.0,4.0,0.0,2.0,0.0,4.0,-0.51,0.0,0.0,0.0,-0.48,-3.7,-1.0,0.0,0.0,0.0,0.0,0.0,0.0,0.0,0.0,-1.0,0.0,0.0,0.0,9.17,2.36,0.77,1.25,0.02,-5.33,-0.13,0.0,-0.25,0.0,0.5,-0.27,2.59,-0.03,0.06,-0.01,-0.01,0.07,-0.03,-0.04,0.0,2.59,0.1,-0.05,-0.03
40,"The World Health Organization has hesitated to call the coronavirus outbreak a pandemic, but some health experts say that it is.",CDC officials have warned that the novel coronavirus is likely to spread in communities in the United States. Here are 10 questions answered about how to prepare and protect yourself and your family.,0.0,108,21,6,6,2,21.0,5.142857142857143,0,0.0,0.0,0.0,4.761904761904762,21,0,0,1,0,0,1,0,0,21,0,0,1,-59.0,-12.0,-2.0,-2.0,-1.0,4.5,0.08,0.0,-25.0,0.0,-3.03,1.73,-4.0,0.0,0.0,1.0,-1.0,0.0,0.0,0.0,0.0,-4.0,0.0,0.0,0.0,7.43,2.02,0.75,1.08,0.01,-5.33,-0.12,0.0,-0.66,0.0,0.45,-0.25,2.39,-0.03,0.06,0.01,-0.03,0.07,-0.02,-0.04,0.0,2.39,0.1,-0.05,-0.02
41,"Despite Trump's claims, what politicians like Sanders are pushing for is not akin to the authoritarian-style socialism in places like Venezuela.","Jill Filipovic responds to the recording of Michael Bloomberg, recently surfaced and reportedly from 2015, describing stop-and-frisk and policing in highly racialized terms. If you need proof that Michael Bloomberg is the absolute wrong person to lead the div…",0.0,124,21,3,7,2,21.0,5.904761904761905,0,66.66666666666666,0.0,9.523809523809524,0.0,19,0,0,0,0,0,0,0,0,19,0,0,0,-98.0,-18.0,-5.0,-4.0,0.0,1.5,0.21,0.0,54.17,0.0,6.96,-2.56,-11.0,0.0,0.0,0.0,-1.0,0.0,-1.0,0.0,0.0,-11.0,0.0,0.0,-1.0,6.15,1.68,0.67,0.94,0.01,-5.32,-0.1,0.0,0.54,0.0,0.64,-0.35,2.15,-0.03,0.05,0.01,-0.04,0.07,-0.04,-0.04,0.0,2.15,0.1,-0.05,-0.04
42,"In a move that other states might want to emulate, New York State Governor Andrew M. Cuomo said that the state's Department of Financial Services is requiring health insurers in the state to waive cost sharing associated with testing for the new coronavirus, …","As an outbreak of a novel coronavirus has swept through Hubei province, China, the US Centers for Disease Control and Prevention has been preparing for its worst case scenario -- a widespread outbreak of illnesses in the United States.",0.0,217,44,10,19,2,22.0,4.931818181818182,0,10.0,0.0,0.0,0.0,37,0,0,0,0,0,0,0,0,37,0,0,0,20.0,5.0,5.0,3.0,0.0,-17.0,-0.12,0.0,-10.0,0.0,0.0,-7.69,10.0,0.0,0.0,0.0,0.0,0.0,-1.0,0.0,0.0,10.0,0.0,0.0,-1.0,7.1,1.9,0.75,1.09,0.0,-5.29,-0.11,0.0,0.37,0.0,0.59,-0.43,2.35,-0.03,0.05,0.0,-0.06,0.07,-0.05,-0.04,0.0,2.35,0.09,-0.05,-0.05
