,Text,Reference,Label,# of Characters,# of Words,# of Verbs,# of Noun,# of Sentence,Average # of Words per Sentence,Average # of Characters per Words,# of Question Marks,% of Subjective Verbs,% of Passive Voice,% of Positive Words,% of Negative Words,# of Unique Wrods/Terms,# of Misspelled Words,# of Causation Terms,% of generalizing terms,% of # and quantifiers,1st person pronouns,2nd and 3rd person pronouns,Exclusive term,# of exclamation marks,Lexical,Singular pronouns(1st person),Group ref pronouns(1st person),2nd 3rd pronouns,# of Characters- sub,# of Words- sub,# of Verbs- sub,# of Noun- sub,# of Sentence- sub,Average # of Words per Sentence- sub,Average # of Characters per Words- sub,# of Question Marks- sub,% of Subjective Verbs- sub,% of Passive Voice- sub,% of Positive Words- sub,% of Negative Words- sub,# of Unique Wrods/Terms- sub,# of Misspelled Words- sub,# of Causation Terms- sub,% of generalizing terms- sub,% of # and quantifiers- sub,1st person pronouns- sub,2nd and 3rd person pronouns- sub,Exclusive term- sub,# of exclamation marks- sub,Lexical- sub,Singular pronouns(1st person)- sub,Group ref pronouns(1st person)- sub,2nd 3rd pronouns- sub,# of Characters- avg sub,# of Words- avg sub,# of Verbs- avg sub,# of Noun- avg sub,# of Sentence- avg sub,Average # of Words per Sentence- avg sub,Average # of Characters per Words- avg sub,# of Question Marks- avg sub,% of Subjective Verbs- avg sub,% of Passive Voice- avg sub,% of Positive Words- avg sub,% of Negative Words- avg sub,# of Unique Wrods/Terms- avg sub,# of Misspelled Words- avg sub,# of Causation Terms- avg sub,% of generalizing terms- avg sub,% of # and quantifiers- avg sub,1st person pronouns- avg sub,2nd and 3rd person pronouns- avg sub,Exclusive term- avg sub,# of exclamation marks- avg sub,Lexical- avg sub,Singular pronouns(1st person)- avg sub,Group ref pronouns(1st person)- avg sub,2nd 3rd pronouns- avg sub
0,A renowned Canadian doctor and emergencies specialist is leading a team of international experts investigating the coronavirus outbreak on the ground in China.,"White House officials have privately weighed appointing a czar to oversee the administration's response to the growing novel coronavirus outbreak, despite public denials by members of the administration, sources inside the administration and advisers close to…",1.0,137.0,23.0,3.0,9.0,2.0,23.0,5.956521739130435,0.0,33.33333333333333,0.0,8.695652173913043,4.3478260869565215,21.0,0.0,0.0,0.0,0.0,0.0,0.0,0.0,0.0,21.0,0.0,0.0,0.0,-88.0,-13.0,-2.0,-6.0,1.0,-13.0,-0.29,0.0,33.33,0.0,8.7,1.57,-9.0,0.0,0.0,0.0,0.0,0.0,0.0,0.0,0.0,-9.0,0.0,0.0,0.0,-35.56,-10.22,-3.0,-2.6,0.0,-4.26,0.73,-0.02,19.15,0.0,6.67,0.5,-6.11,-0.02,-0.04,-0.04,-0.38,-0.13,-0.4,-0.02,0.0,-6.11,-0.02,-0.13,-0.4
1,"Biden, Bloomberg 'both wrong' about Trump cutting CDC, NIH funding, AP fact check says Fox News Mike Bloomberg's Height Might Actually Hurt His Election Chances Against Trump, History Shows Newsweek Bloomberg targets Trump's 'reckless CDC cuts' in new coronav…","Most of the Americans who were being monitored at the University of Nebraska Medical Center for coronavirus after evacuating a cruise ship in Japan tested positive for the virus, the hospital says.",1.0,222.0,39.0,3.0,29.0,1.0,39.0,5.6923076923076925,0.0,0.0,0.0,0.0,2.564102564102564,37.0,0.0,0.0,0.0,0.0,0.0,0.0,0.0,0.0,37.0,0.0,0.0,0.0,56.0,7.0,-3.0,18.0,-1.0,7.0,0.5,0.0,-16.67,0.0,-3.12,-0.56,13.0,0.0,0.0,0.0,0.0,0.0,0.0,0.0,0.0,13.0,0.0,0.0,0.0,6.94,-2.22,-3.0,7.4,-0.5,3.74,0.6,-0.02,2.49,0.0,2.32,-0.4,1.89,-0.02,-0.04,-0.04,-0.38,-0.13,-0.4,-0.02,0.0,1.89,-0.02,-0.13,-0.4
2,"CBC's head of news, Jennifer McGuire, is stepping down after more than a decade in the role and leaving CBC at the end of this week, the public broadcaster announced Thursday.","Although physicians still have no vaccine or cure for the novel coronavirus, health officials and pharmaceutical companies around the world are working hard to develop them.",1.0,145.0,31.0,4.0,12.0,2.0,31.0,4.67741935483871,0.0,25.0,0.0,0.0,0.0,26.0,0.0,0.0,0.0,0.0,0.0,0.0,0.0,0.0,26.0,0.0,0.0,0.0,-3.0,5.0,0.0,4.0,0.0,5.0,-1.01,0.0,0.0,0.0,-3.85,-3.85,2.0,0.0,0.0,0.0,0.0,0.0,0.0,0.0,0.0,2.0,0.0,0.0,0.0,-4.56,-2.22,-2.67,5.07,-0.33,3.74,0.22,-0.02,5.27,0.0,0.87,-1.55,0.89,-0.02,-0.04,-0.04,-0.38,-0.13,-0.4,-0.02,0.0,0.89,-0.02,-0.13,-0.4
3,"Medical experts say coronavirus COVID-19 and Ebola outbreaks show that robotic medicine can help fight infectious disease, but the goal needs to be applications in everyday health care.","It has been more than a month since the World Health Organization declared the novel coronavirus a public health emergency of international concern. Since the outbreak began, there have been more than 90,000 cases of the virus worldwide and more than 3,100 de…",1.0,158.0,28.0,7.0,9.0,2.0,28.0,5.642857142857143,0.0,14.285714285714285,0.0,0.0,0.0,28.0,0.0,0.0,0.0,0.0,0.0,0.0,0.0,0.0,28.0,0.0,0.0,0.0,-60.0,-15.0,1.0,-4.0,0.0,6.5,0.57,0.0,-19.05,0.0,0.0,-9.3,1.0,0.0,0.0,0.0,-2.0,0.0,0.0,0.0,0.0,1.0,0.0,0.0,0.0,-7.06,-2.97,-1.75,3.15,-0.25,2.99,0.27,-0.02,3.98,0.0,0.15,-2.12,0.89,-0.02,-0.04,-0.04,-0.38,-0.13,-0.4,-0.02,0.0,0.89,-0.02,-0.13,-0.4
4,"Thanks to artificial intelligence, the start-up BlueDot was able to predict the initial spread of coronavirus quicker than public health authorities. The technology, which incorporates natural language processing and machine learning, has been used for Zika v…","Laurie Garrett, an expert on pandemics and author of ""Ebola: Story of an Outbreak,"" spoke to CNN's Bianca Nobilo about what she thinks is behind the spike in novel coronavirus cases in China.",1.0,224.0,37.0,6.0,15.0,2.0,18.5,6.054054054054054,0.0,33.33333333333333,0.0,5.405405405405405,0.0,33.0,0.0,0.0,0.0,0.0,0.0,0.0,0.0,0.0,33.0,0.0,0.0,0.0,65.0,4.0,3.0,0.0,0.0,-14.5,1.24,0.0,0.0,0.0,5.41,0.0,6.0,0.0,0.0,0.0,0.0,0.0,-1.0,0.0,0.0,6.0,0.0,0.0,-1.0,4.64,-1.62,-1.4,3.2,-0.2,0.64,0.38,-0.02,7.01,0.0,0.79,-2.47,1.89,-0.02,-0.04,-0.04,-0.38,-0.13,-0.4,-0.02,0.0,1.89,-0.02,-0.13,-0.4
5,"""In short, we may only be seeing the tip of the iceberg,"" Tedros Adhanom Ghebreyesus, director-general of the World Health Organization, said in a tweet on Sunday.","The coronavirus that emerged from Wuhan, China, last year is causing alarm across the world, with fear that this could become the next pandemic. Late last month, the World Health Organization declared the virus, named COVID-19, a ""Public Health Emergency of I…",1.0,137.0,27.0,4.0,10.0,2.0,27.0,5.074074074074074,0.0,25.0,0.0,0.0,0.0,22.0,0.0,0.0,0.0,0.0,1.0,0.0,0.0,0.0,22.0,0.0,1.0,0.0,-82.0,-15.0,-3.0,-7.0,0.0,6.0,-0.14,0.0,10.71,0.0,0.0,-7.14,-10.0,0.0,0.0,0.0,0.0,1.0,0.0,0.0,0.0,-10.0,0.0,1.0,0.0,-2.06,-2.39,-1.5,2.4,-0.17,0.49,0.29,-0.02,7.65,0.0,0.32,-2.7,0.72,-0.02,-0.04,-0.04,-0.38,0.03,-0.4,-0.02,0.0,0.72,-0.02,0.03,-0.4
6,"Mulvaney, who also heads the Office of Management and Budget, also said that there will ""probably"" be school closures and transportation issues due to the impact of the virus.","Before getting into what Naomi Campbell has to say, it is impossible to ignore what Naomi Campbell projects: A kind of surreal, cyborg beauty. She is what I imagine a 3D printout of what a perfect otherworldly woman would look like.",1.0,147.0,29.0,4.0,10.0,2.0,29.0,5.068965517241379,0.0,25.0,0.0,0.0,6.896551724137931,20.0,0.0,0.0,0.0,0.0,0.0,0.0,0.0,0.0,20.0,0.0,0.0,0.0,-45.0,-12.0,-5.0,0.0,-1.0,8.5,0.39,0.0,2.78,0.0,-9.76,2.02,-5.0,0.0,0.0,0.0,-1.0,-1.0,-1.0,0.0,0.0,-5.0,-1.0,0.0,-1.0,-5.41,-2.65,-1.57,1.83,-0.14,0.67,0.23,-0.02,8.1,0.0,-0.01,-1.88,-0.4,-0.02,-0.04,-0.04,-0.38,0.01,-0.4,-0.02,0.0,-0.4,-0.02,0.01,-0.4
7,"Former Vice President Joe Biden on Sunday criticized President Donald Trump's response to the coronavirus outbreak here in the U.S., saying Trump's administration was largely unprepared.","The White House is requiring health officials to get approval before making public statements about the coronavirus, sources tell CNN. Ron Klain, who served as the Ebola response coordinator under President Obama, discusses the decision.",1.0,161.0,26.0,3.0,14.0,4.0,9.333333333333334,6.1923076923076925,0.0,33.33333333333333,0.0,0.0,11.538461538461538,20.0,0.0,0.0,0.0,0.0,0.0,0.0,0.0,0.0,20.0,0.0,0.0,0.0,-42.0,-9.0,-4.0,-3.0,1.0,-8.17,0.39,0.0,19.05,0.0,-2.86,11.54,-12.0,0.0,0.0,0.0,0.0,0.0,0.0,0.0,0.0,-12.0,0.0,0.0,0.0,-6.18,-3.22,-1.75,1.9,0.12,-1.65,0.32,-0.02,9.48,0.0,-0.26,-0.68,-1.24,-0.02,-0.04,-0.04,-0.38,-0.01,-0.4,-0.02,0.0,-1.24,-0.02,-0.01,-0.4
8,"""How quickly that can be deployed will depend on some of the early data that we have, some animal data, what we will see in patients,"" Regeneron CEO Leonard Schleifer told CNBC.","A patient being treated for novel coronavirus at UC Davis Medical Center was admitted to the facility last week but wasn't tested until Sunday, according to a letter sent to UC Davis staff and obtained by CNN.",1.0,146.0,32.0,9.0,8.0,2.0,32.0,4.5625,0.0,11.11111111111111,0.0,0.0,0.0,24.0,0.0,0.0,2.0,0.0,2.0,0.0,0.0,0.0,24.0,0.0,2.0,0.0,-27.0,-5.0,0.0,-6.0,0.0,-5.0,-0.11,0.0,0.0,0.0,-2.7,0.0,-6.0,0.0,0.0,2.0,0.0,2.0,0.0,0.0,0.0,-6.0,0.0,2.0,0.0,-8.44,-3.0,-1.22,1.29,0.11,-0.94,0.21,-0.02,8.09,0.0,-0.46,-1.03,-1.44,-0.02,-0.04,0.18,-0.38,0.2,-0.4,-0.02,0.0,-1.44,-0.02,0.2,-0.4
9,Canadian hospitals are preparing for the next phase of the COVID-19 epidemic.,"Although physicians still have no vaccine or cure for the novel coronavirus, health officials and pharmaceutical companies around the world are working hard to develop them.",1.0,66.0,12.0,2.0,4.0,2.0,12.0,5.5,0.0,50.0,0.0,0.0,8.333333333333332,10.0,0.0,0.0,0.0,0.0,0.0,0.0,0.0,0.0,10.0,0.0,0.0,0.0,-82.0,-14.0,-2.0,-4.0,0.0,-14.0,-0.19,0.0,25.0,0.0,-3.85,4.49,-14.0,0.0,0.0,0.0,0.0,0.0,0.0,0.0,0.0,-14.0,0.0,0.0,0.0,-18.26,-4.82,-1.5,0.4,0.1,-2.37,0.22,-0.02,10.86,0.0,-0.62,-0.48,-3.01,-0.02,-0.04,0.16,-0.38,0.17,-0.4,-0.02,0.0,-3.01,-0.02,0.17,-0.4
10,"Canadian doctor stops shaking hands and advises people to use another form of acknowledgment, such as putting their hands in prayer, bowing or just smiling and looking someone in the eyes when saying hello.","A majority of Americans say they are at least somewhat confident the federal government can prevent a nationwide epidemic of novel coronavirus, according to a new CNN poll conducted by SSRS, but only about half say the government has done a good job of contai…",1.0,173.0,34.0,8.0,11.0,2.0,34.0,5.088235294117647,0.0,0.0,0.0,2.941176470588235,0.0,28.0,0.0,0.0,0.0,0.0,0.0,1.0,0.0,0.0,28.0,0.0,0.0,1.0,-43.0,-11.0,-1.0,-1.0,1.0,-11.0,0.29,0.0,-11.11,0.0,-1.5,-2.22,-5.0,0.0,0.0,0.0,0.0,0.0,1.0,0.0,0.0,-5.0,0.0,0.0,1.0,-16.56,-4.31,-1.18,0.31,0.09,-1.54,0.19,-0.02,8.58,0.0,-0.48,-0.79,-2.66,-0.02,-0.04,0.14,-0.38,0.14,-0.31,-0.02,0.0,-2.66,-0.02,0.14,-0.31
11,"President Donald Trump said Wednesday in an address from the White House that the risk to the U.S. from the deadly coronavirus ""remains very low.""","Vanessa Kerry writes that the story of Osmel Martinez Azcue, a man charged over $3,000 for taking responsible action and visiting a hospital to be screened for the novel coronavirus after he returned from China with flu-like symptoms, proves that if we are go…",1.0,122.0,25.0,2.0,10.0,4.0,6.75,4.88,0.0,0.0,0.0,0.0,8.0,19.0,0.0,0.0,0.0,0.0,0.0,0.0,0.0,0.0,19.0,0.0,0.0,0.0,-95.0,-19.0,-7.0,-3.0,3.0,-37.25,-0.05,0.0,-22.22,0.0,-2.27,5.73,-17.0,0.0,0.0,0.0,-1.0,-1.0,-1.0,0.0,0.0,-17.0,0.0,-1.0,-1.0,-19.39,-4.64,-1.42,0.15,0.25,-3.12,0.14,-0.02,6.69,0.0,-0.61,-0.38,-3.11,-0.02,-0.04,0.12,-0.38,0.12,-0.32,-0.02,0.0,-3.11,-0.02,0.12,-0.32
12,"Dr. Bonnie Henry's briefing Saturday was described as a 'masterclass in communicating compassion,' and highlights the physical and emotional tolls of public health work in times of crisis.",The Trump administration's efforts and ambitions to reduce the size of government could hamper agencies integral to responding to the coronavirus.,1.0,161.0,28.0,4.0,12.0,3.0,14.0,5.75,0.0,25.0,0.0,7.142857142857142,3.571428571428571,22.0,0.0,0.0,0.0,0.0,0.0,0.0,0.0,0.0,22.0,0.0,0.0,0.0,35.0,7.0,0.0,4.0,1.0,-7.0,-0.25,0.0,25.0,0.0,2.38,-1.19,6.0,0.0,0.0,0.0,0.0,0.0,0.0,0.0,0.0,6.0,0.0,0.0,0.0,-18.79,-4.68,-1.46,0.17,0.31,-3.9,0.17,-0.02,7.01,0.0,-0.17,-0.37,-3.26,-0.02,-0.04,0.11,-0.38,0.1,-0.32,-0.02,0.0,-3.26,-0.02,0.1,-0.32
13,"A fund set up by the World Bank three years ago to help fight infectious diseases has done more to rack up fees for bankers and investors than it has to help doctors battle outbreaks, say some critics.","The White House is in the midst of a sharp dispute with Senate Democrats over the amount of money needed to address the threat of the novel coronavirus, even as federal health officials warn that it's no longer a matter of ""if"" but ""when"" the US will have to …",1.0,164.0,38.0,8.0,12.0,2.0,38.0,4.315789473684211,0.0,0.0,0.0,0.0,2.631578947368421,29.0,0.0,0.0,1.0,1.0,0.0,1.0,0.0,0.0,29.0,0.0,0.0,1.0,-47.0,-12.0,0.0,-2.0,1.0,-12.0,0.1,0.0,-12.5,0.0,-2.0,-1.37,-8.0,0.0,0.0,1.0,1.0,0.0,1.0,0.0,0.0,-8.0,0.0,0.0,1.0,-18.06,-4.01,-1.21,0.19,0.29,-2.86,0.1,-0.02,5.49,0.0,-0.3,-0.43,-2.9,-0.02,-0.04,0.17,-0.31,0.08,-0.26,-0.02,0.0,-2.9,-0.02,0.08,-0.26
14,These 'artificial ecosystem' experiments could help develop strategies to mitigate the spread of potentially dangerous viruses,"The last Ebola patient being treated in the Democratic Republic of Congo went home from a treatment center on Tuesday, according to the World Health Organization, a significant step in the countdown to declaring an end to the world's second-deadliest outbreak…",1.0,111.0,16.0,4.0,5.0,1.0,16.0,6.9375,0.0,0.0,0.0,0.0,6.25,16.0,0.0,0.0,0.0,0.0,0.0,0.0,0.0,0.0,16.0,0.0,0.0,0.0,-109.0,-25.0,-1.0,-11.0,0.0,-25.0,1.57,0.0,0.0,0.0,-4.88,6.25,-14.0,0.0,0.0,0.0,0.0,0.0,0.0,0.0,0.0,-14.0,0.0,0.0,0.0,-20.96,-4.89,-1.27,-0.27,0.2,-3.42,0.2,-0.02,4.18,0.0,-0.41,-0.24,-3.44,-0.02,-0.04,0.16,-0.31,0.07,-0.27,-0.02,0.0,-3.44,-0.02,0.07,-0.27
15,"The World Health Organization said despite positive signs in Congo, the country's Ebola epidemic continues to be a global health emergency.","As China and the world try to stop the spread of the novel coronavirus, the fight against another deadly disease, Ebola, has reached an encouraging ""milestone,"" the World Health Organization said Friday.",1.0,119.0,21.0,3.0,9.0,2.0,21.0,5.666666666666667,0.0,33.33333333333333,0.0,4.761904761904762,9.523809523809524,21.0,0.0,0.0,0.0,0.0,0.0,0.0,0.0,0.0,21.0,0.0,0.0,0.0,-53.0,-11.0,-1.0,-4.0,0.0,-11.0,0.29,0.0,33.33,0.0,1.64,6.4,-6.0,0.0,0.0,0.0,0.0,0.0,0.0,0.0,0.0,-6.0,0.0,0.0,0.0,-22.99,-5.35,-1.38,-0.41,0.19,-3.59,0.22,-0.02,5.12,0.0,-0.22,0.13,-3.61,-0.02,-0.04,0.14,-0.32,0.05,-0.28,-0.02,0.0,-3.61,-0.02,0.05,-0.28
16,Canada will focus its $6.5 million in coronavirus research on the medical and social sides of the outbreak.,"Never interested in government details, President Donald Trump now wants to purge officials of dubious loyalty. Wall Street is reminding Americans a weakened executive branch carries risks.",1.0,90.0,18.0,2.0,4.0,3.0,9.5,5.0,0.0,0.0,0.0,0.0,5.555555555555555,16.0,0.0,0.0,0.0,2.0,0.0,1.0,0.0,0.0,16.0,0.0,0.0,1.0,-73.0,-9.0,-4.0,-9.0,0.0,-4.0,-1.04,0.0,-16.67,0.0,-3.7,-1.85,-11.0,0.0,0.0,0.0,2.0,0.0,1.0,0.0,0.0,-11.0,0.0,0.0,1.0,-26.5,-5.93,-1.53,-0.84,0.24,-4.43,0.19,-0.02,3.98,0.0,-0.32,0.22,-4.05,-0.02,-0.04,0.13,-0.2,0.04,-0.22,-0.02,0.0,-4.05,-0.02,0.04,-0.22
17,Barrick Gold CEO Mark Bristow said the lessons the company learned from the 2014 Ebola outbreak are informing its response to the ongoing coronavirus outbreak.,"Nebraska's state slogan ""Honestly, it's not for everyone,"" should have an asterisk, because everyone with even the trickiest disease seems welcome at Nebraska's largest medical facility.",1.0,135.0,25.0,4.0,12.0,2.0,25.0,5.4,0.0,25.0,0.0,0.0,8.0,21.0,0.0,0.0,0.0,1.0,0.0,1.0,0.0,0.0,21.0,0.0,0.0,1.0,-26.0,-1.0,-1.0,4.0,0.0,-1.0,-0.79,0.0,25.0,0.0,-3.85,8.0,-3.0,0.0,-1.0,-1.0,1.0,0.0,1.0,0.0,0.0,-3.0,0.0,0.0,1.0,-27.11,-6.06,-1.56,-0.77,0.22,-4.31,0.19,-0.02,4.36,0.0,-0.42,0.44,-4.17,-0.02,-0.04,0.12,-0.16,0.03,-0.18,-0.02,0.0,-4.17,-0.02,0.03,-0.18
18,CNBC's Jim Cramer said his favorite market indicator is showing it's time to buy stocks while also explaining why he's soured on sector ETFs. He also sat down with Barrick Gold CEO Mark Bristow.,Here's what else you need to know to Get Up to Speed and Out the Door.,1.0,161.0,34.0,9.0,14.0,3.0,17.0,4.735294117647059,0.0,11.11111111111111,0.0,2.941176470588235,0.0,32.0,0.0,0.0,0.0,0.0,0.0,1.0,0.0,0.0,32.0,0.0,0.0,1.0,106.0,18.0,5.0,10.0,1.0,1.0,1.3,0.0,11.11,0.0,2.94,0.0,19.0,0.0,0.0,0.0,0.0,0.0,0.0,-1.0,0.0,19.0,0.0,0.0,0.0,-26.29,-5.7,-1.32,-0.6,0.26,-4.62,0.16,-0.02,3.97,0.0,-0.35,0.21,-3.69,-0.02,-0.04,0.11,-0.17,0.02,-0.14,-0.02,0.0,-3.69,-0.02,0.02,-0.14
19,Your 401(k) likely isn't recovering from the coronavirus as quickly as you'd hoped. Yet history shows stocks typically rebound from outbreaks before long.,"The White House has requested $1.25 billion in emergency funding to address the novel coronavirus, part of an effort to direct as much as $2.5 billion in total funds to bolster its response to the growing global crisis, according to a letter obtained by CNN.",1.0,132.0,23.0,5.0,6.0,3.0,11.5,5.739130434782608,0.0,0.0,0.0,0.0,0.0,19.0,0.0,0.0,0.0,1.0,0.0,0.0,0.0,0.0,19.0,0.0,0.0,0.0,-82.0,-22.0,-3.0,-6.0,-1.0,-4.17,0.98,0.0,0.0,0.0,-2.22,-4.44,-13.0,0.0,0.0,0.0,-3.0,0.0,-1.0,0.0,0.0,-13.0,0.0,0.0,-1.0,-27.01,-5.92,-1.3,-0.85,0.3,-5.18,0.17,-0.02,3.06,0.0,-0.43,0.01,-3.91,-0.02,-0.04,0.11,-0.13,0.02,-0.15,-0.02,0.0,-3.91,-0.02,0.02,-0.15
20,"Stringent travel restrictions imposed on inbound flights from China to contain the coronavirus outbreak become ""irrelevant"" in a potential pandemic because ""you can't keep out the entire world,"" a top U.S. health official said.",Dr. Colleen Kraft of Emory University writes that washing hands and protecting medical workers are our best chance to keep the coronavirus epidemic from spreading further.,1.0,194.0,34.0,7.0,11.0,4.0,11.666666666666666,5.705882352941177,0.0,0.0,0.0,2.941176470588235,5.88235294117647,30.0,0.0,1.0,0.0,0.0,0.0,0.0,0.0,0.0,30.0,0.0,0.0,0.0,48.0,8.0,0.0,2.0,1.0,-1.33,0.09,0.0,-14.29,0.0,-0.9,2.04,4.0,0.0,1.0,0.0,0.0,0.0,0.0,0.0,0.0,4.0,0.0,-1.0,0.0,-24.7,-5.6,-1.19,-0.84,0.38,-5.67,0.19,-0.02,2.24,0.0,-0.37,0.11,-3.59,-0.02,0.0,0.1,-0.14,0.01,-0.16,-0.02,0.0,-3.59,-0.02,0.01,-0.16
21,"""I hope it's not that bad, but we should assume it will be until we know otherwise,"" Gates wrote in an article published Friday in The New England Journal of Medicine.","Dr. Mark Rupp tells CNN patients are in the ""chicken soup stage.""",1.0,137.0,31.0,10.0,6.0,2.0,31.0,4.419354838709677,0.0,10.0,0.0,0.0,3.225806451612903,27.0,0.0,0.0,0.0,0.0,2.0,1.0,0.0,0.0,27.0,0.0,2.0,1.0,83.0,19.0,8.0,-1.0,-1.0,26.67,-0.08,0.0,-40.0,0.0,0.0,3.23,15.0,0.0,0.0,0.0,0.0,2.0,1.0,0.0,0.0,15.0,0.0,2.0,1.0,-25.19,-5.45,-0.95,-1.05,0.36,-5.24,0.14,-0.02,1.95,0.0,-0.44,0.07,-3.43,-0.02,0.0,0.09,-0.15,0.09,-0.13,-0.02,0.0,-3.43,-0.02,0.09,-0.13
22,"India reported three confirmed cases, out of more than 1,700 people tested around the country as of Thursday, according to the Indian Council of Medical Research.","Since the Chinese city of Wuhan went into lockdown two weeks ago, university student Victor Vincent has watched as other international students on his campus have returned home.",1.0,137.0,26.0,3.0,8.0,2.0,26.0,5.269230769230769,0.0,0.0,0.0,0.0,0.0,21.0,0.0,0.0,0.0,2.0,0.0,0.0,0.0,0.0,21.0,0.0,0.0,0.0,-13.0,-2.0,-2.0,-3.0,0.0,-2.0,-0.09,0.0,0.0,0.0,0.0,0.0,-7.0,0.0,0.0,0.0,1.0,0.0,-1.0,0.0,0.0,-7.0,0.0,0.0,-1.0,-25.64,-5.53,-1.04,-1.17,0.35,-5.07,0.14,-0.02,1.25,0.0,-0.51,-0.1,-3.55,-0.02,-0.0,0.09,-0.07,0.08,-0.14,-0.02,0.0,-3.55,-0.02,0.08,-0.14
23,The province’s acting chief medical officer of health says there are still some outstanding tests that remain for coronavirus in New Brunswick.,"Some students at a New York university are in hot water over allegations they held what the school is describing as a ""coronavirus-themed party.""",1.0,122.0,22.0,4.0,9.0,2.0,22.0,5.545454545454546,0.0,25.0,0.0,4.545454545454546,0.0,22.0,0.0,0.0,1.0,0.0,0.0,0.0,0.0,0.0,22.0,0.0,0.0,0.0,0.0,-2.0,0.0,1.0,0.0,9.5,0.46,0.0,-25.0,0.0,0.38,-4.17,0.0,0.0,0.0,1.0,0.0,0.0,0.0,0.0,0.0,0.0,0.0,0.0,0.0,-26.68,-5.76,-1.08,-1.23,0.33,-5.08,0.15,-0.02,1.65,0.0,-0.39,-0.25,-3.61,-0.02,-0.0,0.12,-0.09,0.07,-0.15,-0.02,0.0,-3.61,-0.02,0.07,-0.15
24,"""In short, we may only be seeing the tip of the iceberg,"" Tedros Adhanom Ghebreyesus, director-general of the World Health Organization, said in a tweet Sunday","When the World Health Organization declared the outbreak of the novel coronavirus a public health emergency of international concern, it did so over fears that smaller or less-developed countries would struggle to contain the virus.",1.0,134.0,26.0,4.0,10.0,1.0,26.0,5.153846153846154,0.0,25.0,0.0,0.0,0.0,21.0,0.0,0.0,0.0,0.0,1.0,0.0,0.0,0.0,21.0,0.0,1.0,0.0,-64.0,-9.0,-1.0,-1.0,-1.0,-9.0,-0.5,0.0,25.0,0.0,0.0,-20.0,-8.0,0.0,-1.0,0.0,0.0,1.0,-1.0,0.0,0.0,-8.0,0.0,1.0,-1.0,-27.16,-5.82,-1.12,-1.24,0.28,-4.93,0.14,-0.02,2.01,0.0,-0.45,-0.4,-3.71,-0.02,-0.0,0.12,-0.1,0.11,-0.16,-0.02,0.0,-3.71,-0.02,0.11,-0.16
25,World Health Organization officials are concerned about new coronavirus cases confirmed in France and the U.K. that were transmitted without any travel history to China.,"Former Vice President Joe Biden on Sunday slammed the Trump administration's handling of the novel coronavirus outbreak, saying he would handle it differently if he were president.",1.0,145.0,25.0,5.0,11.0,4.0,8.666666666666666,5.8,0.0,40.0,0.0,0.0,4.0,25.0,0.0,0.0,0.0,0.0,0.0,0.0,1.0,0.0,25.0,0.0,0.0,0.0,-9.0,-2.0,0.0,0.0,2.0,-18.33,0.1,0.0,20.0,0.0,0.0,0.3,2.0,0.0,0.0,0.0,0.0,0.0,-3.0,1.0,0.0,2.0,0.0,0.0,-3.0,-27.17,-5.91,-1.12,-1.22,0.35,-5.45,0.15,-0.02,2.93,0.0,-0.51,-0.38,-3.65,-0.02,-0.01,0.11,-0.11,0.1,-0.17,0.02,0.0,-3.65,-0.02,0.1,-0.17
26,"The Hubei Provincial Health Committee said that 871 people have died in the province and a total of 29,631 cases have been confirmed thus far.","Covid-19 will become a pandemic. We don't yet know how severe it will be, nor do we know if the virus will spread to all continents, but it's already spreading widely in China, South Korea, Italy, Iran and elsewhere -- and thousands of undetected and infectio…",1.0,118.0,25.0,6.0,8.0,2.0,25.0,4.72,0.0,16.666666666666664,0.0,0.0,4.0,23.0,0.0,0.0,0.0,2.0,0.0,0.0,0.0,0.0,23.0,0.0,0.0,0.0,-97.0,-21.0,-6.0,-2.0,0.0,2.0,0.05,0.0,16.67,0.0,0.0,-0.35,-15.0,0.0,0.0,-1.0,2.0,-1.0,-1.0,0.0,0.0,-15.0,0.0,-1.0,-1.0,-28.19,-6.0,-1.07,-1.3,0.33,-5.33,0.13,-0.02,2.91,0.0,-0.57,-0.36,-3.67,-0.02,-0.01,0.1,-0.04,0.09,-0.18,0.01,0.0,-3.67,-0.02,0.09,-0.18
27,"It appears infections among medical workers peaked in mid-January and has ""rapidly"" decreased since, according to the World Health Organization.","While the CDC has screened more than 30,000 passengers in the past month, not a single US coronavirus case has been caught by airport temperature checks, according to a CNN investigation.",1.0,125.0,20.0,5.0,5.0,2.0,20.0,6.25,0.0,0.0,0.0,0.0,5.0,20.0,0.0,0.0,0.0,0.0,0.0,0.0,0.0,0.0,20.0,0.0,0.0,0.0,-32.0,-11.0,-1.0,-6.0,0.0,-11.0,1.19,0.0,-16.67,0.0,0.0,5.0,-5.0,0.0,0.0,0.0,-1.0,0.0,0.0,0.0,0.0,-5.0,0.0,0.0,0.0,-28.88,-6.26,-1.07,-1.49,0.32,-5.4,0.16,-0.02,2.3,0.0,-0.62,-0.3,-3.79,-0.02,-0.01,0.1,-0.06,0.08,-0.19,0.01,0.0,-3.79,-0.02,0.08,-0.19
28,"""This kind of confusion breeds distrust. You should stick to a standard even if you have caveats,"" global health economist at the Harvard Chan School of Public Health Dr. Eric Feigl-Ding said.","Veterans Affairs Secretary Robert Wilkie confirmed during his testimony on Capitol Hill Wednesday that one veteran is being treated for the coronavirus at a VA facility in Palo Alto, California, and said the agency has a section of the campus set up to receiv…",1.0,161.0,32.0,5.0,14.0,4.0,10.666666666666666,5.03125,0.0,0.0,0.0,0.0,6.25,30.0,0.0,0.0,0.0,0.0,0.0,1.0,0.0,0.0,30.0,0.0,0.0,1.0,-56.0,-12.0,-3.0,-5.0,3.0,-33.33,0.1,0.0,-12.5,0.0,0.0,6.25,-9.0,0.0,0.0,0.0,-1.0,0.0,0.0,0.0,0.0,-9.0,0.0,0.0,0.0,-28.28,-6.08,-1.07,-1.36,0.38,-5.79,0.15,-0.02,1.74,0.0,-0.67,-0.21,-3.56,-0.02,-0.01,0.09,-0.07,0.07,-0.16,0.01,0.0,-3.56,-0.02,0.07,-0.16
29,"One trial combines HIV drugs Lopinavir and Ritonavir, while the other is testing U.S.-based biotech Gilead Sciences' antiviral Remdesivir.","President Donald Trump made 115 false claims over the last two weeks of February, during which he faced a growing crisis over the coronavirus pandemic, visited India, held four campaign rallies and addressed the Conservative Political Action Conference.",1.0,120.0,19.0,2.0,10.0,4.0,7.0,6.315789473684211,0.0,50.0,0.0,0.0,0.0,19.0,0.0,0.0,0.0,1.0,0.0,0.0,0.0,0.0,19.0,0.0,0.0,0.0,-96.0,-19.0,-4.0,-5.0,2.0,-31.0,0.63,0.0,50.0,0.0,0.0,-5.26,-14.0,0.0,0.0,0.0,-2.0,0.0,-1.0,0.0,0.0,-14.0,0.0,0.0,-1.0,-29.09,-6.36,-1.17,-1.37,0.43,-6.27,0.18,-0.02,2.87,0.0,-0.71,-0.33,-3.71,-0.02,-0.01,0.09,-0.04,0.07,-0.17,0.01,0.0,-3.71,-0.02,0.07,-0.17
30,"At DuPont's largest manufacturing facility in Richmond, Virginia, CNBC got an inside look at how the company is making changes to its operations to accommodate the rise in demand for protective suits.","The deadly outbreak of a novel coronavirus has raised concern worldwide but it has not developed yet into a full-blown pandemic, according to the World Health Organization. Here's why.",1.0,169.0,32.0,4.0,13.0,2.0,32.0,5.28125,0.0,25.0,0.0,3.125,0.0,26.0,0.0,0.0,0.0,0.0,0.0,1.0,0.0,0.0,26.0,0.0,0.0,1.0,13.0,3.0,-2.0,5.0,-1.0,17.5,-0.1,0.0,25.0,0.0,3.12,-13.79,1.0,0.0,0.0,0.0,0.0,0.0,0.0,0.0,0.0,1.0,0.0,0.0,0.0,-28.27,-6.19,-1.19,-1.28,0.42,-5.91,0.18,-0.02,3.13,0.0,-0.65,-0.45,-3.63,-0.02,-0.01,0.08,-0.06,0.06,-0.14,0.01,0.0,-3.63,-0.02,0.06,-0.14
