18,"Older people are the most likely to die from the coronavirus. But overworked, under-protected healthcare workers are at risk, too.",Here's what else you need to know to Get Up to Speed and Out the Door.,0.0,111.0,20.0,4.0,5.0,3.0,10.0,5.55,0.0,50.0,0.0,0.0,10.0,16.0,0.0,0.0,1.0,0.0,0.0,0.0,0.0,0.0,16.0,0.0,0.0,0.0,56.0,4.0,0.0,1.0,1.0,-6.0,2.11,0.0,50.0,0.0,0.0,10.0,3.0,0.0,0.0,1.0,0.0,0.0,-1.0,-1.0,0.0,3.0,0.0,0.0,-1.0,-2.56,-1.17,-0.47,0.61,0.05,-5.59,0.08,0.03,2.8,0.0,-1.28,2.28,-0.85,-0.02,0.01,0.17,-0.01,-0.13,0.23,-0.02,0.0,-0.85,-0.02,-0.13,0.23
19,"Democratic White House hopefuls are seizing on President Donald Trump’s delayed response to the coronavirus outbreak, calling it the latest evidence of his incompetence and warning that the crisis may only deepen as a result. Former Vice President Joe Biden, …","The White House has requested $1.25 billion in emergency funding to address the novel coronavirus, part of an effort to direct as much as $2.5 billion in total funds to bolster its response to the growing global crisis, according to a letter obtained by CNN.",0.0,220.0,41.0,7.0,21.0,2.0,20.5,5.365853658536586,0.0,14.285714285714285,0.0,0.0,12.195121951219512,36.0,0.0,0.0,0.0,0.0,0.0,2.0,0.0,0.0,36.0,0.0,0.0,2.0,6.0,-4.0,-1.0,9.0,-2.0,4.83,0.61,0.0,14.29,0.0,-2.22,7.75,4.0,0.0,0.0,0.0,-4.0,0.0,1.0,0.0,0.0,4.0,0.0,0.0,1.0,-0.06,-0.72,-0.4,1.05,0.05,-5.65,0.08,0.03,2.66,0.0,-1.32,2.59,-0.36,-0.02,0.01,0.16,-0.03,-0.13,0.3,-0.02,0.0,-0.36,-0.02,-0.13,0.3
20,"President Trump was getting inaugurated later that week, so he was understandably absent when Bill Gates issued a prescient warning at the 2017 World Economic Summit in Davos, Switzerland.“Ebola and Zika showed that the world is tragically unprepared to detec…",Dr. Colleen Kraft of Emory University writes that washing hands and protecting medical workers are our best chance to keep the coronavirus epidemic from spreading further.,0.0,221.0,40.0,8.0,15.0,2.0,20.5,5.525,0.0,37.5,0.0,0.0,7.5,34.0,0.0,1.0,0.0,1.0,0.0,1.0,0.0,0.0,34.0,0.0,0.0,1.0,75.0,14.0,1.0,6.0,-1.0,7.5,-0.09,0.0,23.21,0.0,-3.85,3.65,8.0,0.0,1.0,0.0,1.0,0.0,1.0,0.0,0.0,8.0,0.0,-1.0,1.0,2.25,-0.37,-0.29,1.16,0.05,-5.7,0.09,0.03,3.65,0.0,-1.35,2.64,-0.02,-0.02,0.05,0.15,0.0,-0.13,0.31,-0.02,0.0,-0.02,-0.02,-0.13,0.31
21,* President gives rambling address to reassure Americans * Trump says US ready to spend ‘whatever’s appropriate’ * US officials confirm new case in northern CaliforniaDonald Trump on Wednesday put Vice-President Mike Pence in charge of the US response to coro…,"Dr. Mark Rupp tells CNN patients are in the ""chicken soup stage.""",0.0,220.0,41.0,8.0,21.0,1.0,41.0,5.365853658536586,0.0,0.0,0.0,7.317073170731707,0.0,28.0,0.0,0.0,0.0,0.0,0.0,0.0,0.0,0.0,28.0,0.0,0.0,0.0,166.0,29.0,6.0,14.0,-2.0,36.67,0.87,0.0,-50.0,0.0,7.32,0.0,16.0,0.0,0.0,0.0,0.0,0.0,0.0,0.0,0.0,16.0,0.0,0.0,0.0,4.31,0.01,-0.18,1.54,0.0,-4.82,0.1,0.02,2.84,0.0,-1.05,2.34,0.03,-0.02,0.05,0.14,-0.01,-0.13,0.28,-0.02,0.0,0.03,-0.02,-0.13,0.28
22,"Democrats are freaking out that Sen. Bernie Sanders (I-Vt.), the tentative frontrunner for their party's presidential nomination, may not only lose to President Trump in November, but also reverse their midterm election gains in the suburbs. The latest bit of…","Since the Chinese city of Wuhan went into lockdown two weeks ago, university student Victor Vincent has watched as other international students on his campus have returned home.",0.0,221.0,40.0,5.0,15.0,4.0,10.25,5.525,0.0,20.0,0.0,2.5,7.5,34.0,0.0,0.0,0.0,0.0,0.0,2.0,0.0,0.0,34.0,0.0,0.0,2.0,71.0,12.0,0.0,4.0,2.0,-17.75,0.17,0.0,20.0,0.0,2.5,7.5,6.0,0.0,0.0,0.0,-1.0,0.0,1.0,0.0,0.0,6.0,0.0,0.0,1.0,6.23,0.3,-0.22,1.62,0.09,-5.35,0.1,0.02,2.97,0.0,-0.99,2.4,0.32,-0.02,0.04,0.13,-0.03,-0.13,0.34,-0.02,0.0,0.32,-0.02,-0.13,0.34
23,The prevalence of coronavirus among Iran's political leadership appears to be a unique example of the virus' deep impact on the nation's authorities.,"Some students at a New York university are in hot water over allegations they held what the school is describing as a ""coronavirus-themed party.""",0.0,127.0,23.0,2.0,9.0,2.0,23.0,5.521739130434782,0.0,50.0,0.0,0.0,4.3478260869565215,19.0,0.0,0.0,0.0,0.0,0.0,0.0,0.0,0.0,19.0,0.0,0.0,0.0,5.0,-1.0,-2.0,1.0,0.0,10.5,0.44,0.0,0.0,0.0,-4.17,0.18,-3.0,0.0,0.0,0.0,0.0,0.0,0.0,0.0,0.0,-3.0,0.0,0.0,0.0,4.07,-0.14,-0.38,1.44,0.08,-5.3,0.11,0.02,4.33,0.0,-1.03,2.32,-0.03,-0.02,0.04,0.12,-0.04,-0.13,0.31,-0.02,0.0,-0.03,-0.02,-0.13,0.31
24,President Trump announced that he was putting Vice President Mike Pence in charge of the U.S. response to coronavirus.,"When the World Health Organization declared the outbreak of the novel coronavirus a public health emergency of international concern, it did so over fears that smaller or less-developed countries would struggle to contain the virus.",0.0,100.0,19.0,3.0,10.0,4.0,6.666666666666667,5.2631578947368425,0.0,33.33333333333333,0.0,0.0,0.0,17.0,0.0,0.0,0.0,0.0,0.0,1.0,0.0,0.0,17.0,0.0,0.0,1.0,-98.0,-16.0,-2.0,-1.0,2.0,-28.33,-0.39,0.0,33.33,0.0,0.0,-20.0,-12.0,0.0,-1.0,0.0,0.0,0.0,0.0,0.0,0.0,-12.0,0.0,0.0,0.0,1.0,-0.7,-0.48,1.32,0.16,-5.91,0.11,0.02,4.93,0.0,-1.07,2.07,-0.43,-0.02,0.04,0.12,-0.06,-0.13,0.32,-0.02,0.0,-0.43,-0.02,-0.13,0.32
25,"COVID-19 has been found in 30 countries, and as it continues to spread, experts told Business Insider many countries lack the capacity to contain it.","Former Vice President Joe Biden on Sunday slammed the Trump administration's handling of the novel coronavirus outbreak, saying he would handle it differently if he were president.",0.0,125.0,25.0,8.0,7.0,2.0,25.0,5.0,0.0,12.5,0.0,0.0,4.0,23.0,0.0,0.0,1.0,1.0,0.0,1.0,0.0,0.0,23.0,0.0,0.0,1.0,-29.0,-2.0,3.0,-4.0,0.0,-2.0,-0.7,0.0,-7.5,0.0,0.0,0.3,0.0,0.0,0.0,1.0,1.0,0.0,-2.0,0.0,0.0,0.0,0.0,0.0,-2.0,-0.86,-0.99,-0.38,1.09,0.15,-5.77,0.1,0.02,4.67,0.0,-1.11,2.0,-0.57,-0.02,0.03,0.15,-0.03,-0.13,0.33,-0.02,0.0,-0.57,-0.02,-0.13,0.33
26,"To wit, Kinnos, which makes additives that cause disinfectants to turn blue long enough to ensure a surface has actually been covered, just closed on $6 million in funding, a major chunk of which came from Prolog Ventures,  though it was joined by Allston Ven…","Covid-19 will become a pandemic. We don't yet know how severe it will be, nor do we know if the virus will spread to all continents, but it's already spreading widely in China, South Korea, Italy, Iran and elsewhere -- and thousands of undetected and infectio…",0.0,215.0,45.0,10.0,12.0,1.0,45.0,4.777777777777778,0.0,20.0,0.0,2.2222222222222223,0.0,40.0,0.0,1.0,0.0,2.0,0.0,1.0,0.0,0.0,40.0,0.0,0.0,1.0,0.0,-1.0,-2.0,2.0,-1.0,22.0,0.1,0.0,20.0,0.0,2.22,-4.35,2.0,0.0,1.0,-1.0,2.0,-1.0,0.0,0.0,0.0,2.0,0.0,-1.0,0.0,0.74,-0.52,-0.22,1.07,0.11,-4.9,0.08,0.01,4.72,0.0,-1.06,1.78,-0.07,-0.02,0.07,0.14,0.03,-0.13,0.34,-0.02,0.0,-0.07,-0.02,-0.13,0.34
27,"In interviews across the major television networks on Sunday, U.S. officials all-but-admitted that efforts to contain the spread of the novel coronavirus, COVID-19, have failed and that the country now needs to move to mitigate the effects of the continuing s…","While the CDC has screened more than 30,000 passengers in the past month, not a single US coronavirus case has been caught by airport temperature checks, according to a CNN investigation.",0.0,220.0,41.0,8.0,13.0,3.0,14.0,5.365853658536586,0.0,0.0,0.0,0.0,2.4390243902439024,28.0,0.0,0.0,0.0,0.0,0.0,0.0,0.0,0.0,28.0,0.0,0.0,0.0,63.0,10.0,2.0,2.0,1.0,-17.0,0.3,0.0,-16.67,0.0,0.0,2.44,3.0,0.0,0.0,0.0,-1.0,0.0,0.0,0.0,0.0,3.0,0.0,0.0,0.0,2.41,-0.22,-0.14,1.08,0.14,-5.2,0.08,0.01,4.04,0.0,-1.09,1.67,-0.04,-0.02,0.06,0.13,0.02,-0.13,0.31,-0.02,0.0,-0.04,-0.02,-0.13,0.31
28,"Quarantine could have long-lasting psychological impact... (Top headline, 14th story, link ) Related stories: TWITTER Tells All Employees To Work At Home... FAUCI PANDEMIC WARNING... Patient's chilling account of what disease feels like... WHO makes urgent pl…","Veterans Affairs Secretary Robert Wilkie confirmed during his testimony on Capitol Hill Wednesday that one veteran is being treated for the coronavirus at a VA facility in Palo Alto, California, and said the agency has a section of the campus set up to receiv…",0.0,224.0,37.0,6.0,20.0,5.0,7.4,6.054054054054054,0.0,0.0,0.0,5.405405405405405,2.7027027027027026,37.0,0.0,0.0,0.0,1.0,0.0,0.0,0.0,0.0,37.0,0.0,0.0,0.0,7.0,-7.0,-2.0,1.0,4.0,-36.6,1.12,0.0,-12.5,0.0,5.41,2.7,-2.0,0.0,0.0,0.0,0.0,0.0,-1.0,0.0,0.0,-2.0,0.0,0.0,-1.0,4.1,-0.08,-0.14,1.33,0.24,-5.7,0.1,0.01,3.41,0.0,-0.94,1.57,0.3,-0.02,0.06,0.13,0.04,-0.13,0.29,-0.02,0.0,0.3,-0.02,-0.13,0.29
29,"Ill Nebraska man being tested for coronavirus ABC News First Ebola, Now Coronavirus. Why an Omaha Hospital Gets the Toughest Cases. The New York Times Nebraska's specialized medical care has handled Ebola. Now it's taking on the novel coronavirus CNN Why trea…","President Donald Trump made 115 false claims over the last two weeks of February, during which he faced a growing crisis over the coronavirus pandemic, visited India, held four campaign rallies and addressed the Conservative Political Action Conference.",0.0,219.0,42.0,7.0,22.0,4.0,10.5,5.214285714285714,0.0,0.0,0.0,0.0,0.0,34.0,0.0,0.0,0.0,0.0,0.0,0.0,0.0,0.0,34.0,0.0,0.0,0.0,3.0,4.0,1.0,7.0,2.0,-27.5,-0.47,0.0,0.0,0.0,0.0,-5.26,1.0,0.0,0.0,0.0,-3.0,0.0,-1.0,0.0,0.0,1.0,0.0,0.0,-1.0,5.51,0.21,-0.1,1.63,0.3,-6.07,0.1,0.01,2.83,0.0,-0.97,1.39,0.52,-0.02,0.06,0.12,0.02,-0.13,0.27,-0.02,0.0,0.52,-0.02,-0.13,0.27
30,Ebola czar calls White House's move an 'outrage' CNN Trump to talk coronavirus in just 2nd White House briefing room visit New York Post Trump: Coronavirus Poses 'Very Low' Risk To Americans | NBC News NBC News Trump says coronavirus could affect economic gro…,"The deadly outbreak of a novel coronavirus has raised concern worldwide but it has not developed yet into a full-blown pandemic, according to the World Health Organization. Here's why.",0.0,217.0,44.0,7.0,29.0,1.0,44.0,4.931818181818182,0.0,0.0,0.0,0.0,0.0,34.0,0.0,0.0,0.0,1.0,0.0,0.0,0.0,0.0,34.0,0.0,0.0,0.0,61.0,15.0,1.0,21.0,-2.0,29.5,-0.45,0.0,0.0,0.0,0.0,-13.79,9.0,0.0,0.0,0.0,1.0,0.0,-1.0,0.0,0.0,9.0,0.0,0.0,-1.0,6.77,0.55,-0.06,2.14,0.26,-5.34,0.09,0.01,2.28,0.0,-1.01,1.22,0.73,-0.02,0.05,0.12,0.04,-0.13,0.25,-0.02,0.0,0.73,-0.02,-0.13,0.25
31,Analyst: This is a four-alarm fire CNN Trump Says He’s Doing ‘Incredible Job’ Handling Coronavirus Bloomberg Trump downplays fears of coronavirus spread in news conference Washington Post Trump to talk coronavirus in just 2nd White House briefing room visit N…,"The first US study of a drug to treat the novel coronavirus is underway, the National Institutes of Health said Tuesday, as a  federal health officials warned that the virus will eventually begin spreading in US communities.",0.0,221.0,40.0,5.0,28.0,1.0,40.0,5.525,0.0,20.0,0.0,0.0,2.5,33.0,0.0,0.0,0.0,1.0,0.0,0.0,0.0,0.0,33.0,0.0,0.0,0.0,34.0,3.0,-2.0,15.0,-1.0,3.0,0.47,0.0,5.71,0.0,0.0,-2.91,4.0,0.0,0.0,0.0,1.0,0.0,0.0,0.0,0.0,4.0,0.0,0.0,0.0,8.07,0.75,-0.09,2.59,0.22,-4.77,0.1,0.01,2.39,0.0,-1.04,1.14,0.89,-0.02,0.05,0.11,0.06,-0.13,0.23,-0.02,0.0,0.89,-0.02,-0.13,0.23
32,Markets not buying Trump administration is ready for coronavirus | Don Lemon CNN Donald Trump Blames Media Coverage Of Coronavirus For Dow Jones Drop Deadline Trump downplays fears of coronavirus spread in news conference Washington Post Trump is reportedly '…,Jerome Adams writes that Americans should take comfort in knowing that we have the best team in the world to protect them from coronavirus,0.0,221.0,40.0,4.0,27.0,1.0,40.0,5.525,0.0,50.0,0.0,2.5,2.5,32.0,0.0,0.0,0.0,0.0,0.0,0.0,0.0,0.0,32.0,0.0,0.0,0.0,106.0,16.0,-2.0,20.0,0.0,16.0,0.73,0.0,50.0,0.0,-10.0,2.5,14.0,0.0,0.0,0.0,0.0,-1.0,-1.0,0.0,0.0,14.0,0.0,-1.0,-1.0,9.29,0.93,-0.15,2.98,0.18,-4.24,0.1,0.01,3.4,0.0,-0.99,1.07,1.01,-0.02,0.05,0.11,0.05,-0.13,0.21,-0.02,0.0,1.01,-0.02,-0.13,0.21
33,"'Way Too Early' to Say If COVID-19 Has Peaked After Coronavirus Cases Drop, WHO Says QuickTake by Bloomberg Coronavirus outbreak: Fall in new cases raises hope in China KRON4 ARIRANG NEWS [LIVE] : China's Hubei Province reports huge jump in new coronavirus ca…","President Donald Trump brought to his office voluble disdain for his White House predecessors, Congress, the Federal Reserve and the executive branch itself.",0.0,218.0,43.0,4.0,30.0,1.0,43.0,5.069767441860465,0.0,0.0,0.0,0.0,2.3255813953488373,36.0,0.0,0.0,0.0,0.0,0.0,0.0,0.0,0.0,36.0,0.0,0.0,0.0,83.0,20.0,3.0,16.0,-1.0,20.0,-0.8,0.0,0.0,0.0,0.0,-2.02,17.0,0.0,0.0,0.0,0.0,0.0,-2.0,0.0,0.0,17.0,0.0,0.0,-2.0,10.36,1.19,-0.21,3.43,0.15,-3.65,0.09,0.01,2.88,0.0,-1.02,0.99,1.24,-0.02,0.04,0.1,0.03,-0.13,0.19,-0.02,0.0,1.24,-0.02,-0.13,0.19
34,"Infectious disease expert Dr. Dena Grayson joins Yahoo Finance’s Seana Smith on The Ticker to discuss the differences between the coronavirus and Ebola and how Senate passing an emergency bill is a ""very important first step"" in combatting the virus.","The number of deaths from the Wuhan coronavirus had risen to over 1,000 by Tuesday morning, as experts from the World Health Organization (WHO) arrived in China to assist with controlling the epidemic.",0.0,211.0,40.0,6.0,19.0,3.0,20.0,5.275,0.0,16.666666666666664,0.0,2.5,5.0,35.0,0.0,0.0,0.0,0.0,0.0,0.0,0.0,0.0,35.0,0.0,0.0,0.0,42.0,7.0,1.0,6.0,1.0,-13.0,0.15,0.0,16.67,0.0,2.5,1.97,9.0,0.0,0.0,0.0,-1.0,0.0,0.0,0.0,0.0,9.0,0.0,0.0,0.0,11.16,1.35,-0.2,3.54,0.17,-3.76,0.09,0.01,2.87,0.0,-0.98,0.99,1.43,-0.02,0.04,0.1,0.02,-0.13,0.17,-0.02,0.0,1.43,-0.02,-0.13,0.17
35,"An experimental Gilead Sciences antiviral drug prevented disease and reduced the severity of symptoms in monkeys infected with Middle East Respiratory Syndrome (MERS),  an infection closely related to the fast-spreading coronavirus that originated in China, a…",Millions of people across China are heading back to work after the Lunar New Year break turned into an extended quarantine due to the Wuhan coronavirus.,0.0,224.0,36.0,5.0,16.0,1.0,36.0,6.222222222222222,0.0,0.0,0.0,0.0,11.11111111111111,33.0,0.0,0.0,0.0,0.0,0.0,0.0,0.0,0.0,33.0,0.0,0.0,0.0,97.0,10.0,2.0,5.0,-1.0,10.0,1.34,0.0,-33.33,0.0,-3.85,7.26,11.0,0.0,0.0,0.0,0.0,0.0,0.0,0.0,0.0,11.0,0.0,0.0,0.0,12.28,1.39,-0.22,3.57,0.14,-3.41,0.12,0.01,2.4,0.0,-1.01,1.17,1.56,-0.02,0.04,0.09,0.01,-0.13,0.16,-0.02,0.0,1.56,-0.02,-0.13,0.16
36,(Bloomberg) -- Gilead Sciences Inc. shares gained Monday after a senior World Health Organization official said the company’s experimental drug may be the best bet to find a treatment for the new coronavirus that’s spreading around the globe.Gilead’s compound…,"Stock markets are tumbling (it was the largest single point drop in history Thursday), there's a mysterious new case in California and the world map is lighting up with countries affected by the coronavirus outbreak. The White House responded by telling publi…",0.0,222.0,39.0,8.0,20.0,3.0,13.333333333333334,5.6923076923076925,0.0,12.5,0.0,5.128205128205128,0.0,33.0,0.0,0.0,0.0,0.0,0.0,0.0,0.0,0.0,33.0,0.0,0.0,0.0,3.0,-3.0,-1.0,4.0,1.0,-7.67,0.48,0.0,-20.83,0.0,5.13,-4.76,-2.0,0.0,0.0,0.0,0.0,0.0,0.0,0.0,0.0,-2.0,0.0,0.0,0.0,13.28,1.51,-0.16,3.7,0.16,-3.69,0.13,0.0,2.29,0.0,-0.9,1.03,1.67,-0.02,0.04,0.09,0.0,-0.13,0.14,-0.02,0.0,1.67,-0.02,-0.13,0.14
37,"Barrick Gold on Friday said it was increasing its inventory of key commodities to above normal levels because of the global spread of coronavirus, though placed and forecast orders were unchanged and supplies to mines were not affected.  The world's second-la…",As new cases of coronavirus arise daily in the United States -- including several announced over the weekend and one death --  the US Centers for Disease Control and Prevention has failed to release crucial information physicians say could help save the lives…,0.0,219.0,41.0,8.0,13.0,2.0,20.5,5.341463414634147,0.0,37.5,0.0,0.0,0.0,33.0,0.0,1.0,0.0,0.0,0.0,2.0,0.0,0.0,33.0,0.0,0.0,2.0,2.0,-2.0,-1.0,-1.0,1.0,-22.5,0.29,0.0,37.5,0.0,0.0,-4.65,-3.0,0.0,1.0,0.0,-1.0,0.0,2.0,0.0,0.0,-3.0,0.0,0.0,2.0,14.15,1.67,-0.11,3.64,0.16,-3.77,0.13,0.0,2.84,0.0,-0.93,0.9,1.78,-0.02,0.06,0.09,-0.01,-0.13,0.18,-0.02,0.0,1.78,-0.02,-0.13,0.18
38,"Airlines, hotels, casinos and other stocks continue to fall as fear of the coronavirus grows worldwide and all but halts activity in the virus epicenter of Wuhan, China.  Alpha Pro Tech, Ltd. (NYSE: APT) manufactures masks and protective apparel — goods alrea…","Vanessa Kerry writes that the story of Osmel Martinez Azcue, a man charged over $3,000 for taking responsible action and visiting a hospital to be screened for the novel coronavirus after he returned from China with flu-like symptoms, proves that if we are go…",0.0,218.0,42.0,4.0,24.0,3.0,14.0,5.190476190476191,0.0,0.0,0.0,2.380952380952381,7.142857142857142,36.0,0.0,0.0,1.0,0.0,0.0,0.0,0.0,0.0,36.0,0.0,0.0,0.0,1.0,-2.0,-5.0,11.0,2.0,-30.0,0.26,0.0,-22.22,0.0,0.11,4.87,0.0,0.0,0.0,1.0,-1.0,-1.0,-1.0,0.0,0.0,0.0,0.0,-1.0,-1.0,14.96,1.85,-0.15,3.86,0.18,-4.02,0.12,0.0,2.41,0.0,-0.9,0.97,1.97,-0.02,0.06,0.11,-0.02,-0.13,0.16,-0.02,0.0,1.97,-0.02,-0.13,0.16
39,"(Bloomberg) -- Inovio Pharmaceuticals Inc.’s meteoric rise on the back of hype for a vaccine to treat the coronavirus drew the ire of noted short-seller Citron Research, as the firm slapped a $2 target on the drug maker.“SEC should immediately HALT this stock…","A recent scientific article suggested that the novel coronavirus responsible for the Covid-19 epidemic has mutated into a more ""aggressive"" form. Is this something we need to worry about? No, and here's why.",0.0,218.0,43.0,6.0,20.0,3.0,15.0,5.069767441860465,0.0,0.0,0.0,0.0,4.651162790697675,32.0,0.0,0.0,0.0,1.0,0.0,0.0,0.0,0.0,32.0,0.0,0.0,0.0,43.0,10.0,-1.0,14.0,0.0,4.0,-0.23,-1.0,0.0,0.0,0.0,-4.44,1.0,-1.0,0.0,0.0,1.0,-1.0,0.0,0.0,0.0,1.0,0.0,-1.0,0.0,15.72,2.05,-0.15,3.98,0.2,-4.22,0.12,0.0,1.99,0.0,-0.92,0.96,2.04,-0.02,0.06,0.11,-0.0,-0.13,0.15,-0.02,0.0,2.04,-0.02,-0.13,0.15
40,U.S. President Donald Trump signed an $8.3 billion spending bill which passed through both houses of Congress this week that will help fund the U.S. response to the coronavirus outbreak.,"In a striking contradiction to White House assertions that the coronavirus is under control, the Pentagon's chief of personnel is sharply warning that the virus poses an increased ""threat"" in areas where US troops and defense personnel are located around the …",0.0,157.0,30.0,5.0,13.0,7.0,5.5,5.233333333333333,0.0,0.0,0.0,0.0,3.3333333333333335,26.0,0.0,0.0,0.0,2.0,0.0,0.0,0.0,0.0,26.0,0.0,0.0,0.0,-62.0,-12.0,-2.0,-4.0,6.0,-36.5,0.02,0.0,-42.86,0.0,-2.38,-8.57,-6.0,0.0,0.0,0.0,2.0,0.0,0.0,0.0,0.0,-6.0,0.0,0.0,0.0,14.96,1.92,-0.17,3.91,0.32,-4.65,0.11,0.0,1.6,0.0,-0.95,0.92,1.96,-0.02,0.05,0.1,0.04,-0.13,0.14,-0.02,0.0,1.96,-0.02,-0.13,0.14
41,"The coronavirus’ grip on the market continues. Since the beginning of February, the S&P 500 has shed 8.5% of its value, a reflection of the effect the outbreak is having on the global economy. Amidst the bloodbath, one specific group of stocks is holding up. …",Governments around the world are adopting a variety of different  measures to try and contain the spread of the novel coronavirus.,0.0,215.0,46.0,8.0,18.0,5.0,9.4,4.673913043478261,0.0,25.0,0.0,0.0,2.1739130434782608,31.0,0.0,0.0,0.0,3.0,0.0,1.0,0.0,0.0,31.0,0.0,0.0,1.0,106.0,25.0,4.0,12.0,3.0,-11.6,-0.52,0.0,0.0,0.0,-4.76,2.17,14.0,0.0,0.0,0.0,3.0,0.0,1.0,0.0,0.0,14.0,0.0,0.0,1.0,15.61,2.18,-0.12,3.97,0.38,-4.96,0.1,0.0,1.82,0.0,-0.98,0.86,2.01,-0.02,0.05,0.1,0.1,-0.13,0.15,-0.02,0.0,2.01,-0.02,-0.13,0.15
42,Goldman Sachs warns the coronavirus outbreak could easily trigger a U.S. recession.,Dr. Abdul El-Sayed - formerly the health commissioner of Detroit - outlines the particular challenges faced by ravaged local public health entities as they seek to fight the spread of coronavirus.,0.0,72.0,12.0,3.0,6.0,4.0,4.333333333333333,6.0,0.0,0.0,0.0,0.0,16.666666666666664,12.0,0.0,0.0,0.0,0.0,0.0,0.0,0.0,0.0,12.0,0.0,0.0,0.0,-94.0,-19.0,-1.0,-5.0,1.0,-11.17,0.65,0.0,0.0,0.0,0.0,16.67,-10.0,0.0,0.0,0.0,0.0,0.0,0.0,0.0,0.0,-10.0,0.0,0.0,0.0,12.91,1.64,-0.19,3.75,0.42,-5.38,0.11,0.0,1.44,0.0,-1.0,1.14,1.61,-0.02,0.05,0.1,0.09,-0.13,0.13,-0.02,0.0,1.61,-0.02,-0.13,0.13
43,"(Bloomberg Opinion) -- Global markets have entered the meltdown stage, accelerating in the past few days beyond a relatively orderly stock-market correction. With coronavirus cases now on all continents this is no longer a domestic China problem; that suddenl…","Colleges and universities across the US are bracing for a possible pandemic while weighing potential campus closures, program cancellations and dips in enrollment.",0.0,222.0,39.0,4.0,12.0,2.0,19.5,5.6923076923076925,0.0,25.0,0.0,2.564102564102564,5.128205128205128,35.0,0.0,0.0,2.0,0.0,0.0,0.0,0.0,0.0,35.0,0.0,0.0,0.0,81.0,16.0,1.0,2.0,0.0,-3.5,-0.44,0.0,-8.33,0.0,2.56,5.13,14.0,0.0,0.0,2.0,0.0,0.0,0.0,0.0,0.0,14.0,0.0,0.0,0.0,13.74,1.73,-0.23,3.67,0.41,-5.44,0.12,0.0,1.66,0.0,-0.97,1.14,1.75,-0.02,0.05,0.14,0.08,-0.13,0.12,-0.02,0.0,1.75,-0.02,-0.13,0.12
44,"The 2020 Democrats have been putting forth a range of ideas to combat the coronavirus in recent days. On Thursday, Elizabeth Warren announced perhaps the most novel one.","As health officials in a growing number of countries fight to slow the spread of the novel coronavirus, they're also working to stem a secondary issue that the World Health Organization is calling an ""infodemic.""",0.0,142.0,28.0,5.0,9.0,3.0,14.0,5.071428571428571,0.0,20.0,0.0,0.0,0.0,26.0,0.0,0.0,1.0,2.0,0.0,0.0,0.0,0.0,26.0,0.0,0.0,0.0,-36.0,-7.0,-3.0,-1.0,1.0,-4.0,-0.01,0.0,7.5,0.0,0.0,-5.71,0.0,0.0,0.0,1.0,2.0,0.0,0.0,0.0,0.0,0.0,0.0,0.0,0.0,12.76,1.58,-0.24,3.53,0.42,-5.61,0.12,0.0,1.75,0.0,-0.99,1.03,1.69,-0.02,0.04,0.16,0.11,-0.13,0.11,-0.02,0.0,1.69,-0.02,-0.13,0.11
