63,"As a teenage boy, Elon Musk felt a ""personal obligation"" for the fate of mankind, according to ""Elon Musk: Tesla, SpaceX, and the Quest for a Fantastic Future"" by Ashlee Vance. And Musk shared the book that inspired this ""obligation.""","NASA's Curiosity rover has been searching for evidence that Mars was once habitable. Now, researchers are following up on its discovery of organic compounds to determine their origin.",1.0,195.0,40.0,4.0,18.0,3.0,13.666666666666666,4.875,0.0,0.0,0.0,0.0,0.0,30.0,0.0,0.0,0.0,0.0,0.0,0.0,0.0,0.0,30.0,0.0,0.0,0.0,39.0,12.0,-3.0,9.0,0.0,-0.33,-0.7,0.0,-42.86,0.0,0.0,0.0,2.0,0.0,0.0,0.0,0.0,0.0,-2.0,0.0,0.0,2.0,0.0,0.0,-2.0,-9.75,-1.83,-0.5,-0.35,0.25,-2.75,-0.05,-0.0,-5.61,0.0,-0.25,0.6,-0.93,-0.04,0.02,-0.12,0.09,-0.04,-0.04,0.02,0.0,-0.93,-0.03,0.02,-0.04
64,"China, formerly the world's largest consumer of recycled paper, banned the import of many recyclables. Now, Chinese companies are investing in American recycling.",The boom in US production has made America the largest oil producer in the world and radically changed the economics from when it was a net consumer. It also means this latest oil price plunge will be far more damaging to the US economy than the massive oil p…,1.0,140.0,23.0,3.0,8.0,3.0,11.5,6.086956521739131,0.0,33.33333333333333,0.0,0.0,0.0,19.0,0.0,0.0,1.0,0.0,0.0,0.0,0.0,0.0,19.0,0.0,0.0,0.0,-72.0,-26.0,-4.0,-8.0,1.0,-13.0,1.76,0.0,4.76,0.0,-2.04,-4.08,-18.0,0.0,0.0,1.0,0.0,0.0,-1.0,0.0,0.0,-18.0,0.0,0.0,-1.0,-10.04,-1.95,-0.53,-0.4,0.25,-2.9,-0.03,-0.0,-5.32,0.0,-0.28,0.56,-1.04,-0.04,0.02,-0.1,0.08,-0.04,-0.05,0.02,0.0,-1.04,-0.03,0.02,-0.05
65,Check out the companies making headlines in midday trading on Thursday.,Photographer Kyle Weeks wants to help re-write preconceived narratives about African men by focusing on young creatives.,1.0,61.0,11.0,2.0,5.0,2.0,11.0,5.545454545454546,0.0,0.0,0.0,0.0,0.0,11.0,0.0,0.0,0.0,0.0,0.0,0.0,0.0,0.0,11.0,0.0,0.0,0.0,-43.0,-6.0,-2.0,-1.0,0.0,-6.0,-0.57,0.0,0.0,0.0,0.0,0.0,-6.0,0.0,0.0,0.0,0.0,0.0,0.0,0.0,0.0,-6.0,0.0,0.0,0.0,-11.51,-2.25,-0.58,-0.49,0.24,-3.05,-0.03,-0.0,-5.53,0.0,-0.3,0.51,-1.27,-0.04,0.02,-0.11,0.07,-0.04,-0.07,0.02,0.0,-1.27,-0.03,0.02,-0.07
66,"Laurene Powell Jobs spoke about the ""very beautiful and rich connection"" she shared with her late husband, Apple founder Steve Jobs, in an interview with the New York Times. The most important lesson that he taught her? ""[W]e don't have to accept the world th…","President Donald Trump has told aides he wants fewer people working for him in the White House and only loyalists installed in key administration positions, several people familiar with the matter say.",1.0,216.0,45.0,6.0,19.0,2.0,15.0,4.8,1.0,0.0,0.0,6.666666666666667,0.0,40.0,0.0,0.0,1.0,0.0,0.0,4.0,0.0,0.0,40.0,0.0,0.0,4.0,46.0,13.0,-1.0,8.0,0.0,-17.0,-0.51,1.0,0.0,0.0,6.67,0.0,14.0,0.0,0.0,1.0,0.0,0.0,2.0,0.0,0.0,14.0,0.0,0.0,2.0,-10.63,-2.03,-0.57,-0.38,0.24,-3.14,-0.03,0.01,-5.74,0.0,-0.23,0.47,-1.06,-0.04,0.01,-0.09,0.06,-0.04,-0.02,0.02,0.0,-1.06,-0.03,0.02,-0.02
67,"Entrepreneur Tanner Chidester, who became a millionaire at 27, says that if you want to get rich, focus on earning.","Dean Obeidallah writes that Americans could be hearing, ""Please welcome the 46th President of the United States of America, Bernie Sanders,"" come this time next year. While many believe that Bernie has little chance at winning a general election, Obeidallah p…",1.0,96.0,20.0,5.0,5.0,2.0,20.0,4.8,0.0,0.0,0.0,5.0,0.0,20.0,0.0,0.0,0.0,1.0,0.0,1.0,0.0,0.0,20.0,0.0,0.0,1.0,-124.0,-21.0,-4.0,-12.0,0.0,-0.5,-0.57,0.0,-11.11,0.0,0.12,0.0,-11.0,0.0,0.0,-2.0,0.0,0.0,1.0,0.0,0.0,-11.0,0.0,0.0,1.0,-11.54,-2.18,-0.57,-0.47,0.23,-3.15,-0.04,0.01,-5.95,0.0,-0.18,0.43,-1.15,-0.04,0.01,-0.09,0.07,-0.04,-0.01,0.02,0.0,-1.15,-0.03,0.02,-0.01
68,"""I never did the fad diets,"" Maye Musk, a 71 year old model, registered dietitian and Elon's mom tells CNBC Make It. Here's why, plus the evidence-based diets she thinks are worthwhile.","In contrast to previous seasons, there were few overt political messages seen on the runways. Designers opted for more subtle queues to convey messages of general malaise and, in some instances, sullen, brooding defiance.",1.0,154.0,32.0,5.0,12.0,3.0,16.0,4.8125,0.0,20.0,0.0,3.125,0.0,30.0,0.0,0.0,1.0,1.0,0.0,1.0,0.0,0.0,30.0,0.0,0.0,1.0,-34.0,-2.0,0.0,1.0,0.0,-1.0,-0.72,0.0,0.0,0.0,3.12,-8.82,0.0,0.0,0.0,-2.0,1.0,0.0,1.0,0.0,0.0,0.0,0.0,0.0,1.0,-11.58,-2.16,-0.57,-0.46,0.24,-3.22,-0.04,0.01,-5.86,0.0,-0.17,0.39,-1.09,-0.04,0.01,-0.08,0.08,-0.04,-0.01,0.02,0.0,-1.09,-0.03,0.02,-0.01
69,"Airline revenue losses due to the coronavirus could reach $100 billion, but American carrier businesses like United, Southwest and Delta may be more resilient than the 30% sector selloff suggests.","The promise that in America ""anyone can grow up to be President"" has never felt more real, writes Jeff Yang. Andrew Yang put a crack in the glass ceiling for a population that has always been treated as more of a source of campaign donations than a pool of na…",1.0,167.0,30.0,5.0,13.0,2.0,30.0,5.566666666666666,0.0,20.0,0.0,6.666666666666667,3.3333333333333335,28.0,0.0,0.0,0.0,3.0,0.0,0.0,0.0,0.0,28.0,0.0,0.0,0.0,-44.0,-20.0,-5.0,-4.0,0.0,5.0,1.35,0.0,0.0,0.0,4.67,1.33,-7.0,0.0,0.0,-2.0,3.0,0.0,0.0,0.0,0.0,-7.0,0.0,0.0,0.0,-11.43,-2.17,-0.58,-0.43,0.23,-3.09,-0.04,0.01,-5.77,0.0,-0.1,0.4,-1.06,-0.04,0.01,-0.08,0.11,-0.04,-0.02,0.02,0.0,-1.06,-0.03,0.02,-0.02
71,"The key to nailing a job interview isn't just about giving the right answers, it's also about asking the right questions.","Bob Iger consistently waded into waters he didn't initially know much about and just wrangled them into a shape he could understand and deal with, writes Bill Carter, a media analyst for CNN.",1.0,101.0,21.0,5.0,5.0,2.0,21.0,4.809523809523809,0.0,0.0,0.0,9.523809523809524,0.0,15.0,0.0,0.0,0.0,0.0,0.0,0.0,0.0,0.0,15.0,0.0,0.0,0.0,-58.0,-12.0,-2.0,-5.0,0.0,-12.0,-0.01,0.0,0.0,0.0,6.49,0.0,-10.0,0.0,0.0,0.0,0.0,0.0,-3.0,0.0,0.0,-10.0,0.0,0.0,-3.0,-12.72,-2.49,-0.63,-0.54,0.2,-2.84,-0.03,0.01,-5.91,0.0,0.07,0.35,-1.39,-0.04,0.01,-0.08,0.15,-0.04,-0.05,0.02,0.0,-1.39,-0.03,0.02,-0.05
72,There's so much money advice out there that it can be difficult to differentiate the good ones from the bad ones. Don't let these common myths stunt your financial success.,"It is not Alexander and Yevgeny Vindman who have been disgraced by the pettiness of their firing, it is President Trump, writes John Kirby. It is not they who will be remembered for putting personal needs above national interests. The President will, he write…",1.0,143.0,30.0,7.0,6.0,3.0,15.0,4.766666666666667,0.0,14.285714285714285,0.0,6.666666666666667,10.0,28.0,0.0,1.0,0.0,0.0,0.0,2.0,0.0,0.0,28.0,0.0,0.0,2.0,-74.0,-14.0,-6.0,-6.0,0.0,0.33,-0.17,0.0,-24.18,0.0,4.39,7.73,-5.0,0.0,1.0,0.0,0.0,0.0,-1.0,0.0,0.0,-5.0,0.0,0.0,-1.0,-12.89,-2.5,-0.6,-0.61,0.21,-2.92,-0.04,0.01,-5.9,0.0,0.13,0.45,-1.36,-0.04,0.03,-0.09,0.14,-0.04,-0.03,0.02,0.0,-1.36,-0.03,0.01,-0.03
73,The U.S. economy offers more stable growth and American securities promise more secure cash flows and yield that the rest of the globe.,"Andrew Yang plans to announce he is suspending his presidential campaign during a speech Tuesday night in New Hampshire, two sources tell CNN.",1.0,113.0,23.0,1.0,10.0,4.0,8.0,4.913043478260869,0.0,0.0,0.0,13.043478260869565,0.0,17.0,0.0,0.0,0.0,0.0,0.0,0.0,0.0,0.0,17.0,0.0,0.0,0.0,-7.0,0.0,-4.0,0.0,2.0,-15.0,-0.3,0.0,-20.0,0.0,13.04,0.0,-6.0,0.0,0.0,0.0,-1.0,0.0,-2.0,0.0,0.0,-6.0,0.0,0.0,-2.0,-13.46,-2.59,-0.66,-0.62,0.23,-3.1,-0.04,0.01,-6.09,0.0,0.28,0.41,-1.48,-0.04,0.03,-0.09,0.13,-0.04,-0.04,0.02,0.0,-1.48,-0.03,0.01,-0.04
74,The Trump administration has announced new initiatives to crack down on the sale of Chinese counterfeit goods on e-commerce platforms. Some small firms say it won't be enough.,"The producers of the Lykan Hypersport, star of Vin Diesel's ""The Fast Saga,"" are turning their attention to electric and autonomous vehicles.",1.0,148.0,28.0,6.0,9.0,3.0,14.0,5.285714285714286,0.0,16.666666666666664,0.0,3.571428571428571,3.571428571428571,26.0,0.0,0.0,0.0,0.0,0.0,1.0,0.0,0.0,26.0,0.0,0.0,1.0,28.0,6.0,4.0,-1.0,1.0,-8.0,-0.17,0.0,-33.33,0.0,-0.97,3.57,6.0,0.0,0.0,0.0,0.0,0.0,0.0,0.0,0.0,6.0,0.0,0.0,0.0,-13.55,-2.62,-0.64,-0.65,0.24,-3.19,-0.04,0.01,-6.05,0.0,0.29,0.42,-1.47,-0.05,0.03,-0.09,0.12,-0.04,-0.04,0.02,0.0,-1.47,-0.03,0.01,-0.04
75,"In addition to complying with safety guidelines from sources such as the Centers for Disease Control and Prevention, experts say these are some of the ways employers can support their workers amid the coronavirus outbreak.","The Ukraine allegations that President Donald Trump's personal attorney Rudy Giuliani is providing to the Justice Department are being vetted by investigators in the US Attorney's Office in Pittsburgh, two US law enforcement officials said.",1.0,188.0,35.0,5.0,14.0,2.0,35.0,5.371428571428571,0.0,20.0,0.0,2.857142857142857,2.857142857142857,32.0,0.0,0.0,1.0,0.0,0.0,1.0,0.0,0.0,32.0,0.0,0.0,1.0,-18.0,0.0,-1.0,-5.0,0.0,0.0,-0.51,0.0,-13.33,0.0,2.86,0.0,3.0,0.0,0.0,1.0,-1.0,0.0,1.0,0.0,0.0,3.0,0.0,0.0,1.0,-13.12,-2.56,-0.65,-0.61,0.23,-3.0,-0.03,0.01,-5.96,0.0,0.3,0.43,-1.39,-0.05,0.03,-0.08,0.11,-0.04,-0.03,0.02,0.0,-1.39,-0.03,0.01,-0.03
76,"Saving the first few dollars are quick and easy. But once you hit your 30s, generating the amount of income you need to retire early will only get harder and harder.","From phone cases to battery packs, there are plenty to choose from out there, and we've highlighted the best Galaxy S20 and S20+ accessories that are sure to streamline your experience.",1.0,135.0,31.0,8.0,3.0,3.0,15.5,4.354838709677419,0.0,12.5,0.0,3.225806451612903,0.0,25.0,0.0,0.0,1.0,1.0,0.0,3.0,0.0,0.0,25.0,0.0,0.0,3.0,-20.0,0.0,1.0,-5.0,1.0,-15.5,-0.65,0.0,-16.07,0.0,0.0,0.0,1.0,0.0,0.0,1.0,1.0,0.0,2.0,0.0,0.0,1.0,0.0,0.0,2.0,-13.38,-2.55,-0.61,-0.72,0.24,-3.07,-0.05,0.01,-5.98,0.0,0.31,0.39,-1.4,-0.05,0.03,-0.07,0.12,-0.04,-0.0,0.02,0.0,-1.4,-0.03,0.01,-0.0
77,"Oil rises as OPEC, allies work on big cut CNBC Crude Oil: Focus on OPEC+ as Demand Continues to Slump FX Empire Crude Oil prices are expected to trade higher today: Angel Broking Moneycontrol.com Opec pushing Russia to support big oil cut amid coronavirus Eco…","When you think of George Washington, do you think washers and dryers, refrigerators and pressure cookers? Presidents Day weekend may have originally meant honoring America's top leaders, but it has come to also signify serious appliance sales. We've rounded u…",1.0,216.0,45.0,7.0,27.0,2.0,23.0,4.8,0.0,14.285714285714285,0.0,4.444444444444445,0.0,30.0,0.0,0.0,0.0,0.0,0.0,0.0,0.0,0.0,30.0,0.0,0.0,0.0,-5.0,5.0,-5.0,12.0,0.0,9.67,-0.73,-1.0,14.29,0.0,-0.56,0.0,-4.0,0.0,0.0,0.0,0.0,0.0,-3.0,0.0,0.0,-4.0,0.0,0.0,-3.0,-12.6,-2.35,-0.58,-0.51,0.23,-3.05,-0.05,0.01,-5.97,0.0,0.34,0.36,-1.34,-0.05,0.03,-0.07,0.11,-0.04,-0.01,0.02,0.0,-1.34,-0.03,0.01,-0.01
78,A Russian icebreaker has made a successful supply run to exchange crew and deliver goods to an international expedition that's been adrift in the high Arctic for months trying to improve scientific understanding of climate change.,"The coronavirus is a global health crisis we're still learning about. And while we don't know everything about its spread and its impact on global populations, the virus is impacting life across the globe in unexpected ways.",1.0,195.0,36.0,9.0,10.0,2.0,36.0,5.416666666666667,0.0,11.11111111111111,0.0,5.555555555555555,0.0,33.0,0.0,0.0,0.0,0.0,0.0,0.0,0.0,0.0,33.0,0.0,0.0,0.0,7.0,-1.0,2.0,-1.0,-1.0,17.5,0.34,0.0,-17.46,0.0,5.56,-8.11,4.0,0.0,0.0,0.0,0.0,-1.0,-2.0,0.0,0.0,4.0,0.0,-1.0,-2.0,-12.1,-2.28,-0.53,-0.53,0.22,-2.85,-0.05,0.01,-6.0,0.0,0.38,0.33,-1.25,-0.05,0.03,-0.07,0.11,-0.04,-0.02,0.02,0.0,-1.25,-0.03,0.01,-0.02
79,"Iran has nearly tripled its stockpile of enriched uranium since November in violation of its deal with world powers, the UN atomic watchdog agency said Tuesday, raising questions about other undeclared nuclear materials.","Lizzo, Billie Eilish and Harry Styles were among the best-dressed stars at the annual British music awards ceremony.",1.0,188.0,33.0,4.0,14.0,2.0,33.0,5.696969696969697,0.0,0.0,0.0,0.0,3.0303030303030303,29.0,0.0,0.0,0.0,0.0,0.0,2.0,0.0,0.0,29.0,0.0,0.0,2.0,89.0,15.0,3.0,5.0,0.0,15.0,0.2,0.0,-100.0,0.0,-5.56,3.03,13.0,0.0,0.0,0.0,0.0,0.0,2.0,0.0,0.0,13.0,0.0,0.0,2.0,-11.7,-2.25,-0.55,-0.49,0.22,-2.71,-0.04,0.01,-6.17,0.0,0.34,0.33,-1.21,-0.05,0.03,-0.07,0.1,-0.04,-0.01,0.02,0.0,-1.21,-0.03,0.01,-0.01
80,"The utility maintains about 95,000 streetlights around the province. Converting these older lights to LED could lead to cost savings of 50 to 70 per cent, according to the UBCM.",This is only the beginning -- that was the message from a group of women known as the Silence Breakers had on Monday following the conviction of Harvey Weinstein on two of five charges in a New York criminal case.,1.0,148.0,30.0,7.0,7.0,3.0,15.0,4.933333333333334,0.0,0.0,0.0,6.666666666666667,0.0,24.0,0.0,0.0,0.0,3.0,0.0,0.0,0.0,0.0,24.0,0.0,0.0,0.0,-26.0,-10.0,2.0,-7.0,1.0,-25.0,0.58,0.0,-40.0,0.0,6.67,-2.5,-5.0,0.0,0.0,0.0,1.0,0.0,0.0,0.0,0.0,-5.0,0.0,0.0,0.0,-11.81,-2.26,-0.53,-0.54,0.22,-2.78,-0.04,0.01,-6.34,0.0,0.4,0.3,-1.23,-0.05,0.02,-0.08,0.13,-0.04,-0.02,0.01,0.0,-1.23,-0.03,0.01,-0.02
81,British Columbia's police watchdog is investigating the death of a man who was pepper sprayed and shocked with a stun gun by Mounties on Sunday morning.,"The 2020 contenders meet on stage on Tuesday with one final chance to halt the momentum of Vermont Sen. Bernie Sanders, days before the South Carolina primary and exactly one week before voters go to the polls in Super Tuesday states.",1.0,127.0,26.0,4.0,11.0,2.0,26.0,4.884615384615385,0.0,50.0,0.0,0.0,11.538461538461538,24.0,0.0,0.0,0.0,0.0,0.0,0.0,0.0,0.0,24.0,0.0,0.0,0.0,-67.0,-15.0,1.0,-8.0,-1.0,5.5,0.15,0.0,50.0,0.0,0.0,11.54,-4.0,0.0,0.0,0.0,-3.0,0.0,0.0,0.0,0.0,-4.0,0.0,0.0,0.0,-12.17,-2.31,-0.54,-0.54,0.22,-2.72,-0.05,0.0,-5.89,0.0,0.37,0.41,-1.25,-0.05,0.02,-0.08,0.12,-0.04,-0.03,0.01,0.0,-1.25,-0.03,0.0,-0.03
82,"Paper Excellence Canada of Richmond says it will curtail pulp and paper production for 30 days at its Crofton operation, south of Nanaimo.","No drug manufacturers have reported that they anticipate shortages of particular drugs due to the novel coronavirus, according to the US Food and Drug Administration, but the agency and experts in the pharmaceutical industry are paying close attention to the …",1.0,116.0,23.0,3.0,12.0,2.0,23.0,5.043478260869565,0.0,0.0,0.0,0.0,0.0,21.0,0.0,0.0,0.0,1.0,0.0,2.0,0.0,0.0,21.0,0.0,0.0,2.0,-104.0,-18.0,-3.0,-2.0,1.0,-18.0,-0.32,0.0,-16.67,0.0,0.0,0.0,-10.0,0.0,0.0,0.0,1.0,0.0,2.0,0.0,0.0,-10.0,0.0,0.0,2.0,-12.65,-2.4,-0.57,-0.53,0.21,-2.7,-0.05,0.0,-6.05,0.0,0.34,0.38,-1.31,-0.05,0.02,-0.08,0.13,-0.04,-0.01,0.01,0.0,-1.31,-0.03,0.0,-0.01
83,Teck Resources Ltd. says it will take an impairment charge of about $1.13 billion if the federal government decides not to approve its Frontier oilsands mining project.,"Julian Zelizer writes that South Carolina will be a telling primary race for the candidates. But without a doubt, the most important story on Saturday will be Joe Biden.",1.0,142.0,27.0,6.0,8.0,4.0,9.333333333333334,5.2592592592592595,0.0,0.0,0.0,3.7037037037037033,0.0,27.0,0.0,0.0,0.0,2.0,0.0,2.0,0.0,0.0,27.0,0.0,0.0,2.0,1.0,-2.0,1.0,-2.0,1.0,-5.17,0.4,0.0,-40.0,0.0,0.26,-3.45,6.0,0.0,0.0,-1.0,2.0,0.0,2.0,-1.0,0.0,6.0,0.0,0.0,2.0,-12.82,-2.44,-0.56,-0.57,0.23,-2.84,-0.05,0.0,-6.22,0.0,0.35,0.35,-1.3,-0.05,0.02,-0.08,0.14,-0.04,0.0,0.01,0.0,-1.3,-0.03,0.0,0.0
84,"'Nakwaxda'xw hereditary Chief Thomas Henderson and RCMP Corporal Chris Voller call each other ""brother"" and the chief invites RCMP officers to his potlatches to build trust with the community.","In a new series, unveiled this week, photographer Renell Medrano returns home to her motherland.",1.0,164.0,29.0,2.0,14.0,2.0,29.0,5.655172413793103,0.0,0.0,0.0,3.4482758620689653,0.0,21.0,0.0,0.0,0.0,0.0,0.0,1.0,0.0,0.0,21.0,0.0,0.0,1.0,82.0,14.0,0.0,8.0,0.0,14.0,0.19,0.0,0.0,0.0,3.45,0.0,6.0,0.0,0.0,0.0,0.0,0.0,-1.0,0.0,0.0,6.0,0.0,0.0,-1.0,-12.72,-2.45,-0.6,-0.54,0.22,-2.75,-0.04,0.0,-6.37,0.0,0.36,0.32,-1.35,-0.05,0.02,-0.08,0.14,-0.04,0.01,0.01,0.0,-1.35,-0.03,0.0,0.01
85,"A B.C. woman says her husband, a Canadian citizen, has died in China after demonstrating possible symptoms of the novel coronavirus, and hopes Global Affairs Canada will fight to discover the truth about his death.","Best S20 Ultra cases, chargers and accessories",1.0,180.0,35.0,8.0,12.0,4.0,12.0,5.142857142857143,0.0,0.0,0.0,0.0,8.571428571428571,33.0,0.0,0.0,0.0,0.0,0.0,3.0,0.0,0.0,33.0,0.0,0.0,3.0,140.0,28.0,7.0,6.0,3.0,5.0,-0.57,0.0,0.0,0.0,0.0,8.57,26.0,0.0,0.0,0.0,0.0,0.0,3.0,0.0,0.0,26.0,0.0,0.0,3.0,-12.43,-2.4,-0.56,-0.53,0.24,-2.86,-0.04,0.0,-6.53,0.0,0.33,0.38,-1.27,-0.05,0.02,-0.09,0.13,-0.05,0.03,0.01,0.0,-1.27,-0.03,0.0,0.03
86,"When Erin Boisvert showed up for work at her elementary school in Whistler on Feb. 5, 2010, it was just supposed to be another day. Little did she know that later that day she would be an Olympic torchbearer, one of 12,000 chosen for the 2010 Winter Games tor…","Canadian miner Teck Resources announced it will drop plans for its controversial Frontier oil sands project in Alberta, Canada. The project gripped the Canadian public for months, sparking a heated debate about the economy and the environment.",1.0,212.0,49.0,8.0,14.0,3.0,16.333333333333332,4.326530612244898,0.0,37.5,0.0,2.0408163265306123,0.0,41.0,0.0,0.0,0.0,5.0,0.0,5.0,0.0,0.0,41.0,0.0,0.0,5.0,5.0,12.0,3.0,-3.0,0.0,-2.17,-1.27,0.0,37.5,0.0,2.04,-2.7,13.0,0.0,0.0,0.0,5.0,0.0,3.0,0.0,0.0,13.0,0.0,0.0,3.0,-11.79,-2.18,-0.53,-0.49,0.25,-2.91,-0.05,0.0,-6.25,0.0,0.33,0.35,-1.09,-0.05,0.02,-0.09,0.18,-0.05,0.08,0.01,0.0,-1.09,-0.03,0.0,0.08
87,We've been hearing different numbers on the size of Alberta's oilsands emissions. Here's what's behind the discrepancy.,"John Avlon writes that while ""Bernie Sanders is the Democratic front-runner after trailing Joe Biden in the polls for most of the campaign. Now, he has momentum. But can Bernie win?"" The answer lies in the swing states, where ideological voters tend to fair w…",1.0,103.0,17.0,5.0,5.0,3.0,8.5,6.0588235294117645,0.0,20.0,0.0,0.0,0.0,15.0,0.0,0.0,0.0,0.0,0.0,0.0,0.0,0.0,15.0,0.0,0.0,0.0,-113.0,-28.0,-4.0,-11.0,0.0,-3.0,1.26,-1.0,8.89,0.0,-4.44,-2.22,-24.0,0.0,0.0,-1.0,0.0,0.0,-1.0,0.0,0.0,-24.0,0.0,0.0,-1.0,-12.4,-2.33,-0.53,-0.56,0.25,-3.05,-0.04,0.0,-6.17,0.0,0.3,0.33,-1.22,-0.05,0.02,-0.09,0.17,-0.05,0.07,0.01,0.0,-1.22,-0.03,-0.0,0.07
88,"Energy stocks are getting hammered, but UBS said there are two names that investors should bet on.","Durable and versatile enough to act as a picnic blanket, beach towel or stylish scarf, this towel is life-changing for frequent travelers.",1.0,82.0,17.0,7.0,5.0,2.0,17.0,4.823529411764706,0.0,28.57142857142857,0.0,0.0,0.0,15.0,0.0,0.0,0.0,1.0,0.0,0.0,0.0,0.0,15.0,0.0,0.0,0.0,-35.0,-5.0,5.0,-2.0,0.0,-5.0,-0.49,0.0,-21.43,0.0,-13.64,0.0,-5.0,0.0,0.0,0.0,1.0,0.0,0.0,0.0,0.0,-5.0,0.0,0.0,0.0,-13.23,-2.48,-0.51,-0.63,0.24,-3.1,-0.04,0.0,-6.0,0.0,0.28,0.3,-1.34,-0.05,0.02,-0.09,0.18,-0.05,0.06,0.01,0.0,-1.34,-0.03,-0.0,0.06
89,"After its energy business dipped in 2019, Tesla is under pressure to ramp up hiring and production at its solar panel factory in Buffalo, New York.","The Virginia legislative session comes to a close Saturday, as state lawmakers will adjourn their 60-day session.",1.0,122.0,26.0,3.0,11.0,2.0,26.0,4.6923076923076925,0.0,33.33333333333333,0.0,0.0,0.0,22.0,0.0,0.0,0.0,1.0,0.0,2.0,0.0,0.0,22.0,0.0,0.0,2.0,25.0,9.0,0.0,4.0,0.0,9.0,-1.01,0.0,33.33,0.0,0.0,0.0,5.0,0.0,0.0,0.0,1.0,0.0,1.0,0.0,0.0,5.0,0.0,0.0,1.0,-13.6,-2.53,-0.54,-0.63,0.24,-3.04,-0.05,0.0,-5.78,0.0,0.25,0.27,-1.38,-0.05,0.02,-0.09,0.18,-0.05,0.07,0.01,0.0,-1.38,-0.03,-0.0,0.07
90,"OPEC and its allied oil-producing nations are still working well together and still have options to try to rebalance global crude markets, Saudi Energy Minister Prince Abdulaziz bin Salman said Tuesday.","Lynda Doughty's nonprofit, Marine Mammals of Maine, responds to marine animal strandings and provides rehabilitative care for critically ill and injured seals.",1.0,172.0,31.0,6.0,13.0,2.0,31.0,5.548387096774194,0.0,16.666666666666664,0.0,3.225806451612903,3.225806451612903,25.0,0.0,0.0,0.0,0.0,0.0,1.0,0.0,0.0,25.0,0.0,0.0,1.0,34.0,9.0,3.0,4.0,0.0,9.0,-0.72,0.0,16.67,0.0,3.23,3.23,5.0,0.0,0.0,0.0,0.0,0.0,1.0,0.0,0.0,5.0,0.0,0.0,1.0,-13.41,-2.52,-0.53,-0.61,0.23,-2.93,-0.05,0.0,-5.75,0.0,0.26,0.28,-1.39,-0.05,0.02,-0.09,0.18,-0.05,0.07,0.01,0.0,-1.39,-0.03,-0.0,0.07
91,"Vladimir Putin just sparked what could end up being one of the ugliest oil price wars in modern history, and American oil and gas companies may be the victims.","You may have trouble falling asleep at night, like me and countless others. Dodow is looking to change that, one insomniac at a time, with its sleep aid that focuses on calm breathing.",1.0,131.0,29.0,6.0,10.0,2.0,29.0,4.517241379310345,0.0,16.666666666666664,0.0,3.4482758620689653,3.4482758620689653,23.0,0.0,0.0,0.0,1.0,0.0,0.0,0.0,0.0,23.0,0.0,0.0,0.0,-21.0,-4.0,-1.0,1.0,-1.0,12.5,-0.09,0.0,2.38,0.0,-2.61,-2.61,-8.0,0.0,0.0,0.0,0.0,0.0,-1.0,0.0,0.0,-8.0,-1.0,0.0,-1.0,-13.67,-2.53,-0.52,-0.62,0.23,-2.84,-0.05,0.0,-5.72,0.0,0.27,0.29,-1.42,-0.05,0.02,-0.09,0.18,-0.05,0.06,0.01,0.0,-1.42,-0.03,-0.0,0.06
92,"The cascade in bond yields and call for more spending from Washington will result in ""the trade of our lifetime,"" said Wall Street veteran and Bear Traps Report author Lawrence McDonald.","The coronavirus that has devastated China is also hurting the small businesses that shape everyday life in every corner of the world. The food we eat, the work we do and the clothes we wear -- many are reminders of the vital role China plays in the global eco…",1.0,156.0,31.0,4.0,16.0,2.0,31.0,5.032258064516129,0.0,0.0,0.0,0.0,0.0,27.0,0.0,0.0,0.0,0.0,0.0,0.0,0.0,0.0,27.0,0.0,1.0,0.0,-56.0,-18.0,-6.0,3.0,0.0,6.5,0.71,0.0,-20.0,0.0,-2.04,-4.08,-3.0,0.0,0.0,-1.0,0.0,-3.0,0.0,0.0,0.0,-3.0,0.0,-2.0,0.0,-13.65,-2.53,-0.53,-0.57,0.22,-2.74,-0.05,0.0,-5.87,0.0,0.25,0.26,-1.4,-0.05,0.02,-0.1,0.17,-0.05,0.05,0.01,0.0,-1.4,-0.03,0.01,0.05
93,Oil is trading below key breakeven levels for the industry. Here's what could happen next.,"It's one of the largest industries in the world, with $5.7 trillion in revenue. It is responsible for an estimated 319 million jobs, or roughly one in 10 people working on the planet. And no sector is more at risk from the novel coronavirus.",1.0,76.0,15.0,5.0,4.0,3.0,7.5,5.066666666666666,0.0,20.0,0.0,0.0,0.0,15.0,0.0,0.0,0.0,0.0,0.0,0.0,0.0,0.0,15.0,0.0,0.0,0.0,-122.0,-29.0,0.0,-5.0,-2.0,-3.75,0.57,0.0,-20.0,0.0,0.0,-2.27,-18.0,0.0,0.0,0.0,-7.0,0.0,0.0,0.0,0.0,-18.0,0.0,0.0,0.0,-14.49,-2.69,-0.53,-0.65,0.23,-2.88,-0.05,0.0,-5.8,0.0,0.22,0.23,-1.52,-0.05,0.02,-0.1,0.17,-0.05,0.05,0.01,0.0,-1.52,-0.03,0.01,0.05
94,"Bank stocks, which are tethered to expectations for interest rates and loan losses, are considered an early indicator for the broader markets.","In Trump, politically conservative America has a once-in-a-generation opportunity to fundamentally alter the direction of the nation, writes Merrill Brown.",1.0,121.0,22.0,4.0,9.0,2.0,22.0,5.5,0.0,50.0,0.0,0.0,4.545454545454546,18.0,0.0,0.0,0.0,0.0,0.0,0.0,0.0,0.0,18.0,0.0,0.0,0.0,-15.0,2.0,1.0,2.0,0.0,2.0,-1.3,0.0,50.0,0.0,0.0,-0.45,0.0,0.0,0.0,0.0,0.0,0.0,0.0,0.0,0.0,0.0,0.0,0.0,0.0,-14.84,-2.77,-0.55,-0.67,0.22,-2.87,-0.05,0.0,-5.42,0.0,0.2,0.25,-1.6,-0.05,0.02,-0.1,0.16,-0.05,0.04,0.01,0.0,-1.6,-0.03,0.01,0.04
95,Credit Suisse scanned more than 100 ESG funds to find the most commonly owned stocks.,"Gideon Lewin, who worked with famed photographer Richard Avedon for 16 years, recounts his experiences in a new book.",1.0,71.0,15.0,2.0,4.0,2.0,15.0,4.733333333333333,0.0,0.0,0.0,0.0,0.0,15.0,0.0,0.0,1.0,1.0,0.0,0.0,0.0,0.0,15.0,0.0,0.0,0.0,-28.0,-4.0,0.0,-4.0,0.0,-4.0,-0.48,0.0,0.0,0.0,-10.53,0.0,-4.0,0.0,0.0,1.0,0.0,0.0,-1.0,0.0,0.0,-4.0,0.0,0.0,-1.0,-15.7,-2.93,-0.58,-0.74,0.22,-2.93,-0.06,0.0,-5.57,0.0,0.17,0.23,-1.7,-0.05,0.02,-0.09,0.16,-0.05,0.03,0.01,0.0,-1.7,-0.03,0.0,0.03
96,"The Defense Department is asking for $705.4 billion in its fiscal 2021 budget, which is actually $13 billion less than what Congress gave the Pentagon in fiscal 2020.","Pete Buttigieg is ramping up his Super Tuesday operation, aides tell CNN, committing to add more than five dozen staffers to the delegate-rich states that will vote in early March.",1.0,139.0,28.0,4.0,5.0,3.0,14.5,4.964285714285714,0.0,50.0,0.0,0.0,0.0,20.0,0.0,0.0,0.0,6.0,0.0,1.0,0.0,0.0,20.0,0.0,0.0,1.0,-12.0,-2.0,-3.0,-6.0,1.0,-15.5,-0.07,0.0,35.71,0.0,0.0,0.0,-8.0,0.0,0.0,0.0,5.0,0.0,0.0,0.0,0.0,-8.0,0.0,0.0,0.0,-15.84,-2.94,-0.59,-0.8,0.22,-3.0,-0.06,0.0,-5.2,0.0,0.15,0.2,-1.76,-0.05,0.02,-0.09,0.22,-0.05,0.03,0.01,0.0,-1.76,-0.03,0.0,0.03
97,Jeremy Siegel criticized President Donald Trump's response to the coronavirus outbreak and called for fiscal stimulus to help the economy.,"Security experts have long warned that the cannabis industry is susceptible to both cybercriminal and fraudulent activities; and although businesses and regulations have matured, those risks and concerns haven't waned.",1.0,119.0,20.0,3.0,10.0,2.0,20.0,5.95,0.0,0.0,0.0,0.0,10.0,16.0,0.0,0.0,0.0,0.0,0.0,0.0,0.0,0.0,16.0,0.0,0.0,0.0,-70.0,-10.0,-4.0,1.0,0.0,-10.0,-0.35,0.0,-14.29,0.0,0.0,-6.67,-8.0,0.0,0.0,0.0,0.0,0.0,0.0,0.0,0.0,-8.0,0.0,0.0,0.0,-16.18,-3.04,-0.61,-0.81,0.22,-3.01,-0.05,0.0,-5.35,0.0,0.13,0.28,-1.85,-0.05,0.02,-0.09,0.21,-0.05,0.02,0.01,0.0,-1.85,-0.03,0.0,0.02
