0,"Final Fantasy VII Remake is being split into a yet-to-be-determined number of separate games. For the first, Square Enix chose to highlight Midgar exclusively. After playing a recent demo in New York, the answer to how the developer would turn a few hours of …","Perhaps no song among the many from ""West Side Story"" that have been fixed in generational memory for over 60 years better expresses American musical theater's energy and promise than ""Something's Coming."" It's what Tony, the ill-fated gang member and star-cr…",0.0,216.0,45.0,8.0,16.0,3.0,15.0,4.8,0.0,12.5,0.0,0.0,2.2222222222222223,35.0,0.0,0.0,1.0,0.0,0.0,0.0,0.0,0.0,35.0,0.0,0.0,0.0,-4.0,4.0,4.0,-1.0,1.0,-6.0,-0.57,0.0,-12.5,0.0,-4.88,-0.22,-2.0,0.0,0.0,0.0,-1.0,0.0,0.0,0.0,0.0,-2.0,0.0,0.0,0.0,47.65,12.32,2.27,4.33,0.71,-8.94,-0.41,-0.02,-7.12,0.0,-2.1,-0.03,7.94,-0.06,0.0,0.77,-0.45,-0.07,-0.79,-0.01,0.0,7.94,-0.03,-0.07,-0.79
1,The T-Mobile / Sprint merger has been approved by a federal court in the latest giant telecom deal. We read the Judge’s 173-page decision so you don’t have to.,"Emergency crews rescued a paraglider after he got tangled in electric lines while attempting to land in Olivehurst, California. The paraglider dangled for hours while fire officials coordinated with Pacific Gas and Electric to make sure all the energy was dra…",0.0,131.0,29.0,7.0,11.0,3.0,14.5,4.517241379310345,0.0,14.285714285714285,0.0,0.0,0.0,27.0,0.0,1.0,0.0,0.0,0.0,1.0,0.0,0.0,27.0,0.0,0.0,1.0,-89.0,-12.0,-3.0,-2.0,1.0,-6.0,-0.85,0.0,4.29,0.0,0.0,-2.44,-6.0,0.0,1.0,-1.0,0.0,0.0,0.0,0.0,0.0,-6.0,0.0,0.0,0.0,5.15,4.32,1.77,1.83,0.71,-9.19,-0.55,-0.02,-6.23,0.0,-2.1,-1.14,3.94,-0.06,0.5,0.27,-0.45,-0.07,-0.29,-0.01,0.0,3.94,-0.03,-0.07,-0.29
2,"Teck pulls out of $20B oilsands project CBC News Alberta NDP says premier's polarizing environmental approach killed Teck mine EverythingGP Teck withdraws application for $20B Frontier oilsands mine CBC.ca Braid: As Teck shelves $20B oilsands project, Kenney …","President Donald Trump's top trade adviser, Peter Navarro, has been leading the charge inside the West Wing that Victoria Coates is the author of the book ""Anonymous,"" according to three people familiar with the situation.",0.0,223.0,38.0,6.0,23.0,2.0,19.5,5.868421052631579,0.0,0.0,0.0,2.631578947368421,2.631578947368421,26.0,0.0,0.0,0.0,3.0,0.0,0.0,0.0,0.0,26.0,2.0,0.0,0.0,35.0,3.0,1.0,7.0,0.0,-15.5,0.5,0.0,-40.0,0.0,-3.08,2.63,-4.0,0.0,0.0,0.0,2.0,0.0,0.0,0.0,0.0,-4.0,2.0,0.0,0.0,21.65,4.65,1.27,5.0,0.38,-7.6,-0.14,-0.02,-10.69,0.0,-1.22,-0.63,2.27,-0.06,0.33,0.1,0.55,-0.07,-0.46,-0.01,0.0,2.27,0.64,-0.07,-0.46
3,Husky CEO slams Ottawa for derailing projects with politics Yahoo Canada Finance Husky Energy CEO blames regulatory process 'that just went on and on' for end of Teck Frontier mine CBC.ca Experts say Alberta hasn’t learned the lesson about climate change and …,It could be a good thing: More sunlight year-round and no losing an hour of sleep. All the states need now is approval from Congress.,0.0,218.0,43.0,6.0,26.0,2.0,22.0,5.069767441860465,0.0,0.0,0.0,0.0,0.0,35.0,0.0,0.0,0.0,0.0,0.0,0.0,0.0,0.0,35.0,1.0,0.0,0.0,109.0,18.0,1.0,19.0,-1.0,9.5,0.71,0.0,-40.0,0.0,-8.0,-4.0,10.0,0.0,0.0,0.0,0.0,0.0,0.0,0.0,0.0,10.0,1.0,0.0,0.0,28.65,6.07,1.02,7.33,0.21,-6.19,-0.14,-0.02,-12.93,0.0,-1.44,-1.04,3.69,-0.06,0.25,0.02,0.3,-0.07,-0.54,-0.01,0.0,3.69,0.72,-0.07,-0.54
4,CN trains back up and running but recovery 'will take several weeks' Yahoo Canada Finance CN employees heading back to work after temporary layoffs as blockades wind down CTV News 'We've got 10 months': CN CEO aims to hit forecasts despite blockades BNNBloomb…,"Republican Sen. John Cornyn Wednesday blasted the socialist vision of Democratic presidential candidate Bernie Sanders and said it's critical Republicans keep control of the Senate to be a ""firewall"" against the Vermont senator's policies in case he's elected.",0.0,218.0,43.0,10.0,19.0,1.0,43.0,5.069767441860465,0.0,0.0,0.0,4.651162790697675,0.0,34.0,0.0,0.0,0.0,2.0,0.0,0.0,0.0,0.0,34.0,0.0,0.0,0.0,-5.0,5.0,3.0,3.0,-2.0,24.0,-0.8,0.0,-14.29,0.0,4.65,-5.26,1.0,0.0,0.0,0.0,2.0,0.0,0.0,0.0,0.0,1.0,0.0,0.0,0.0,32.85,6.92,1.67,7.33,-0.09,-1.14,-0.14,-0.02,-14.27,0.0,-0.64,-1.28,4.34,-0.06,0.2,-0.03,0.55,-0.07,-0.59,-0.01,0.0,4.34,0.57,-0.07,-0.59
5,"Stock market news live: Wall Street dives on coronavirus panic, stocks have worst day in 2 years Yahoo Canada Finance Dow plunges more than 800 points as pandemic fears rise Kitco NEWS Wall Street opens deep in red on coronavirus fears, Nasdaq is down 3% FXSt…","There is something curiously and unexpectedly satisfying about Alastair Philip Wiper's images of factories, laboratories and industrial facilities.",0.0,215.0,46.0,6.0,27.0,1.0,46.0,4.673913043478261,0.0,16.666666666666664,0.0,0.0,8.695652173913043,36.0,0.0,0.0,0.0,3.0,0.0,0.0,0.0,0.0,36.0,0.0,0.0,0.0,85.0,28.0,4.0,19.0,-1.0,28.0,-2.55,0.0,-33.33,0.0,-5.56,3.14,20.0,0.0,0.0,0.0,3.0,0.0,0.0,0.0,0.0,20.0,0.0,0.0,0.0,35.15,7.99,1.44,8.66,-0.29,2.73,-0.21,-0.02,-12.38,0.0,-0.88,0.01,5.11,-0.06,0.17,-0.06,0.88,-0.07,-0.62,-0.01,0.0,5.11,0.47,-0.07,-0.62
6,Sharon Osbourne debuts new white blonde hair after dramatic colour transformation Yahoo News Sharon Osbourne rocks dramatic white hair transformation CNN Sharon Osbourne Debuted a Dramatic Hair Transformation After Two Decades of Red InStyle Sharon Osbourne D…,"Please, Mr. President, re-think this one. Richard Grenell, as close a friend and ally as he might be, is very much the wrong man at the wrong time as acting Director of National Intelligence. He is a catastrophe-in-waiting who will be in a position he is tota…",0.0,224.0,37.0,3.0,24.0,1.0,37.0,6.054054054054054,0.0,0.0,0.0,0.0,0.0,21.0,0.0,0.0,0.0,1.0,0.0,0.0,0.0,0.0,21.0,0.0,0.0,0.0,10.0,-10.0,-5.0,10.0,-3.0,25.25,1.5,0.0,-50.0,0.0,0.0,-4.26,-11.0,0.0,0.0,0.0,0.0,0.0,-2.0,0.0,0.0,-11.0,0.0,0.0,-2.0,38.08,7.46,0.84,9.19,-0.43,4.21,-0.06,-0.02,-13.42,0.0,-1.06,-0.31,3.51,-0.06,0.14,-0.09,0.84,-0.07,-0.65,-0.01,0.0,3.51,0.4,-0.07,-0.65
7,U.S. Stock Futures Swing to Gains After BOJ Emergency Act Yahoo Canada Finance BOJ reassurance on coronavirus bolsters speculation of global policy action Investing.com Tokyo stocks rebound after BOJ's stability pledge Nikkei Asian Review Stock Slide Halts on…,"Space weather has more implications than causing glitches in Earth's satellite-based communications -- it can also strand gray whales, according to a new study. Typically, space weather is created when solar storms occur on the sun and stream out toward Earth…",0.0,223.0,38.0,1.0,31.0,4.0,10.0,5.868421052631579,0.0,0.0,0.0,5.263157894736842,0.0,34.0,0.0,0.0,0.0,0.0,0.0,0.0,0.0,0.0,34.0,0.0,0.0,0.0,3.0,-3.0,-7.0,16.0,2.0,-10.5,0.5,0.0,-12.5,0.0,5.26,-2.44,-5.0,0.0,0.0,0.0,0.0,0.0,-1.0,0.0,0.0,-5.0,0.0,0.0,-1.0,40.15,7.2,0.14,10.46,-0.17,1.94,0.03,-0.02,-14.19,0.0,-0.53,-0.56,3.94,-0.06,0.12,-0.1,0.68,-0.07,-0.67,-0.01,0.0,3.94,0.34,-0.07,-0.67
8,"BEIJING/SINGAPORE/NEW YORK, Feb 13 (Reuters) - The coronavirus's effect on energy markets is worsening, as the sharp fall in demand in China, the world&#...","Most investors only think about electric cars when they think about Tesla. But the company's solar power and storage battery business could be a major factor in the performance of Tesla shares, according to a new analyst note.",0.0,133.0,24.0,2.0,12.0,2.0,24.0,5.541666666666667,0.0,50.0,0.0,4.166666666666666,8.333333333333332,20.0,0.0,0.0,0.0,1.0,0.0,0.0,0.0,0.0,20.0,0.0,0.0,0.0,-56.0,-14.0,-3.0,-2.0,-1.0,5.0,0.57,0.0,30.0,0.0,4.17,8.33,-10.0,0.0,0.0,0.0,1.0,0.0,0.0,0.0,0.0,-10.0,0.0,0.0,0.0,31.76,5.43,-0.29,9.33,-0.18,1.73,0.07,-0.02,-9.24,0.0,-0.24,0.18,2.72,-0.06,0.11,-0.12,0.66,-0.07,-0.68,-0.01,0.0,2.72,0.3,-0.07,-0.68
9,"NEW YORK/LONDON (Reuters) - Exxon and Chevron boasted to investors this week about booming U.S. oil production, illustrating how the gap has widened - at least in words - between top American oil and gas companies and their European rivals over efforts to tra…","Not long after Valentine's Day ends, a massive asteroid estimated to be between 1,443 feet and 3,248 feet long will pass by Earth around 6:05 a.m. ET on Saturday. Based on the size range, it could be anywhere between the size of a suspension bridge to taller …",0.0,217.0,44.0,6.0,17.0,3.0,15.0,4.931818181818182,0.0,0.0,0.0,4.545454545454546,0.0,34.0,0.0,0.0,0.0,0.0,0.0,1.0,0.0,0.0,34.0,0.0,0.0,1.0,4.0,-4.0,-3.0,2.0,-1.0,2.75,0.49,0.0,-22.22,0.0,4.55,0.0,4.0,0.0,0.0,0.0,-3.0,0.0,0.0,0.0,0.0,4.0,0.0,0.0,0.0,33.45,6.02,-0.23,8.93,-0.09,0.66,0.03,-0.02,-10.28,0.0,0.03,-0.06,3.14,-0.06,0.1,-0.13,0.55,-0.07,-0.59,-0.01,0.0,3.14,0.27,-0.07,-0.59
10,"A Seattle scientist estimates that a ""few hundred"" residents of Washington state alone may already have been infected with the deadly new coronavirus.",The week that gave Joe Biden a sorely needed political comeback also dealt Donald Trump some of the greatest challenges of his presidency.,0.0,128.0,23.0,4.0,7.0,2.0,23.0,5.565217391304348,0.0,25.0,0.0,0.0,8.695652173913043,23.0,0.0,0.0,0.0,1.0,0.0,0.0,0.0,0.0,23.0,0.0,0.0,0.0,12.0,0.0,1.0,-1.0,0.0,0.0,0.52,0.0,25.0,0.0,-4.35,4.35,2.0,0.0,0.0,-1.0,1.0,0.0,-1.0,0.0,0.0,2.0,0.0,0.0,-1.0,26.74,4.59,-0.37,7.69,-0.11,0.52,0.06,-0.02,-8.85,0.0,-0.16,0.53,2.49,-0.06,0.09,-0.14,0.55,-0.07,-0.61,-0.01,0.0,2.49,0.24,-0.07,-0.61
11,A push to end the practice of changing clocks twice a year is gaining steam in parts of the U.S. Should daylight saving time be abolished nationwide?,Australia was already grappling with extreme heat and one of the worst droughts on record when devastating bushfires tore through the bone dry land.,0.0,123.0,27.0,8.0,9.0,3.0,9.333333333333334,4.555555555555555,1.0,25.0,0.0,3.7037037037037033,0.0,23.0,0.0,0.0,0.0,0.0,0.0,0.0,0.0,0.0,23.0,0.0,0.0,0.0,-2.0,3.0,5.0,2.0,1.0,-14.67,-0.65,1.0,-8.33,0.0,3.7,-8.33,1.0,0.0,0.0,0.0,-1.0,0.0,0.0,0.0,0.0,1.0,0.0,0.0,0.0,20.73,3.74,-0.15,6.83,-0.04,-0.74,0.0,0.06,-7.67,0.0,-0.02,0.3,1.94,-0.06,0.08,-0.15,0.47,-0.07,-0.62,-0.01,0.0,1.94,0.22,-0.07,-0.62
12,"QUETTA, Pakistan: - At least 10 people were killed in a suicide blast that hit a police vehicle in southwestern Pakistan on Monday, officials said.  Two poli...","Alejandro Fernández anuncia las fechas de su gira ""Hecho en México"" para 2020 en México, Estados Unidos, Canadá y Europa",0.0,133.0,27.0,4.0,11.0,3.0,13.5,4.925925925925926,0.0,25.0,0.0,0.0,7.4074074074074066,24.0,0.0,0.0,0.0,2.0,0.0,0.0,0.0,0.0,24.0,0.0,0.0,0.0,32.0,7.0,3.0,-1.0,2.0,-6.5,-0.12,0.0,25.0,0.0,0.0,7.41,6.0,-6.0,0.0,0.0,1.0,0.0,0.0,0.0,0.0,6.0,0.0,0.0,0.0,16.42,3.01,-0.27,6.25,0.02,-1.49,-0.02,0.06,-6.66,0.0,-0.18,0.67,1.56,-0.06,0.08,-0.15,0.55,-0.07,-0.64,-0.01,0.0,1.56,0.2,-0.07,-0.64
13,"Is this the result of Donald Trump's ""diplomacy""?","Deputy national security adviser Victoria Coates is leaving the National Security Council and going to the Energy Department, according to a statement released by the council on Thursday.",0.0,42.0,8.0,1.0,4.0,1.0,8.0,5.25,1.0,0.0,0.0,0.0,0.0,8.0,0.0,0.0,0.0,0.0,0.0,0.0,0.0,0.0,8.0,0.0,0.0,0.0,-118.0,-20.0,-4.0,-9.0,-1.0,-20.0,-0.46,1.0,-20.0,0.0,0.0,0.0,-15.0,0.0,0.0,0.0,0.0,0.0,0.0,0.0,0.0,-15.0,0.0,0.0,0.0,6.22,1.03,-0.59,5.26,-0.08,-2.52,-0.01,0.12,-7.59,0.0,-0.31,0.46,0.08,-0.06,0.07,-0.16,0.48,-0.07,-0.65,-0.01,0.0,0.08,0.18,-0.07,-0.65
14,"Environmental groups have accused Amazon chief Jeff Bezos of paying lip service to the climate crisis after he pledged to spend $10bn to combat global warming, to which his massive online empire has contributed millions of tonnes in carbon emissions.Several g…","One septuagenarian New Yorker is a ""5'4"" mass of dead energy."" The other septuagenarian New Yorker is a ""carnival barking clown."" Both are hoping to be president next year.",0.0,220.0,41.0,8.0,14.0,2.0,21.0,5.365853658536586,0.0,0.0,0.0,0.0,2.4390243902439024,35.0,0.0,0.0,0.0,1.0,0.0,2.0,0.0,0.0,35.0,0.0,0.0,2.0,76.0,12.0,2.0,4.0,-2.0,10.67,0.4,0.0,-66.67,0.0,0.0,-1.01,16.0,0.0,0.0,0.0,-2.0,0.0,2.0,0.0,0.0,16.0,0.0,0.0,2.0,9.25,1.52,-0.4,5.06,-0.09,-2.55,-0.0,0.11,-8.39,0.0,-0.43,0.44,0.61,-0.06,0.07,-0.16,0.48,-0.07,-0.52,-0.01,0.0,0.61,0.17,-0.07,-0.52
15,"(Bloomberg) -- Welcome to the Brussels Edition, Bloomberg’s daily briefing on what matters most in the heart of the European Union. Sign up here to get it in your inbox every weekday morning.Weeks after Alphabet chief Sundar Pichai visited the European Union …","Sen. Bernie Sanders on the campaign trail Saturday attacked former New York Mayor Michael Bloomberg's previous policy positions, saying ""all his money"" will not be enough to produce the voter turnout needed to defeat President Donald Trump.",0.0,218.0,43.0,6.0,17.0,3.0,14.666666666666666,5.069767441860465,0.0,0.0,0.0,0.0,0.0,33.0,1.0,0.0,1.0,0.0,0.0,2.0,0.0,0.0,33.0,0.0,0.0,2.0,14.0,6.0,-1.0,-2.0,0.0,-3.83,-0.44,0.0,-14.29,0.0,-5.41,0.0,0.0,1.0,0.0,1.0,0.0,0.0,1.0,0.0,0.0,0.0,0.0,0.0,1.0,11.78,2.07,-0.35,5.08,-0.04,-2.97,-0.01,0.1,-9.09,0.0,-0.54,0.28,0.94,0.0,0.06,-0.1,0.42,-0.07,-0.41,-0.01,0.0,0.94,0.16,-0.07,-0.41
16,"Bernie Sanders and Elizabeth Warren endorsed her, Texas' largest labor union is on her side and she surpassed $1 million in donors. Jessica Cisneros, who at 26 would become the youngest member of Congress, is the best shot liberal activists could've taken for…","Former New York Mayor Michael Bloomberg attacked Bernie Sanders on Monday in a new digital ad featuring aggressive and derogatory tweets, memes and videos purportedly posted by the Vermont senator's online supporters.",0.0,218.0,43.0,9.0,15.0,2.0,21.5,5.069767441860465,0.0,22.22222222222222,0.0,4.651162790697675,0.0,37.0,0.0,0.0,0.0,3.0,0.0,3.0,0.0,0.0,37.0,0.0,0.0,3.0,32.0,11.0,6.0,0.0,0.0,-10.5,-0.74,0.0,22.22,0.0,4.65,-6.25,7.0,0.0,0.0,0.0,3.0,0.0,3.0,0.0,0.0,7.0,0.0,0.0,3.0,14.0,2.56,-0.14,4.98,-0.05,-2.94,-0.02,0.1,-8.41,0.0,-0.35,0.13,1.47,-0.0,0.06,-0.11,0.55,-0.07,-0.26,-0.01,0.0,1.47,0.15,-0.07,-0.26
17,"Though astrophysicists do not know the source of the radio signal, it's almost definitely not aliens.","Republican Sen. John Cornyn Wednesday blasted the socialist vision of Democratic presidential candidate Bernie Sanders and said it's critical Republicans keep control of the Senate to be a ""firewall"" against the Vermont senator's policies in case he's elected.",0.0,86.0,16.0,3.0,5.0,2.0,16.0,5.375,0.0,0.0,0.0,0.0,0.0,12.0,0.0,0.0,0.0,0.0,0.0,0.0,0.0,0.0,12.0,0.0,0.0,0.0,-137.0,-22.0,-4.0,-11.0,-1.0,-3.0,-0.49,0.0,-14.29,0.0,0.0,-5.26,-21.0,0.0,0.0,0.0,0.0,0.0,0.0,0.0,0.0,-21.0,0.0,0.0,0.0,8.65,1.49,-0.29,4.33,-0.07,-3.21,-0.01,0.09,-9.03,0.0,-0.45,-0.0,0.55,-0.0,0.06,-0.12,0.49,-0.07,-0.29,-0.01,0.0,0.55,0.14,-0.07,-0.29
18,(Bloomberg) -- Saudi Arabia’s Crown Prince Mohammed bin Salman has just started an oil-price war. Winning it will come at a cost he might not be ready to pay for long.If oil prices fail to recover and stay at less than half the level Saudi Arabia needs to bal…,"Andrew Yang plans to announce he is suspending his presidential campaign during a speech Tuesday night in New Hampshire, two sources tell CNN.",0.0,212.0,49.0,14.0,16.0,3.0,16.666666666666668,4.326530612244898,0.0,7.142857142857142,0.0,4.081632653061225,2.0408163265306123,42.0,0.0,0.0,0.0,0.0,0.0,2.0,0.0,0.0,42.0,0.0,0.0,2.0,92.0,26.0,9.0,6.0,1.0,-6.33,-0.89,0.0,-12.86,0.0,4.08,2.04,19.0,0.0,0.0,0.0,-1.0,0.0,0.0,0.0,0.0,19.0,0.0,0.0,0.0,10.49,2.27,0.16,4.33,-0.03,-3.43,-0.05,0.09,-9.21,0.0,-0.32,-0.02,1.31,-0.01,0.05,-0.12,0.44,-0.07,-0.21,-0.01,0.0,1.31,0.13,-0.07,-0.21
19,"Somalia's 2-million strong diaspora has a huge role to play as the Horn of Africa country rebuilds its economy and resets ties with major international institutions after three decades as a ""failed state,"" Somalia's finance minister said. Long saddled with $5…","The Ukraine allegations that President Donald Trump's personal attorney Rudy Giuliani is providing to the Justice Department are being vetted by investigators in the US Attorney's Office in Pittsburgh, two US law enforcement officials said.",0.0,220.0,41.0,5.0,16.0,2.0,20.5,5.365853658536586,0.0,0.0,0.0,2.4390243902439024,2.4390243902439024,33.0,0.0,0.0,0.0,2.0,0.0,1.0,0.0,0.0,33.0,0.0,0.0,1.0,14.0,6.0,-1.0,-3.0,0.0,-14.5,-0.52,0.0,-33.33,0.0,2.44,-0.42,4.0,0.0,0.0,0.0,1.0,0.0,1.0,0.0,0.0,4.0,0.0,0.0,1.0,12.55,2.57,0.12,4.33,-0.04,-3.43,-0.04,0.08,-9.73,0.0,-0.29,-0.01,1.54,-0.01,0.05,-0.13,0.5,-0.07,-0.19,-0.01,0.0,1.54,0.12,-0.07,-0.19
20,"China is threatening the sovereignty of small Pacific Islands and undermining the region's stability, a top U.S. military commander said on Thursday, in comments likely to inflame tension with China. Admiral Philip Davidson - commander of the U.S. Indo-Pacifi…","With a disappointing finish in today's New Hampshire primary a near-certainty, former Vice President Joe Biden is insisting that he will remain in the race -- pointing to the more diverse electorates in Nevada and, especially, South Carolina.",0.0,222.0,39.0,5.0,18.0,6.0,6.833333333333333,5.6923076923076925,0.0,20.0,0.0,5.128205128205128,10.256410256410255,30.0,0.0,0.0,0.0,0.0,0.0,0.0,0.0,0.0,30.0,0.0,0.0,0.0,17.0,1.0,-1.0,5.0,4.0,-31.17,0.3,0.0,3.33,0.0,5.13,7.62,-1.0,0.0,0.0,0.0,0.0,0.0,-1.0,0.0,0.0,-1.0,0.0,0.0,-1.0,14.51,2.75,0.08,4.43,0.14,-4.08,-0.02,0.08,-9.25,0.0,-0.13,0.38,1.61,-0.01,0.05,-0.13,0.45,-0.07,-0.22,-0.01,0.0,1.61,0.11,-0.07,-0.22
21,"Donald Trump asks his top aides whether he is likely to get impeached during a possible second term, said Acting White House Chief of Staff Mick Mulvaney, who accused the media of trying to use Coronavirus to ""bring down"" his boss.""The president asks me, 'Do …","Mike Bloomberg's rivals savaged his claim to be the best candidate to defeat Donald Trump in November by branding him as a misogynistic, Obamacare-hating, soft-on-Wall-Street bully -- basically the rough equivalent of that other New York billionaire.",0.0,215.0,46.0,10.0,16.0,2.0,23.5,4.673913043478261,0.0,10.0,0.0,2.1739130434782608,0.0,37.0,0.0,0.0,0.0,0.0,0.0,3.0,0.0,0.0,37.0,0.0,0.0,3.0,1.0,9.0,6.0,4.0,0.0,-13.5,-1.11,0.0,-15.0,0.0,-3.23,-8.11,4.0,0.0,0.0,0.0,0.0,0.0,1.0,0.0,0.0,4.0,0.0,0.0,1.0,15.97,3.23,0.27,4.42,0.12,-3.91,-0.04,0.07,-9.27,0.0,-0.12,0.26,1.99,-0.01,0.05,-0.14,0.41,-0.07,-0.11,-0.01,0.0,1.99,0.11,-0.07,-0.11
22,"Blacks who are the descendants of slaves and black immigrants have divergent histories, levels of wealth","In South Carolina, Michael Bloomberg is something of a phantom: He won't be on the ballot in the state's Democratic primary on Saturday, but you can still feel his presence. And the dueling attachments black voters here have to the billionaire reveal a lot ab…",0.0,89.0,16.0,2.0,7.0,1.0,16.0,5.5625,0.0,50.0,0.0,0.0,12.5,14.0,0.0,0.0,0.0,0.0,0.0,0.0,0.0,0.0,14.0,0.0,0.0,0.0,-127.0,-29.0,-5.0,-10.0,-1.0,-6.5,0.76,0.0,21.43,0.0,0.0,12.5,-23.0,0.0,0.0,0.0,0.0,0.0,-2.0,0.0,0.0,-23.0,0.0,0.0,-2.0,11.82,2.36,0.1,4.03,0.06,-4.09,-0.02,0.07,-7.54,0.0,-0.21,0.69,1.33,-0.02,0.04,-0.14,0.38,-0.07,-0.14,-0.01,0.0,1.33,0.1,-0.07,-0.14
23,"Democratic legislators in Virginia have dramatically reshaped the state in two months, sweeping aside many of the state’s old business-friendly and socially conservative laws and replacing them with a broad, progressive policy agenda. Democrats had not had fu…",The spread of the coronavirus around the world is sending shockwaves through an oil market ill-prepared for a serious blow to energy demand.,0.0,223.0,38.0,7.0,11.0,2.0,19.0,5.868421052631579,0.0,0.0,0.0,5.263157894736842,2.631578947368421,30.0,0.0,0.0,1.0,1.0,0.0,1.0,0.0,0.0,30.0,0.0,0.0,1.0,105.0,15.0,5.0,2.0,0.0,-4.0,0.74,0.0,-50.0,0.0,5.26,-1.72,9.0,0.0,0.0,1.0,1.0,0.0,1.0,0.0,0.0,9.0,0.0,0.0,1.0,13.61,2.49,0.14,3.83,0.04,-4.12,0.0,0.06,-8.05,0.0,-0.07,0.68,1.4,-0.02,0.04,-0.1,0.38,-0.07,-0.12,-0.01,0.0,1.4,0.1,-0.07,-0.12
24,"ANN ARBOR, Michigan—After canceling events in Mississippi and Missouri in the hopes of avoiding an embarrassing loss in a state he carried in 2016, Sen. Bernie Sanders has pushed to make inroads with black voters in delegate-rich Michigan.But after scrapping …",Nokia has appointed an energy executive from Finnish firm Fortum to serve as its new CEO.,0.0,220.0,41.0,7.0,16.0,3.0,14.0,5.365853658536586,0.0,0.0,0.0,0.0,4.878048780487805,36.0,0.0,0.0,0.0,1.0,0.0,1.0,0.0,0.0,36.0,0.0,0.0,1.0,146.0,25.0,4.0,10.0,1.0,-2.0,0.74,0.0,0.0,0.0,0.0,4.88,20.0,0.0,0.0,0.0,1.0,0.0,0.0,0.0,0.0,20.0,0.0,0.0,0.0,15.13,2.72,0.19,3.85,0.07,-4.36,0.01,0.06,-8.51,0.0,-0.15,0.76,1.7,-0.02,0.04,-0.11,0.39,-0.07,-0.11,-0.01,0.0,1.7,0.09,-0.07,-0.11
25,"US President Donald Trump will open the world's biggest cricket stadium and watch the sun set at the famed Taj Mahal during a lightning visit to India starting Monday, but behind the spectacular optics he is expected to face a protectionist counter-punch on t…",Eva Amurri will have her third baby with only female energy and her other two children in the room with her.,0.0,217.0,44.0,8.0,17.0,1.0,44.0,4.931818181818182,0.0,12.5,0.0,4.545454545454546,0.0,36.0,0.0,0.0,0.0,0.0,0.0,1.0,0.0,0.0,36.0,0.0,0.0,1.0,129.0,23.0,6.0,10.0,-1.0,23.0,0.74,0.0,12.5,0.0,4.55,0.0,19.0,0.0,0.0,0.0,-1.0,0.0,-3.0,0.0,0.0,19.0,0.0,0.0,-3.0,16.42,3.05,0.27,3.91,0.02,-3.42,-0.0,0.06,-8.46,0.0,-0.05,0.64,1.98,-0.02,0.04,-0.11,0.36,-0.07,-0.1,-0.01,0.0,1.98,0.09,-0.07,-0.1
26,"Casketmaker Fletcher Collins drove his memorial casket from North Carolina to Los Angeles to honor Kobe Bryant and his daughter “Gigi.""","Iran has nearly tripled its stockpile of low enriched uranium since November, indicating a significant jump in production, according to a confidential report issued by the International Atomic Energy Agency, the United Nation's nuclear watchdog.",0.0,115.0,21.0,2.0,13.0,2.0,11.0,5.476190476190476,0.0,0.0,0.0,4.761904761904762,0.0,17.0,0.0,0.0,0.0,0.0,0.0,2.0,0.0,0.0,17.0,0.0,0.0,2.0,-96.0,-14.0,-4.0,-1.0,0.0,-24.0,-0.55,0.0,0.0,0.0,1.9,0.0,-14.0,0.0,0.0,0.0,0.0,0.0,1.0,0.0,0.0,-14.0,0.0,0.0,1.0,13.84,2.51,0.12,3.81,0.01,-3.77,0.01,0.05,-8.87,0.0,0.05,0.53,1.53,-0.02,0.04,-0.12,0.33,-0.07,-0.05,-0.01,0.0,1.53,0.08,-0.07,-0.05
27,"(Bloomberg) -- The Democratic presidential candidates have spent their summers at the Iowa State Fair and fall weekends at New Hampshire diners, trying to win over one voter at a time in the two early states that can make or break a campaign.Now, the campaign…",Senegal has opened what it describes as West Africa's largest wind power plant.,0.0,216.0,45.0,8.0,15.0,2.0,23.0,4.8,0.0,0.0,0.0,2.2222222222222223,4.444444444444445,37.0,0.0,0.0,0.0,2.0,0.0,1.0,0.0,0.0,37.0,0.0,0.0,1.0,149.0,32.0,5.0,9.0,0.0,10.0,-0.35,0.0,0.0,0.0,2.22,4.44,24.0,0.0,0.0,0.0,2.0,0.0,0.0,0.0,0.0,24.0,0.0,0.0,0.0,15.04,2.86,0.2,3.79,-0.0,-3.67,-0.01,0.05,-9.25,0.0,0.06,0.59,1.83,-0.02,0.04,-0.12,0.37,-0.07,-0.04,-0.01,0.0,1.83,0.08,-0.07,-0.04
28,"In the New York Times-bestselling memoir by Michael Bornstein and Debbie Bornstein Holinstat, a very young child witnesses grotesque inhumanity upon his arrival at the Nazi extermination camp","In selecting judges for top US courts, President Donald Trump has searched for reliable conservatives who would reduce federal regulatory power over the environment and energy, worker safety and consumer affairs.",0.0,164.0,28.0,1.0,16.0,1.0,28.0,5.857142857142857,0.0,0.0,0.0,0.0,10.714285714285714,24.0,0.0,0.0,0.0,0.0,0.0,1.0,0.0,0.0,24.0,0.0,0.0,1.0,-18.0,-3.0,-4.0,2.0,-1.0,-3.0,-0.01,0.0,0.0,0.0,-6.45,10.71,-3.0,0.0,0.0,0.0,0.0,0.0,1.0,0.0,0.0,-3.0,0.0,0.0,1.0,14.37,2.6,0.03,3.81,-0.05,-3.4,0.02,0.05,-9.61,0.0,-0.02,0.86,1.66,-0.03,0.03,-0.13,0.34,-0.07,-0.03,-0.01,0.0,1.66,0.07,-0.07,-0.03
29,"For decades, the cliché about American political parties has gone that ""Republicans fall in line, while Democrats fall in love."" But for a significant portion of today's Democratic electorate, that is not the case. Joe Biden's campaign came back from the brin…","Senate Republicans are sharpening their investigations involving former Vice President Joe Biden and his son's work at a Ukrainian energy company, just as the former vice president surges in the Democratic presidential race and reemerges as the front-runner f…",0.0,219.0,42.0,6.0,15.0,3.0,14.333333333333334,5.214285714285714,0.0,16.666666666666664,0.0,4.761904761904762,4.761904761904762,33.0,0.0,0.0,0.0,0.0,0.0,0.0,0.0,0.0,33.0,0.0,0.0,0.0,-3.0,3.0,2.0,-2.0,2.0,-24.67,-0.48,0.0,-8.33,0.0,2.2,2.2,3.0,0.0,0.0,0.0,0.0,0.0,-2.0,0.0,0.0,3.0,0.0,0.0,-2.0,15.58,2.82,0.04,3.8,-0.02,-3.61,0.02,0.05,-9.39,0.0,0.07,0.92,1.81,-0.03,0.03,-0.13,0.32,-0.07,-0.06,-0.01,0.0,1.81,0.07,-0.07,-0.06
30,"Here's the life of Michael Bloomberg so far — including how he made his fortune, his years in politics, and his personal life.","Republican Sen. Mitt Romney of Utah plans to vote in favor of a subpoena as part of the Senate Homeland Security and Governmental Affairs Committee's investigation into Burisma, a key decision that could advance the GOP investigation into the Ukrainian energy…",0.0,104.0,23.0,3.0,7.0,2.0,23.0,4.521739130434782,0.0,0.0,0.0,4.3478260869565215,0.0,20.0,0.0,1.0,0.0,0.0,0.0,4.0,0.0,0.0,20.0,0.0,0.0,4.0,-116.0,-18.0,-1.0,-12.0,0.0,2.5,-0.84,0.0,0.0,0.0,1.91,-2.44,-9.0,0.0,1.0,0.0,0.0,0.0,4.0,0.0,0.0,-9.0,0.0,0.0,4.0,13.0,2.42,-0.05,3.52,-0.03,-3.52,-0.01,0.04,-9.72,0.0,0.14,0.82,1.52,-0.03,0.06,-0.13,0.29,-0.07,0.05,-0.01,0.0,1.52,0.07,-0.07,0.05
