,Text,Reference,Label,# of Characters,# of Words,# of Verbs,# of Noun,# of Sentence,Average # of Words per Sentence,Average # of Characters per Words,# of Question Marks,% of Subjective Verbs,% of Passive Voice,% of Positive Words,% of Negative Words,# of Unique Wrods/Terms,# of Misspelled Words,# of Causation Terms,% of generalizing terms,% of # and quantifiers,1st person pronouns,2nd and 3rd person pronouns,Exclusive term,# of exclamation marks,Lexical,Singular pronouns(1st person),Group ref pronouns(1st person),2nd 3rd pronouns,# of Characters- sub,# of Words- sub,# of Verbs- sub,# of Noun- sub,# of Sentence- sub,Average # of Words per Sentence- sub,Average # of Characters per Words- sub,# of Question Marks- sub,% of Subjective Verbs- sub,% of Passive Voice- sub,% of Positive Words- sub,% of Negative Words- sub,# of Unique Wrods/Terms- sub,# of Misspelled Words- sub,# of Causation Terms- sub,% of generalizing terms- sub,% of # and quantifiers- sub,1st person pronouns- sub,2nd and 3rd person pronouns- sub,Exclusive term- sub,# of exclamation marks- sub,Lexical- sub,Singular pronouns(1st person)- sub,Group ref pronouns(1st person)- sub,2nd 3rd pronouns- sub,# of Characters- avg sub,# of Words- avg sub,# of Verbs- avg sub,# of Noun- avg sub,# of Sentence- avg sub,Average # of Words per Sentence- avg sub,Average # of Characters per Words- avg sub,# of Question Marks- avg sub,% of Subjective Verbs- avg sub,% of Passive Voice- avg sub,% of Positive Words- avg sub,% of Negative Words- avg sub,# of Unique Wrods/Terms- avg sub,# of Misspelled Words- avg sub,# of Causation Terms- avg sub,% of generalizing terms- avg sub,% of # and quantifiers- avg sub,1st person pronouns- avg sub,2nd and 3rd person pronouns- avg sub,Exclusive term- avg sub,# of exclamation marks- avg sub,Lexical- avg sub,Singular pronouns(1st person)- avg sub,Group ref pronouns(1st person)- avg sub,2nd 3rd pronouns- avg sub
0,CBC's Marketplace rounds up the consumer and health news you need from the week.,"Multiple outbreaks of the novel coronavirus outside of mainland China have continued to worsen, as experts warn we may be approaching pandemic levels.",1.0,67.0,14.0,2.0,6.0,2.0,14.0,4.785714285714286,0.0,0.0,0.0,0.0,0.0,12.0,0.0,0.0,0.0,0.0,0.0,1.0,0.0,0.0,12.0,0.0,0.0,1.0,-61.0,-9.0,-4.0,-1.0,0.0,-9.0,-0.78,0.0,-16.67,0.0,0.0,-4.35,-9.0,0.0,0.0,0.0,0.0,-1.0,1.0,0.0,0.0,-9.0,0.0,-1.0,1.0,-93.55,-16.7,-3.45,-6.0,-0.15,-10.53,-0.44,0.0,-9.05,0.0,-1.7,-3.11,-14.0,0.0,0.0,-0.1,-0.4,-0.05,0.55,-0.05,0.0,-14.0,0.0,-0.05,0.55
1,"Syrian troops backed by Russian forces have been battling since December to eradicate the last rebel strongholds in the region in a war that has killed an estimated 400,000 Syrians and left much of Syria in ruins.","The Trump administration wants to slash billions of dollars in federal support from Medicaid, food stamps and other safety net programs for the poor, while largely sparing the Medicare program that benefits seniors.",1.0,177.0,37.0,9.0,10.0,2.0,37.0,4.783783783783784,0.0,11.11111111111111,0.0,0.0,5.405405405405405,32.0,0.0,0.0,0.0,1.0,0.0,0.0,0.0,0.0,32.0,0.0,0.0,0.0,-6.0,4.0,6.0,-5.0,0.0,4.0,-0.76,0.0,11.11,0.0,-6.06,2.38,1.0,0.0,0.0,0.0,1.0,0.0,0.0,0.0,0.0,1.0,0.0,0.0,0.0,-38.55,-5.2,0.05,-4.0,-0.15,0.97,-0.44,0.0,-3.49,0.0,-1.7,-0.41,-4.0,0.0,0.0,-0.1,0.1,-0.05,0.05,-0.05,0.0,-4.0,0.0,-0.05,0.05
2,"On Friday morning, more than 200 Canadian and permanent residents received their official authorization to leave their two-week coronavirus quarantine at an army base in Ontario. They talk about the challenges of the experience and what they plan to do with t…",The Centers for Disease Control and Prevention announced an investigation into a multi-state E. coli outbreak they believe is linked to Jimmy John's.,1.0,219.0,42.0,5.0,12.0,2.0,21.0,5.214285714285714,0.0,0.0,0.0,0.0,0.0,34.0,0.0,0.0,0.0,1.0,0.0,3.0,0.0,0.0,34.0,0.0,0.0,3.0,92.0,19.0,0.0,3.0,-1.0,9.5,-0.31,0.0,-20.0,0.0,0.0,-4.35,11.0,0.0,0.0,0.0,1.0,0.0,3.0,0.0,0.0,11.0,0.0,0.0,3.0,-6.22,0.3,-0.12,-2.67,-0.15,-0.53,-0.3,0.0,-5.34,0.0,-1.7,-1.31,0.0,0.0,0.0,-0.1,0.27,-0.05,0.88,-0.05,0.0,0.0,0.0,-0.05,0.88
3,"Canada's Feminist International Assistance Policy is aimed at supporting the economic, political, and social empowerment of women and girls, but the government is falling short of the mark when it comes to addressing the Rohingya genocide and refugee crisis.","The US Food and Drug Administration has issued a warning letter to the Jimmy John's sandwich chain, saying certain vegetables it served were implicated in five outbreaks of E. coli or salmonella in the past seven years.",1.0,220.0,39.0,7.0,14.0,2.0,39.0,5.641025641025641,0.0,28.57142857142857,0.0,5.128205128205128,7.6923076923076925,28.0,0.0,0.0,0.0,0.0,0.0,1.0,0.0,0.0,28.0,0.0,0.0,1.0,37.0,2.0,1.0,-2.0,-1.0,20.5,0.7,0.0,11.9,0.0,5.13,4.99,-5.0,0.0,0.0,0.0,-2.0,0.0,0.0,0.0,0.0,-5.0,0.0,0.0,0.0,10.2,2.3,0.3,-1.5,-0.15,3.23,-0.12,0.0,0.87,0.0,-0.42,0.16,0.5,0.0,0.0,-0.1,0.1,-0.05,0.8,-0.05,0.0,0.5,0.0,-0.05,0.8
4,"A global recession would likely kill more people than the coronavirus, a Canadian expert says.","The US Food and Drug Administration announced Wednesday it is requiring a boxed warning -- the agency's most prominent warning -- for the asthma and allergy medication montelukast, sold under the brand name Singulair.",1.0,80.0,15.0,3.0,5.0,2.0,15.0,5.333333333333333,0.0,0.0,0.0,0.0,13.333333333333334,15.0,0.0,0.0,0.0,0.0,0.0,0.0,0.0,0.0,15.0,0.0,0.0,0.0,-104.0,-19.0,-1.0,-9.0,0.0,-19.0,-0.08,0.0,-25.0,0.0,-2.94,4.51,-10.0,0.0,0.0,-1.0,0.0,0.0,-1.0,0.0,0.0,-10.0,0.0,0.0,-1.0,-7.95,-1.3,-0.25,-2.6,-0.15,0.68,-0.07,0.0,-1.11,0.0,-0.67,2.18,-1.8,0.0,0.0,-0.1,0.0,-0.05,0.55,-0.05,0.0,-1.8,0.0,-0.05,0.55
5,"Donald Trump declared Wednesday that the U.S. is ""very, very ready"" for whatever the coronavirus threat brings, and he put his vice-president in charge of overseeing the nation's response.","House Speaker Nancy Pelosi and Senate Minority Leader Chuck Schumer slammed President Donald Trump's budget proposal on Tuesday, with Schumer describing it as ""a blueprint for destroying America.""",1.0,160.0,29.0,4.0,11.0,4.0,10.0,5.517241379310345,0.0,25.0,0.0,3.4482758620689653,3.4482758620689653,26.0,0.0,0.0,0.0,0.0,0.0,2.0,0.0,0.0,26.0,0.0,0.0,2.0,-9.0,1.0,1.0,-7.0,2.0,-4.5,-0.52,0.0,25.0,0.0,3.45,3.45,0.0,0.0,0.0,0.0,0.0,0.0,1.0,0.0,0.0,0.0,0.0,0.0,1.0,-6.72,-1.37,-0.45,-2.33,0.18,-1.86,-0.01,0.0,1.73,0.0,-0.27,1.87,-1.5,0.0,0.0,-0.1,-0.07,-0.05,0.72,-0.05,0.0,-1.5,0.0,-0.05,0.72
6,"A Marketplace survey finds that Canadians seeking appliance repairs experience complications, whether it's an inability to access prompt service, diagnose the problem, find a part, or the expense associated with repairs and replacement. But advocates say righ…","Ordered into quarantine, a group evacuated to California from Wuhan, China, is at odds with the US Centers for Disease Control and Prevention and has petitioned for five ""critical"" changes in their conditions.",1.0,224.0,37.0,7.0,17.0,2.0,18.5,6.054054054054054,0.0,0.0,0.0,5.405405405405405,5.405405405405405,33.0,0.0,0.0,0.0,0.0,0.0,0.0,0.0,0.0,33.0,0.0,0.0,0.0,47.0,4.0,2.0,4.0,0.0,-14.5,0.69,0.0,-20.0,0.0,5.41,2.38,4.0,0.0,0.0,0.0,-1.0,0.0,-1.0,0.0,0.0,4.0,0.0,0.0,-1.0,3.31,-0.27,-0.16,-1.29,0.14,-2.45,0.11,0.0,0.19,0.0,0.3,1.93,-0.29,0.0,0.0,-0.1,-0.11,-0.05,0.55,-0.05,0.0,-0.29,0.0,-0.05,0.55
7,"An Iranian refugee who is trying to cross the border from Turkey into Greece described babies and the elderly waiting in freezing conditions, and Greek officials firing tear gas at refugees.",Here's what else you need to know to Get Up to Speed and Out the Door.,1.0,160.0,31.0,6.0,10.0,2.0,31.0,5.161290322580645,0.0,16.666666666666664,0.0,0.0,3.225806451612903,27.0,0.0,0.0,0.0,0.0,0.0,0.0,0.0,0.0,27.0,0.0,0.0,0.0,105.0,15.0,2.0,6.0,0.0,15.0,1.72,0.0,16.67,0.0,0.0,3.23,14.0,0.0,0.0,0.0,0.0,0.0,-1.0,-1.0,0.0,14.0,0.0,0.0,-1.0,2.83,-0.2,-0.07,-1.38,0.1,-1.34,0.09,0.0,1.12,0.0,0.05,1.7,-0.12,0.0,0.0,-0.1,-0.15,-0.05,0.42,-0.05,0.0,-0.12,0.0,-0.05,0.42
8,"Organizers say they intend to stay for a long time. They have brought in coffee and food to support the protesters, as well as extra sweaters for those who are cold.","No drug manufacturers have reported that they anticipate shortages of particular drugs due to the novel coronavirus, according to the US Food and Drug Administration, but the agency and experts in the pharmaceutical industry are paying close attention to the …",1.0,135.0,31.0,7.0,6.0,3.0,15.5,4.354838709677419,0.0,14.285714285714285,0.0,6.451612903225806,3.225806451612903,25.0,0.0,0.0,0.0,0.0,0.0,1.0,0.0,0.0,25.0,0.0,0.0,1.0,-85.0,-10.0,1.0,-8.0,2.0,-25.5,-1.01,0.0,-2.38,0.0,6.45,3.23,-6.0,0.0,0.0,0.0,0.0,0.0,1.0,0.0,0.0,-6.0,0.0,0.0,1.0,-0.33,-0.14,0.11,-1.89,0.18,-2.19,-0.02,0.0,1.58,0.0,0.57,1.53,-0.22,0.0,0.0,-0.1,-0.18,-0.05,0.44,-0.05,0.0,-0.22,0.0,-0.05,0.44
9,"Participants in the 12th edition of the 6633 Arctic Ultra marathon, which started on talk about the ""brutal"" challenges they faced while trying to complete the race. This year was the coldest year for the event since its inception.","The complete guide to American Express Centurion Lounges, including which airports have them, how to get in and a look at the new LAX location.",1.0,193.0,39.0,6.0,11.0,3.0,19.5,4.948717948717949,0.0,16.666666666666664,0.0,0.0,2.564102564102564,31.0,0.0,0.0,0.0,2.0,0.0,1.0,0.0,0.0,31.0,0.0,0.0,1.0,74.0,14.0,3.0,2.0,1.0,-5.5,0.19,0.0,16.67,0.0,0.0,2.56,8.0,0.0,0.0,0.0,2.0,0.0,1.0,0.0,0.0,8.0,0.0,0.0,1.0,2.95,0.7,0.15,-1.8,0.25,-2.48,-0.04,0.0,2.18,0.0,0.34,1.32,0.3,0.0,0.0,-0.1,0.0,-0.05,0.45,-0.05,0.0,0.3,0.0,-0.05,0.45
11,"U.S. stock futures were pointing to an over 700-point or 2.4% decline at Wall Street's open on Monday for the Dow Jones Industrial Average, trimming some earlier losses.","Bureau of Prisons(BOP) officials found a loaded firearm Thursday inside a housing unit at the federal prison in New York where Jeffrey Epstein killed himself last summer, the agency said.",1.0,142.0,28.0,3.0,13.0,5.0,7.5,5.071428571428571,0.0,33.33333333333333,0.0,0.0,7.142857142857142,28.0,0.0,0.0,1.0,1.0,0.0,0.0,0.0,0.0,28.0,0.0,0.0,0.0,-16.0,-2.0,0.0,-2.0,3.0,-22.5,-0.2,0.0,33.33,0.0,0.0,0.48,2.0,0.0,0.0,1.0,1.0,0.0,0.0,0.0,0.0,2.0,0.0,0.0,0.0,3.83,1.36,0.0,-1.67,0.53,-4.11,-0.12,0.0,5.23,0.0,0.14,1.34,0.92,0.0,0.0,-0.01,0.22,-0.05,0.42,-0.05,0.0,0.92,0.0,-0.05,0.42
12,The fiscal 2021 budget projects the deficit will hit $1 trillion this fiscal year and linger at $200 billion after a decade.,"One hundred floors up, and 1,100 feet in the air, Edge has built-in bragging rights: It is, after all, the highest outdoor observation deck in the Western Hemisphere. Take that One World Observatory and Willis Tower.",1.0,103.0,22.0,2.0,6.0,2.0,22.0,4.681818181818182,0.0,0.0,0.0,0.0,0.0,20.0,0.0,0.0,0.0,5.0,0.0,0.0,0.0,0.0,20.0,0.0,0.0,0.0,-78.0,-14.0,-3.0,-8.0,-1.0,4.0,-0.35,0.0,0.0,0.0,0.0,0.0,-7.0,0.0,0.0,0.0,2.0,0.0,0.0,0.0,0.0,-7.0,0.0,0.0,0.0,-0.89,0.58,-0.26,-2.0,0.48,-3.98,-0.16,0.0,4.13,0.0,0.0,1.0,0.38,0.0,0.0,-0.02,0.55,-0.05,0.35,-0.05,0.0,0.38,0.0,-0.05,0.35
13,"While headlines focus on millennials' perceived inability to save for retirement, Americans of all ages are financially strapped: 45% of boomers have nothing saved for retirement and one-third of those between 67 and 72 have postponed leaving the workforce th…","In Hong Kong, lingering resentments from the 2019 protests have collided with the coronavirus outbreak to create a perfect storm.",1.0,221.0,40.0,10.0,13.0,1.0,40.0,5.525,0.0,10.0,0.0,0.0,2.5,31.0,0.0,0.0,1.0,3.0,0.0,0.0,0.0,0.0,31.0,0.0,0.0,0.0,111.0,20.0,6.0,6.0,-1.0,20.0,0.03,0.0,10.0,0.0,-5.0,-7.5,13.0,0.0,0.0,1.0,2.0,0.0,0.0,0.0,0.0,13.0,0.0,0.0,0.0,3.49,1.21,0.08,-1.79,0.36,-2.59,-0.12,0.0,3.91,0.0,-0.12,0.88,0.71,0.0,0.0,0.05,0.7,-0.05,0.3,-0.05,0.0,0.71,0.0,-0.05,0.3
14,"Medical experts say coronavirus COVID-19 and Ebola outbreaks show that robotic medicine can help fight infectious disease, but the goal needs to be applications in everyday health care.","New York Governor Andrew Cuomo says this will be the year that his state legalizes recreational cannabis. If those efforts prove successful, New York would become the 12th state to put cannabis laws in place and could quickly become home to the second-biggest…",1.0,158.0,28.0,7.0,9.0,2.0,28.0,5.642857142857143,0.0,14.285714285714285,0.0,0.0,0.0,28.0,0.0,0.0,0.0,0.0,0.0,0.0,0.0,0.0,28.0,0.0,0.0,0.0,-60.0,-15.0,-3.0,-7.0,0.0,6.5,0.57,0.0,4.29,0.0,-2.33,0.0,-2.0,0.0,0.0,0.0,-1.0,0.0,-1.0,0.0,0.0,-2.0,0.0,0.0,-1.0,3.09,0.95,0.18,-1.87,0.33,-2.19,-0.09,0.0,3.99,0.0,-0.22,0.62,0.8,0.0,0.0,0.04,0.63,-0.05,0.25,-0.05,0.0,0.8,0.0,-0.05,0.25
15,"""Aggressive"" migration policies imposed by the Untied States and Mexico are trapping Central American migrants and refugees in a ""vicious cycle"" of violence, sexual assault, kidnappings and ill treatment from border authorities, a new report from Doctors With…","Blueland's cleaners and foaming hand soap aren't just good, but they can help save the planet.",1.0,223.0,38.0,4.0,17.0,1.0,38.0,5.868421052631579,0.0,25.0,0.0,0.0,5.263157894736842,31.0,0.0,0.0,0.0,0.0,0.0,0.0,0.0,0.0,31.0,0.0,0.0,0.0,144.0,22.0,-1.0,12.0,-1.0,22.0,0.93,0.0,25.0,0.0,-6.25,5.26,15.0,0.0,0.0,0.0,0.0,0.0,0.0,0.0,0.0,15.0,0.0,0.0,0.0,6.8,1.34,0.08,-1.44,0.23,-1.21,-0.04,0.0,4.74,0.0,-0.32,0.71,1.06,0.0,0.0,0.03,0.56,-0.05,0.2,-0.05,0.0,1.06,0.0,-0.05,0.2
16,"Transport Minister Marc Garneau says the federal Liberal government is ""very concerned"" about growing anti-pipeline protests that are crippling parts of the country's transport network, including one of the country's main rail arteries in southern Ontario.","The Anantara Golden Triangle Elephant Camp & Resort in Chiang Rai, Thailand has launched a new experience that lets guests spend the night in transparent bubbles next to rescued elephants.",1.0,221.0,36.0,6.0,14.0,2.0,36.0,6.138888888888889,0.0,33.33333333333333,0.0,0.0,11.11111111111111,29.0,0.0,0.0,0.0,1.0,0.0,0.0,0.0,0.0,29.0,0.0,0.0,0.0,62.0,6.0,1.0,-1.0,0.0,6.0,0.84,0.0,33.33,0.0,-3.33,11.11,1.0,0.0,0.0,0.0,1.0,0.0,0.0,0.0,0.0,1.0,0.0,0.0,0.0,9.95,1.58,0.11,-1.24,0.21,-0.46,0.01,0.0,5.89,0.0,-0.4,1.14,1.18,0.0,0.0,0.02,0.56,-0.05,0.16,-0.05,0.0,1.18,0.0,-0.05,0.16
17,West Vancouver's annual Nowruz festival has been cancelled over the threat of coronavirus while a fundraising gala for B.C. Children's Hospital Foundation is indefinitely postponed.,"Sustainable aviation fuel refined from plants, trash and other sources is already available. But there are still obstacles to overcome before passenger airplanes can switch over to using these less environmentally damaging alternatives.",1.0,157.0,25.0,5.0,12.0,4.0,8.666666666666666,6.28,0.0,40.0,0.0,0.0,4.0,25.0,0.0,0.0,0.0,0.0,0.0,0.0,0.0,0.0,25.0,0.0,0.0,0.0,-47.0,-8.0,-3.0,3.0,1.0,-7.83,0.1,0.0,15.0,0.0,-6.06,-2.06,-6.0,0.0,0.0,0.0,0.0,0.0,0.0,0.0,0.0,-6.0,0.0,0.0,0.0,9.2,1.17,0.07,-1.17,0.3,-1.32,0.07,0.0,7.28,0.0,-0.47,1.13,1.06,0.0,0.0,0.02,0.51,-0.05,0.13,-0.05,0.0,1.06,0.0,-0.05,0.13
18,"The Trump administration is considering invoking special powers to rapidly expand domestic manufacturing of protective masks and clothing to combat the coronavirus in the U.S., two officials told Reuters.","""You can always spot a fool,"" wrote Robert Harris, ""for he is the man who will tell you he knows who is going to win an election."" This week, a left-for-dead candidacy sprang back to life and the coronavirus outbreak cast a long shadow over the world of polit…",1.0,176.0,29.0,6.0,10.0,4.0,10.333333333333334,6.068965517241379,0.0,16.666666666666664,0.0,3.4482758620689653,0.0,25.0,0.0,0.0,0.0,1.0,0.0,0.0,0.0,0.0,25.0,0.0,0.0,0.0,-36.0,-20.0,-6.0,-3.0,2.0,-14.67,1.74,0.0,0.0,0.0,1.41,-4.08,-10.0,0.0,0.0,-1.0,1.0,0.0,-3.0,0.0,0.0,-10.0,0.0,0.0,-3.0,9.53,1.02,0.1,-1.21,0.38,-2.0,0.11,0.0,7.3,0.0,-0.35,0.91,0.95,0.0,0.0,0.01,0.52,-0.05,0.1,-0.05,0.0,0.95,0.0,-0.05,0.1
19,"More than 3,000 Vancouver Island forestry workers have been on the picket lines since July 1.","Ball boys and girls will wear gloves at the BNP Paribas Open international tennis tournament in Indian Wells, California, to combat the coronavirus outbreak, organizers have announced.",1.0,78.0,16.0,2.0,7.0,2.0,16.0,4.875,0.0,50.0,0.0,0.0,6.25,16.0,0.0,0.0,0.0,2.0,0.0,0.0,0.0,0.0,16.0,0.0,0.0,0.0,-80.0,-11.0,-3.0,-7.0,0.0,-11.0,-0.98,0.0,50.0,0.0,0.0,2.55,-9.0,0.0,0.0,0.0,2.0,0.0,0.0,0.0,0.0,-9.0,0.0,0.0,0.0,4.93,0.23,-0.08,-1.4,0.36,-2.32,0.09,0.0,8.98,0.0,-0.42,1.02,0.4,0.0,0.0,0.01,0.57,-0.05,0.07,-0.05,0.0,0.4,0.0,-0.05,0.07
0,"Amazon, Google, Facebook, Microsoft, and Twitter have all said they will pay hourly workers their regular rate even if those workers have to stay home due to the ongoing coronavirus outbreak. New work-from-home policies could have harmed hourly employees with…","Multiple outbreaks of the novel coronavirus outside of mainland China have continued to worsen, as experts warn we may be approaching pandemic levels.",0.0,221.0,40.0,10.0,13.0,2.0,20.0,5.525,0.0,0.0,0.0,0.0,5.0,31.0,0.0,0.0,1.0,0.0,0.0,1.0,0.0,0.0,31.0,0.0,0.0,1.0,93.0,17.0,4.0,6.0,0.0,-3.0,-0.04,0.0,-16.67,0.0,0.0,0.65,10.0,0.0,0.0,1.0,0.0,-1.0,1.0,0.0,0.0,10.0,0.0,-1.0,1.0,60.45,9.3,4.55,1.0,-0.15,-4.53,0.3,0.0,-9.05,0.0,-1.7,1.89,5.0,0.0,0.0,0.9,-0.4,-0.05,0.55,-0.05,0.0,5.0,0.0,-0.05,0.55
1,Seven current or former cruise ship workers described to Business Insider the most annoying things passengers do.,"The Trump administration wants to slash billions of dollars in federal support from Medicaid, food stamps and other safety net programs for the poor, while largely sparing the Medicare program that benefits seniors.",0.0,97.0,17.0,2.0,8.0,2.0,17.0,5.705882352941177,0.0,0.0,0.0,0.0,5.88235294117647,17.0,0.0,0.0,1.0,0.0,0.0,0.0,0.0,0.0,17.0,0.0,0.0,0.0,-86.0,-16.0,-1.0,-7.0,0.0,-16.0,0.16,0.0,0.0,0.0,-6.06,2.85,-14.0,0.0,0.0,1.0,0.0,0.0,0.0,0.0,0.0,-14.0,0.0,0.0,0.0,-1.55,-2.2,0.55,-1.5,-0.15,-6.03,0.39,0.0,-9.05,0.0,-1.7,2.33,-2.0,0.0,0.0,0.9,-0.4,-0.05,0.05,-0.05,0.0,-2.0,0.0,-0.05,0.05
2,"An Arizona mother, father and grandmother were charged with murder and child abuse after confessing to keeping a six-year-old in a closet with his brother for “stealing food”. The child died.Anthony Jose Archibeque-Martinez, 23, Elizabeth Archibeque-Martinez,…",The Centers for Disease Control and Prevention announced an investigation into a multi-state E. coli outbreak they believe is linked to Jimmy John's.,0.0,225.0,36.0,5.0,20.0,3.0,12.333333333333334,6.25,0.0,20.0,0.0,0.0,8.333333333333332,28.0,0.0,0.0,0.0,1.0,0.0,1.0,0.0,0.0,28.0,0.0,0.0,1.0,98.0,13.0,0.0,11.0,0.0,0.83,0.73,0.0,0.0,0.0,0.0,3.99,5.0,0.0,0.0,0.0,1.0,0.0,1.0,0.0,0.0,5.0,0.0,0.0,1.0,20.45,0.3,0.22,1.67,0.18,-8.08,0.6,0.0,-2.38,0.0,-1.7,3.3,-0.67,0.0,0.0,0.57,-0.07,-0.05,0.22,-0.05,0.0,-0.67,0.0,-0.05,0.22
3,"Editor’s note: The World Health Organization has declared that COVID-19, the disease caused by the new coronavirus, has a higher fatality rate than the flu. As of March 4, 2020, nine deaths have been reported in the U.S. Brian Labus, a professor of public hea…","The US Food and Drug Administration has issued a warning letter to the Jimmy John's sandwich chain, saying certain vegetables it served were implicated in five outbreaks of E. coli or salmonella in the past seven years.",0.0,216.0,45.0,7.0,19.0,4.0,11.5,4.8,0.0,14.285714285714285,0.0,0.0,0.0,35.0,0.0,1.0,0.0,3.0,0.0,0.0,0.0,0.0,35.0,0.0,0.0,0.0,33.0,8.0,1.0,3.0,1.0,-7.0,-0.15,0.0,-2.38,0.0,0.0,-2.7,2.0,0.0,1.0,0.0,1.0,0.0,-1.0,0.0,0.0,2.0,0.0,0.0,-1.0,29.2,3.8,0.55,3.0,0.6,-9.32,0.35,0.0,-0.48,0.0,-1.7,1.69,1.75,0.0,0.25,0.4,0.6,-0.05,0.05,-0.05,0.0,1.75,0.0,-0.05,0.05
4,"Families of hundreds of Filipino crew members still stuck on board the coronavirus-stricken Diamond Princess cruise ship are increasingly worried for their relatives' health, as the Philippines postponed on Saturday a scheduled trip to bring them home. The ve…","The US Food and Drug Administration announced Wednesday it is requiring a boxed warning -- the agency's most prominent warning -- for the asthma and allergy medication montelukast, sold under the brand name Singulair.",0.0,222.0,39.0,6.0,16.0,2.0,19.5,5.6923076923076925,0.0,16.666666666666664,0.0,0.0,5.128205128205128,33.0,0.0,0.0,0.0,0.0,0.0,2.0,0.0,0.0,33.0,0.0,0.0,2.0,38.0,5.0,2.0,2.0,0.0,-14.5,0.28,0.0,-8.33,0.0,-2.94,-3.7,8.0,0.0,0.0,-1.0,0.0,0.0,1.0,0.0,0.0,8.0,0.0,0.0,1.0,35.65,4.7,0.55,3.2,0.45,-8.46,0.37,0.0,1.14,0.0,-1.7,1.76,2.8,0.0,0.2,0.3,0.4,-0.05,0.35,-0.05,0.0,2.8,0.0,-0.05,0.35
5,"The father of a former student at New York’s elite Sarah Lawrence College has been charged with starting a sex cult in his daughter’s dorm room, eventually forcing one woman into prostitution and holding a knife to a male victim’s throat until he confessed to…","House Speaker Nancy Pelosi and Senate Minority Leader Chuck Schumer slammed President Donald Trump's budget proposal on Tuesday, with Schumer describing it as ""a blueprint for destroying America.""",0.0,216.0,45.0,8.0,24.0,1.0,45.0,4.8,0.0,12.5,0.0,2.2222222222222223,2.2222222222222223,41.0,0.0,0.0,0.0,1.0,0.0,2.0,0.0,0.0,41.0,0.0,0.0,2.0,47.0,17.0,5.0,6.0,-1.0,30.5,-1.24,0.0,12.5,0.0,2.22,2.22,15.0,0.0,0.0,0.0,1.0,0.0,1.0,0.0,0.0,15.0,0.0,0.0,1.0,38.95,6.3,0.88,4.67,0.18,-3.64,0.24,0.0,1.53,0.0,-1.33,1.32,4.83,0.0,0.17,0.23,0.43,-0.05,0.55,-0.05,0.0,4.83,0.0,-0.05,0.55
6,"Lawrence Ray, the father of a Sarah Lawrence College student, has been indicted for manipulating and abusing his daughter's friends.","Ordered into quarantine, a group evacuated to California from Wuhan, China, is at odds with the US Centers for Disease Control and Prevention and has petitioned for five ""critical"" changes in their conditions.",0.0,113.0,20.0,4.0,10.0,2.0,20.0,5.65,0.0,25.0,0.0,0.0,0.0,18.0,0.0,0.0,0.0,0.0,0.0,1.0,0.0,0.0,18.0,0.0,0.0,1.0,-64.0,-13.0,-1.0,-3.0,0.0,-13.0,0.29,0.0,5.0,0.0,0.0,-3.03,-11.0,0.0,0.0,0.0,-1.0,0.0,0.0,0.0,0.0,-11.0,0.0,0.0,0.0,26.59,3.87,0.55,3.71,0.14,-3.76,0.27,0.0,3.59,0.0,-1.38,0.69,3.0,0.0,0.14,0.19,0.31,-0.05,0.55,-0.05,0.0,3.0,0.0,-0.05,0.55
7,"After opening fire in a mall in Manilla, and taking dozens of people hostage, an armed gunman shared why he did it before police tackled him.",Here's what else you need to know to Get Up to Speed and Out the Door.,0.0,116.0,26.0,6.0,8.0,2.0,26.0,4.461538461538462,0.0,0.0,0.0,0.0,3.8461538461538463,24.0,0.0,0.0,0.0,0.0,0.0,2.0,0.0,0.0,24.0,0.0,0.0,2.0,61.0,10.0,2.0,4.0,0.0,10.0,1.02,0.0,0.0,0.0,0.0,3.85,11.0,0.0,0.0,0.0,0.0,0.0,1.0,-1.0,0.0,11.0,0.0,0.0,1.0,17.7,2.8,0.55,2.75,0.1,-3.11,0.14,0.0,2.01,0.0,-1.42,0.69,2.38,0.0,0.12,0.15,0.23,-0.05,0.68,-0.05,0.0,2.38,0.0,-0.05,0.68
8,"Thousands of refugees travel to Indonesia, hoping to make it to Australia. The vast majority of them never will. View Entire Post ›","No drug manufacturers have reported that they anticipate shortages of particular drugs due to the novel coronavirus, according to the US Food and Drug Administration, but the agency and experts in the pharmaceutical industry are paying close attention to the …",0.0,109.0,23.0,4.0,9.0,3.0,7.666666666666667,4.739130434782608,0.0,0.0,0.0,0.0,0.0,18.0,0.0,0.0,1.0,0.0,0.0,2.0,0.0,0.0,18.0,0.0,0.0,2.0,-111.0,-18.0,-2.0,-5.0,2.0,-33.33,-0.63,0.0,-16.67,0.0,0.0,0.0,-13.0,0.0,0.0,1.0,0.0,0.0,2.0,0.0,0.0,-13.0,0.0,0.0,2.0,10.01,1.63,0.33,2.11,0.18,-4.64,0.07,0.0,0.78,0.0,-1.45,0.27,1.22,0.0,0.11,0.23,0.16,-0.05,0.77,-0.05,0.0,1.22,0.0,-0.05,0.77
9,"In 2010, when I was 16, I came down with the stomach flu while on Royal Caribbean's Oasis of the Seas with my family. The quarantine period came next.","The complete guide to American Express Centurion Lounges, including which airports have them, how to get in and a look at the new LAX location.",0.0,122.0,29.0,3.0,8.0,3.0,14.5,4.206896551724138,0.0,33.33333333333333,0.0,0.0,0.0,21.0,0.0,0.0,0.0,2.0,2.0,0.0,0.0,0.0,21.0,3.0,0.0,0.0,3.0,4.0,0.0,-1.0,1.0,-10.5,-0.55,0.0,33.33,0.0,0.0,0.0,-2.0,0.0,0.0,0.0,2.0,2.0,0.0,0.0,0.0,-2.0,3.0,0.0,0.0,5.15,1.3,0.05,1.5,0.25,-5.17,-0.04,0.0,3.13,0.0,-1.48,-0.07,0.6,0.0,0.1,0.2,0.3,0.15,0.65,-0.05,0.0,0.6,0.3,-0.05,0.65
10,"Abu Jabber has a plan to escape the Syrian regime's advance: he has built a ladder from rusty metal for him and his 11 children to climb over the Turkish border wall. Six months ago, the family fled deadly fighting in Idlib province of northwest Syria, seekin…","The first US study of a drug to treat the novel coronavirus is underway, the National Institutes of Health said Tuesday, as a  federal health officials warned that the virus will eventually begin spreading in US communities.",0.0,214.0,47.0,7.0,16.0,2.0,23.5,4.553191489361702,0.0,0.0,0.0,0.0,4.25531914893617,38.0,0.0,0.0,0.0,2.0,0.0,3.0,0.0,0.0,38.0,0.0,0.0,3.0,27.0,10.0,0.0,3.0,0.0,-13.5,-0.5,0.0,-14.29,0.0,0.0,-1.15,9.0,0.0,0.0,0.0,2.0,0.0,3.0,0.0,0.0,9.0,0.0,0.0,3.0,9.54,2.66,0.19,1.73,0.21,-4.8,-0.1,0.0,2.02,0.0,-1.5,0.04,1.64,0.0,0.09,0.17,0.42,0.13,0.82,-0.05,0.0,1.64,0.27,-0.05,0.82
11,Dr. Nancy Messonnier recommended Americans at higher risk of getting ill from the coronavirus take precautions allowing them to stay close to home.,"Bureau of Prisons(BOP) officials found a loaded firearm Thursday inside a housing unit at the federal prison in New York where Jeffrey Epstein killed himself last summer, the agency said.",0.0,125.0,23.0,5.0,9.0,3.0,11.5,5.434782608695652,0.0,0.0,0.0,4.3478260869565215,4.3478260869565215,21.0,0.0,0.0,0.0,0.0,0.0,1.0,0.0,0.0,21.0,0.0,0.0,1.0,-33.0,-7.0,2.0,-6.0,1.0,-18.5,0.17,0.0,0.0,0.0,4.35,-2.32,-5.0,0.0,0.0,0.0,0.0,0.0,1.0,0.0,0.0,-5.0,0.0,0.0,1.0,5.78,1.8,0.13,1.33,0.27,-5.48,-0.07,0.0,1.1,0.0,-1.15,0.14,1.08,0.0,0.08,0.15,0.35,0.12,0.8,-0.05,0.0,1.08,0.25,-0.05,0.8
