25,Arizona's most populous county on Wednesday joined a growing national movement in which areas are declaring themselves Second Amendment sanctuaries and proclaiming support for gun ownership rights. The Maricopa County Board of Supervisors voted in Phoenix to …,The public charge rule change which took effect Monday to block poor or disabled immigrants from seeking better lives in the United States is quintessentially Trumpian -- and quintessentially un-American.,0.0,223,38,7,16,2,19.0,5.868421052631579,0,14.285714285714285,0.0,2.631578947368421,0.0,36,0,0,1,0,0,0,0,0,36,0,0,0,48.0,8.0,3.0,7.0,0.0,-11.0,0.04,0.0,-10.71,0.0,-0.7,-6.67,8.0,0.0,0.0,1.0,0.0,0.0,0.0,0.0,0.0,8.0,0.0,0.0,0.0,-14.36,-3.03,0.14,-1.74,0.47,-7.68,0.02,0.0,1.59,0.0,0.15,-0.57,-1.89,0.0,-0.01,0.2,0.15,-0.01,0.04,0.01,0.0,-1.89,-0.03,-0.01,0.04
26,The Swiss government on Tuesday urged voters to reject a referendum brought by the right-wing Swiss People's Party to end an accord with the European Union on the free movement of citizens. Should the party win the binding vote on May 17 in what is being call…,The Trump administration introduced a proposal that would triple some fees for immigration court filings.,0.0,214,47,8,16,2,23.5,4.553191489361702,0,12.5,0.0,4.25531914893617,2.127659574468085,35,0,0,0,1,0,0,0,0,35,0,0,0,123.0,32.0,5.0,9.0,0.0,8.5,-1.51,0.0,12.5,0.0,4.26,2.13,20.0,0.0,0.0,-1.0,1.0,0.0,0.0,0.0,0.0,20.0,0.0,0.0,0.0,-12.33,-2.39,0.24,-1.56,0.45,-7.48,-0.01,0.0,1.55,0.0,0.24,-0.59,-1.55,0.0,-0.01,0.19,0.16,-0.01,0.01,0.01,0.0,-1.55,-0.03,-0.01,0.01
27,"Democratic presidential candidate Joe Biden is looking ahead to the critical Super Tuesday primary slate with a new endorsement from a Texas congresswoman who served as an impeachment manager in the Senate trial of President Donald Trump. Rep. Sylvia Garcia, …","A recent Washington Post report told the story of young migrants whose therapy sessions are being used against them. David Perry says this alleged practice may be legal, but it's not an ethical position in which to place migrant teens badly in need of therape…",0.0,220,41,3,20,3,13.666666666666666,5.365853658536586,0,33.33333333333333,0.0,2.4390243902439024,2.4390243902439024,37,0,0,0,0,0,0,0,0,37,0,0,0,4.0,-4.0,-6.0,6.0,1.0,-8.83,0.57,0.0,11.11,0.0,0.22,0.22,-4.0,0.0,0.0,0.0,0.0,0.0,0.0,0.0,0.0,-4.0,0.0,0.0,0.0,-10.23,-2.01,0.16,-1.26,0.46,-7.66,-0.0,0.0,2.24,0.0,0.25,-0.6,-1.17,0.0,-0.01,0.18,0.14,-0.01,-0.01,0.01,0.0,-1.17,-0.03,-0.01,-0.01
28,"Greek police fired teargas to push back hundreds of migrants gathered on its border with Turkey on Saturday, as a crisis over Syria shifted onto the European Union's doorstep. Greece, which has tense relations with its neighbor Turkey at the best of times and…","Michael Bloomberg released his plan Monday to overhaul the nation's immigration system, promising to overturn several Trump administration policies and reform the visa system by allowing place-based visas that will allow regions of the country to address unme…",0.0,217,44,6,18,2,22.0,4.931818181818182,0,0.0,0.0,2.272727272727273,4.545454545454546,32,0,0,0,0,0,2,0,0,32,0,0,2,-6.0,6.0,-3.0,3.0,1.0,-16.0,-0.94,0.0,0.0,0.0,-2.99,1.91,0.0,0.0,0.0,0.0,0.0,0.0,1.0,0.0,0.0,0.0,0.0,0.0,1.0,-8.37,-1.56,0.18,-1.05,0.44,-7.53,-0.02,0.0,1.75,0.0,0.26,-0.53,-0.99,0.0,-0.01,0.17,0.12,-0.01,0.04,0.01,0.0,-0.99,-0.03,-0.01,0.04
29,"New York Gov. Andrew Cuomo (D) ""must understand that National Security far exceeds politics,"" President Trump tweeted Thursday before immediately attempting to justify his suspension of a security program for his own political ends: ""New York must stop all of…","President Donald Trump and New York Gov. Andrew Cuomo (D) have been playing a game of chicken over immigration of late, a face-off that will reach new heights when the two men meet in person Thursday.",0.0,221,40,8,19,2,20.0,5.525,0,0.0,0.0,2.5,0.0,36,0,0,1,0,0,2,0,0,36,0,0,2,56.0,4.0,2.0,2.0,-1.0,2.0,0.94,0.0,-16.67,0.0,2.5,0.0,4.0,0.0,0.0,1.0,-1.0,0.0,2.0,0.0,0.0,4.0,0.0,0.0,2.0,-6.51,-1.27,0.27,-0.82,0.42,-7.48,-0.01,0.0,1.28,0.0,0.27,-0.62,-0.68,0.0,-0.01,0.2,0.1,-0.01,0.08,0.01,0.0,-0.68,-0.03,-0.01,0.08
30,"Bernie Sanders and Elizabeth Warren endorsed her, Texas' largest labor union is on her side and she surpassed $1 million in donors. Jessica Cisneros, who at 26 would become the youngest member of Congress, is the best shot liberal activists could've taken for…","Department of Homeland Security acting Secretary Chad Wolf has installed a new leader at US Immigration and Citizenship Services, a move that appears to signal the latest efforts by the White House to shake up the department leadership.",0.0,218,43,9,15,2,21.5,5.069767441860465,0,22.22222222222222,0.0,4.651162790697675,0.0,37,0,0,0,3,0,3,0,0,37,0,0,3,19.0,5.0,3.0,-2.0,0.0,-16.5,-0.17,0.0,22.22,0.0,4.65,-2.63,6.0,0.0,0.0,0.0,3.0,0.0,3.0,0.0,0.0,6.0,0.0,0.0,3.0,-4.86,-0.9,0.39,-0.73,0.4,-7.38,-0.02,0.0,1.56,0.0,0.35,-0.71,-0.36,0.0,-0.01,0.19,0.18,-0.01,0.15,0.01,0.0,-0.36,-0.03,-0.01,0.15
31,A federal judge on Tuesday brought in nearly all members of the jury that convicted Trump ally Roger Stone on charges related to the Russia investigation in order to answer questions on allegations of juror misconduct. The surprise revelation by U.S. District…,"A federal judge on Sunday ruled that Ken Cuccinelli, the acting director of United States Citizenship and Immigration Services, was unlawfully appointed.",0.0,219,42,4,19,4,10.75,5.214285714285714,0,0.0,0.0,2.380952380952381,2.380952380952381,31,0,0,1,0,0,0,0,0,31,0,0,0,87.0,20.0,0.0,9.0,2.0,-11.25,-0.79,0.0,-25.0,0.0,2.38,-2.16,9.0,0.0,0.0,1.0,0.0,0.0,0.0,0.0,0.0,9.0,0.0,0.0,0.0,-3.28,-0.58,0.34,-0.53,0.45,-7.63,-0.02,0.0,1.13,0.0,0.36,-0.71,-0.25,0.0,-0.01,0.21,0.16,-0.01,0.13,0.0,0.0,-0.25,-0.03,-0.01,0.13
32,Sanders is having an easier time making the case for his brand of economic populism while facing a billionaire who's trying to buy the election.,Attorney General William Barr launched a volley of lawsuits at progressive communities Monday in the latest escalation of the administration's hardline tactic on illegal immigration.,0.0,120,25,7,7,2,25.0,4.8,0,14.285714285714285,0.0,4.0,0.0,23,0,0,0,0,0,1,0,0,23,0,0,1,-38.0,0.0,6.0,-5.0,0.0,0.0,-1.52,0.0,14.29,0.0,0.0,-4.0,2.0,0.0,0.0,0.0,0.0,0.0,1.0,0.0,0.0,2.0,0.0,0.0,1.0,-4.8,-0.8,0.39,-0.7,0.43,-7.43,-0.03,0.0,1.16,0.0,0.41,-0.79,-0.39,0.0,-0.01,0.21,0.14,-0.01,0.13,0.0,0.0,-0.39,-0.03,-0.01,0.13
33,"Since riots in Delhi left 46 people dead, hundreds of Muslims have left the city, unsure if they will ever feel safe enough to return.","Elie Honig writes that Justice Sonia Sotomayor's recent, blistering dissent in an immigration case was an uncharacteristic rebuke of her conservative colleagues.",0.0,110,25,6,6,2,25.0,4.4,0,0.0,0.0,8.0,8.0,23,0,0,0,1,0,0,0,0,23,0,0,0,-30.0,3.0,3.0,-4.0,0.0,3.0,-1.96,0.0,-33.33,0.0,8.0,-10.18,3.0,0.0,0.0,0.0,1.0,0.0,-2.0,0.0,0.0,3.0,0.0,0.0,-2.0,-6.53,-1.01,0.41,-0.88,0.41,-7.24,-0.06,0.0,0.77,0.0,0.58,-0.63,-0.52,0.0,-0.01,0.2,0.15,-0.01,0.11,0.0,0.0,-0.52,-0.03,-0.01,0.11
34,Anti-Chinese resentment fuels many of the calls to close the enclave's border,"Jessica Cisneros, a 26-year-old immigration attorney, is launching an all-out attack on Democratic Rep. Henry Cuellar just days before the Tuesday primary in Texas.",0.0,66,12,1,5,1,12.0,5.5,0,0.0,0.0,0.0,8.333333333333332,10,0,0,1,0,0,0,0,0,10,0,0,0,-75.0,-12.0,-1.0,-7.0,-2.0,0.0,-0.38,0.0,-50.0,0.0,0.0,4.17,-14.0,0.0,0.0,1.0,0.0,0.0,0.0,0.0,0.0,-14.0,0.0,0.0,0.0,-9.41,-1.57,0.28,-1.09,0.37,-7.43,-0.05,0.0,0.4,0.0,0.52,-0.46,-1.01,0.0,-0.01,0.22,0.13,-0.01,0.09,0.0,0.0,-1.01,-0.03,-0.01,0.09
35,"In the last four weeks, I've taken six fights throughout Asia – half domestic, half international. Here is what I have learned.","Experts on immigration policy told CNN they had no idea what the term ""redemption money"" means. Americans are paying for the wall.",0.0,106,22,5,5,3,11.0,4.818181818181818,0,20.0,0.0,0.0,0.0,20,0,0,0,2,1,0,0,0,20,1,0,0,-3.0,0.0,1.0,-6.0,0.0,0.0,-0.14,0.0,-5.0,0.0,-4.55,0.0,0.0,0.0,0.0,0.0,2.0,1.0,0.0,0.0,0.0,0.0,1.0,0.0,0.0,-11.02,-1.83,0.27,-1.29,0.38,-7.64,-0.06,0.0,0.61,0.0,0.45,-0.54,-1.2,0.0,-0.01,0.21,0.17,0.01,0.07,0.0,0.0,-1.2,0.0,-0.01,0.07
36,(Bloomberg) -- Opposition leader Juan Guaido staged a chaotic return to Venezuela after another international trip in which he tried to garner world leaders’ support to unseat President Nicolas Maduro.The head of the opposition-controlled National Assembly la…,President Donald Trump and New York Gov. Andrew Cuomo are set to square off Thursday afternoon in the Oval Office over an escalated proxy battle over immigration.,0.0,224,37,5,17,2,19.0,6.054054054054054,0,0.0,0.0,2.7027027027027026,2.7027027027027026,34,0,0,0,0,0,1,0,0,34,0,0,1,88.0,10.0,2.0,3.0,-1.0,5.5,1.02,0.0,-33.33,0.0,2.7,2.7,9.0,0.0,0.0,0.0,0.0,0.0,1.0,0.0,0.0,9.0,0.0,0.0,1.0,-9.36,-1.66,0.26,-1.15,0.37,-7.62,-0.04,0.0,0.26,0.0,0.46,-0.54,-1.0,0.0,-0.01,0.2,0.15,0.01,0.08,0.0,0.0,-1.0,0.0,-0.01,0.08
37,"Aboriginal peoples' connection to the land means they cannot be considered an ""alien"" under the Constitution, the High Court has ruled. View Entire Post ›",A federal judge on Sunday ruled that it was unlawful to appoint Ken Cuccinelli to lead the agency responsible for processing US immigration requests.,0.0,130,25,6,11,2,12.5,5.2,0,16.666666666666664,0.0,0.0,0.0,22,0,0,0,0,0,0,0,0,22,0,0,0,4.0,1.0,1.0,3.0,0.0,-11.5,-0.05,0.0,-3.33,0.0,-4.17,-4.17,0.0,0.0,0.0,0.0,0.0,0.0,-1.0,0.0,0.0,0.0,0.0,0.0,-1.0,-10.26,-1.83,0.28,-1.17,0.35,-7.78,-0.04,0.0,0.37,0.0,0.4,-0.61,-1.13,0.0,-0.01,0.2,0.14,0.01,0.06,-0.0,0.0,-1.13,-0.0,-0.01,0.06
38,"“It’s eating our bodies and our minds,” one refugee said. View Entire Post ›","A US immigration judge has ordered a Tennessee resident, who served as an armed guard at a Nazi concentration camp during World War II, be deported to Germany.",0.0,63,14,5,8,2,7.0,4.5,0,0.0,0.0,0.0,0.0,12,0,0,0,1,0,0,0,0,12,0,2,0,-69.0,-14.0,0.0,-4.0,0.0,-21.0,-0.21,0.0,-20.0,0.0,0.0,0.0,-14.0,0.0,0.0,0.0,1.0,0.0,0.0,0.0,0.0,-14.0,0.0,2.0,0.0,-12.82,-2.26,0.27,-1.27,0.34,-8.07,-0.06,0.0,0.05,0.0,0.34,-0.68,-1.51,0.0,-0.01,0.19,0.15,0.01,0.04,-0.0,0.0,-1.51,-0.0,0.04,0.04
39,"Thousands of refugees travel to Indonesia, hoping to make it to Australia. The vast majority of them never will. View Entire Post ›","While the 2020 Democratic candidates agree on a lot of things, there are differences in their platforms. Hear the promises they're each making to voters about health care, education, income inequality, immigration, gun control and the climate crisis.",0.0,109,23,4,9,3,7.666666666666667,4.739130434782608,0,0.0,0.0,0.0,0.0,18,0,0,1,0,0,2,0,0,18,0,0,2,-104.0,-15.0,-1.0,-8.0,0.0,-11.33,-0.87,0.0,-20.0,0.0,-2.63,-5.26,-17.0,0.0,0.0,1.0,-1.0,0.0,1.0,0.0,0.0,-17.0,0.0,0.0,1.0,-14.12,-2.45,0.23,-1.34,0.35,-8.32,-0.08,0.0,-0.26,0.0,0.29,-0.75,-1.71,0.0,-0.01,0.21,0.13,0.01,0.07,-0.0,0.0,-1.71,-0.0,0.04,0.07
40,"A Pennsylvania county imposed restrictions on U.S. immigration agents Tuesday after a federal officer arrested a man at the courthouse, sparking a heated con...","The Trump administration is reinforcing a tight deadline for immigration cases of unaccompanied migrant children in government custody in an effort to make quicker decisions about deportation, according to an email obtained by CNN.",0.0,137,24,3,11,4,8.333333333333334,5.708333333333333,0,0.0,0.0,0.0,0.0,21,0,0,0,0,0,0,0,0,21,0,0,0,-61.0,-10.0,-2.0,-3.0,2.0,-25.67,-0.12,0.0,-20.0,0.0,-2.94,0.0,-7.0,0.0,0.0,0.0,0.0,0.0,0.0,0.0,0.0,-7.0,0.0,0.0,0.0,-14.66,-2.6,0.17,-1.36,0.39,-8.55,-0.06,0.0,-0.55,0.0,0.24,-0.81,-1.84,0.0,-0.01,0.2,0.12,0.01,0.05,-0.0,0.0,-1.84,-0.0,0.04,0.05
41,"Most other campaigns sent surrogates to the event, sponsored by Amnesty International, while the candidates themselves appeared on cable television or stumped in other states. About one out of five residents in Nevada is an immigrant and President Donald Trum…","A Mexican municipal worker visiting his mother in New York endured a ""horrific, life-altering trip"" after being shot point-blank in the face by a US Immigration and Customs Enforcement agent, according to a federal lawsuit filed Wednesday.",0.0,221,40,5,15,2,20.0,5.525,0,20.0,0.0,0.0,2.5,34,0,0,0,2,0,0,0,0,34,0,0,0,18.0,3.0,0.0,-1.0,0.0,-17.0,0.04,0.0,20.0,0.0,0.0,-0.2,2.0,0.0,0.0,0.0,2.0,0.0,-1.0,0.0,0.0,2.0,0.0,0.0,-1.0,-13.18,-2.37,0.17,-1.29,0.38,-8.49,-0.06,0.0,-0.35,0.0,0.19,-0.8,-1.65,0.0,-0.01,0.2,0.15,0.01,0.04,-0.0,0.0,-1.65,-0.0,0.03,0.04
42,"(Bloomberg) -- Michael Bloomberg proposed an immigration plan similar to proposals from his moderate Democratic presidential rivals that includes reversing President Donald Trump’s policies, creating a path to U.S. citizenship for undocumented residents and a…","Tom Steyer writes, ""Last month, I announced my plan as president to reform our immigration system in a humane and comprehensive way — to undo the racist policies and unconscionable acts committed by the Trump administration.""",0.0,226,35,4,18,3,12.0,6.457142857142857,0,0.0,0.0,0.0,2.857142857142857,33,0,0,0,0,0,1,0,0,33,0,0,1,36.0,-1.0,-1.0,3.0,1.0,-6.5,1.18,0.0,0.0,0.0,-8.33,0.08,3.0,0.0,0.0,0.0,0.0,-1.0,1.0,0.0,0.0,3.0,-2.0,-1.0,1.0,-11.65,-2.27,0.14,-1.14,0.39,-8.62,-0.03,0.0,-0.63,0.0,0.14,-0.8,-1.49,0.0,-0.01,0.19,0.14,0.01,0.04,-0.0,0.0,-1.49,-0.0,0.03,0.04
43,"Britain announced new post-Brexit immigration rules Tuesday that will make it tougher for European Union citizens, but easier for people from many other nations, to move to the U.K. starting next year. Prime Minister Boris Johnson's Conservative government sa…","A Michigan county to test blue-collar appeal, the fate of President Donald Trump's signature campaign rallies, a Supreme Court decision that could jumpstart immigration talks and a Joe Biden-Bernie Sanders fight for the Latino vote.",0.0,222,39,5,17,4,10.0,5.6923076923076925,0,0.0,0.0,5.128205128205128,0.0,35,0,0,1,0,0,1,0,0,35,0,0,1,24.0,4.0,1.0,-3.0,2.0,-25.0,0.04,0.0,0.0,0.0,2.27,0.0,4.0,0.0,0.0,1.0,0.0,0.0,1.0,0.0,0.0,4.0,0.0,0.0,1.0,-10.28,-2.07,0.13,-1.03,0.42,-8.79,-0.02,0.0,-0.89,0.0,0.21,-0.85,-1.29,0.0,-0.01,0.21,0.12,0.01,0.05,-0.0,0.0,-1.29,-0.0,0.03,0.05
44,New York Governor Andrew Cuomo said on Thursday his state will move ahead with a lawsuit against the federal government if President Donald Trump rejects his proposal to resolve a dispute on a travel program and immigration when the two leaders meet at the Wh…,Here's what else you need to know to Get Up to Speed and Out the Door.,0.0,216,45,6,19,1,45.0,4.8,0,0.0,0.0,0.0,4.444444444444445,35,0,0,0,1,0,2,0,0,35,0,0,2,161.0,29.0,2.0,15.0,-1.0,29.0,1.36,0.0,0.0,0.0,0.0,4.44,22.0,0.0,0.0,0.0,1.0,0.0,1.0,-1.0,0.0,22.0,0.0,0.0,1.0,-9.11,-1.76,0.15,-0.88,0.39,-8.17,-0.03,0.0,-1.14,0.0,0.17,-0.81,-1.1,0.0,-0.01,0.2,0.13,0.01,0.08,-0.0,0.0,-1.1,-0.0,0.03,0.08
45,Using red tape and shifting policies the White House has created a nonporous barrier that has effectively changed U.S. immigration.,A 5-4 Supreme Court is allowing a rule that would make it more difficult for immigrants to obtain legal status if they use public benefits like food stamps and housing vouchers to go into effect in every state.,0.0,112,20,6,7,4,7.0,5.6,0,0.0,0.0,5.0,0.0,18,0,0,0,0,0,0,0,0,18,0,0,0,-61.0,-18.0,-1.0,-5.0,2.0,-31.0,1.05,0.0,-14.29,0.0,-0.26,-2.63,-18.0,0.0,0.0,0.0,0.0,0.0,-1.0,0.0,0.0,-18.0,0.0,0.0,-1.0,-10.24,-2.0,0.17,-0.99,0.42,-8.4,-0.02,0.0,-1.38,0.0,0.23,-0.86,-1.29,0.0,-0.01,0.19,0.12,0.01,0.06,-0.0,0.0,-1.29,-0.0,0.03,0.06
46,Stephen Miller is one of the White House's most conservative and influential voices in pushing moves that Trump has taken to curb immigration.,"The Trump administration's ongoing feud with sanctuary cities reached a fever pitch this month as the Department of Homeland Security sparred with New York, historically one of the department's strongest partners -- resulting in a week of hostile exchanges be…",0.0,120,23,5,8,2,23.0,5.217391304347826,0,20.0,0.0,4.3478260869565215,4.3478260869565215,23,0,0,1,1,0,0,0,0,23,0,0,0,-101.0,-17.0,1.0,-8.0,1.0,-17.0,-0.31,0.0,20.0,0.0,1.85,-0.65,-8.0,0.0,0.0,1.0,0.0,0.0,0.0,0.0,0.0,-8.0,0.0,0.0,0.0,-11.16,-2.16,0.16,-1.08,0.41,-8.29,-0.03,0.0,-1.19,0.0,0.28,-0.82,-1.37,0.0,-0.01,0.21,0.13,0.01,0.05,-0.01,0.0,-1.37,-0.01,0.03,0.05
47,A Cambodian refugee who says he was wrongly deported nearly two years ago is reuniting with his family in Massachusetts.  Supporters say 50-year-old Thy Chea...,"The new rule essentially creates a wealth test for immigrants that is based on factors like their age, health, education, income and resources.",0.0,135,25,6,7,3,12.5,5.4,0,33.33333333333333,0.0,0.0,4.0,26,0,0,0,1,0,2,0,0,26,0,0,2,14.0,2.0,3.0,-3.0,1.0,-10.5,0.14,0.0,0.0,0.0,-4.35,4.0,3.0,0.0,0.0,0.0,1.0,0.0,1.0,0.0,0.0,3.0,0.0,0.0,1.0,-11.73,-2.28,0.18,-1.18,0.42,-8.4,-0.02,0.0,-0.72,0.0,0.24,-0.78,-1.38,0.0,-0.01,0.2,0.14,0.01,0.08,-0.01,0.0,-1.38,-0.01,0.03,0.08
48,"A federal court on Wednesday ruled that the Trump administration could withhold grants to New York City, as well as seven states, due to their refusal to cooperate with the federal immigration enforcement efforts.The 2nd Circuit Court of Appeals in Manhattan …","The Church of England has decided to apologize for racism experienced by ""countless black, Asian and minority ethnic people"" over the past 70 years.",0.0,219,42,5,16,2,21.5,5.214285714285714,0,0.0,0.0,2.380952380952381,2.380952380952381,33,0,0,0,2,0,1,0,0,33,0,0,1,94.0,18.0,1.0,10.0,0.0,-2.5,0.01,0.0,0.0,0.0,2.38,-1.79,9.0,0.0,0.0,0.0,1.0,0.0,1.0,0.0,0.0,9.0,0.0,0.0,1.0,-10.56,-2.04,0.17,-1.1,0.4,-8.32,-0.02,0.0,-0.95,0.0,0.24,-0.79,-1.24,0.0,-0.01,0.2,0.17,0.01,0.08,-0.01,0.0,-1.24,-0.01,0.03,0.08
49,"A federal appeals court has blocked President Trump's policy requiring asylum seekers to remain in Mexico while their cases work their way through the immigration court system. The 9th Circuit Court of Appeals came to this decision on Friday, saying that the …","US Border Patrol arrests on the southern border increased for the first time since last May, the height of the migration crisis on the US-Mexico border, according to data obtained by CNN.",0.0,218,43,7,19,2,21.5,5.069767441860465,0,0.0,0.0,2.3255813953488373,0.0,35,0,0,0,1,0,2,0,0,35,0,0,2,62.0,11.0,3.0,6.0,0.0,-10.5,0.19,0.0,0.0,0.0,2.33,-3.12,10.0,0.0,0.0,0.0,1.0,0.0,2.0,0.0,0.0,10.0,0.0,0.0,2.0,-9.46,-1.8,0.21,-0.96,0.39,-8.24,-0.03,0.0,-1.18,0.0,0.25,-0.84,-1.07,0.0,-0.01,0.19,0.17,0.01,0.11,-0.01,0.0,-1.07,-0.01,0.03,0.11
50,Two state policies that stopped some refugees and children of immigrants from getting driver's licenses in Ohio have been struck down by a federal judge....,"Scott Braddock writes ahead of Super Tuesday on what to expect in Texas. While opposition to some Republican policies in the state may be driving Democrats to vote for Sanders, ""those same voters may be sorely disappointed come November when Republicans show …",0.0,132,25,5,9,3,25.0,5.28,0,20.0,0.0,0.0,4.0,25,0,0,1,1,0,0,0,0,25,0,0,0,-86.0,-18.0,-6.0,-4.0,1.0,3.5,0.21,0.0,1.82,0.0,0.0,-2.98,-9.0,0.0,0.0,0.0,1.0,0.0,0.0,0.0,0.0,-9.0,0.0,0.0,0.0,-10.09,-1.92,0.2,-1.02,0.4,-8.1,-0.03,0.0,-1.0,0.0,0.21,-0.8,-1.11,0.0,-0.01,0.21,0.18,0.01,0.09,-0.01,0.0,-1.11,-0.01,0.03,0.09
51,"In El Paso, an administrator entered a courtroom with an urgent message for the judge, informing him of the 9th U.S. Circuit Court of Appeals ruling that halted the government’s policy forcing immigrants to wait out their cases in Mexico. The couple were move…","""Safe Passage"" by Ai Weiwei features life jackets worn by refugees making the journey from Turkey to Greece. Minnesota has the highest number of refugees per capita of any state in the US.",0.0,217,44,7,19,4,11.25,4.931818181818182,0,14.285714285714285,0.0,0.0,2.272727272727273,37,0,0,0,1,0,2,0,0,37,0,0,2,61.0,11.0,3.0,4.0,1.0,-5.25,0.2,0.0,14.29,0.0,0.0,-0.76,13.0,0.0,0.0,0.0,1.0,0.0,2.0,0.0,0.0,13.0,0.0,0.0,2.0,-9.06,-1.67,0.23,-0.89,0.43,-8.23,-0.04,0.0,-0.94,0.0,0.17,-0.81,-0.91,0.0,-0.01,0.2,0.19,0.01,0.12,-0.01,0.0,-0.91,-0.01,0.03,0.12
52,“Hamilton” creator Lin-Manuel Miranda is joining U.S. Rep. Alexandria Ocasio-Cortez in a public service announcement aimed at getting New Yorkers of all back...,"The 2008 election of America's first black president looked at first like racial progress. In the years since, this milestone has revealed the nation's racist underbelly, Dorothy Brown says -- a reality that Russia has exploited but 2020 Democrats don't seem …",0.0,138,23,4,14,5,6.0,6.0,0,25.0,0.0,0.0,0.0,23,0,0,1,0,0,0,0,0,23,0,0,0,-81.0,-19.0,-5.0,1.0,3.0,-15.0,0.79,0.0,25.0,0.0,-4.76,-2.38,-13.0,0.0,0.0,1.0,-2.0,0.0,0.0,0.0,0.0,-13.0,0.0,0.0,0.0,-9.55,-1.82,0.21,-0.86,0.48,-8.45,-0.02,0.0,-0.68,0.0,0.13,-0.85,-0.98,0.0,-0.01,0.22,0.17,0.01,0.1,-0.01,0.0,-0.98,-0.01,0.02,0.1
53,"The Trump administration is escalating its fight against so-called sanctuary cities.The White House is set to deploy 100 tactical Border Patrol officers in 10 U.S. cities — New York, Chicago, San Francisco, Los Angeles, Atlanta, Houston, Boston, New Orleans, …","Victor Joecks writes ahead of the Nevada Democratic debate: ""The best presidential primary debates have conflict and clash."" Viewers should expect to watch candidates spar over the issues like healthcare. Moreover, this might offer viewers a first chance to w…",0.0,221,40,6,24,4,10.5,5.525,0,33.33333333333333,0.0,0.0,0.0,36,0,0,0,2,0,1,0,0,36,0,0,1,0.0,0.0,-3.0,10.0,1.0,-3.17,0.0,0.0,33.33,0.0,-5.0,-7.5,0.0,0.0,0.0,0.0,2.0,0.0,1.0,0.0,0.0,0.0,0.0,0.0,1.0,-8.5,-1.65,0.22,-0.64,0.5,-8.58,-0.02,0.0,-0.28,0.0,0.09,-0.9,-0.81,0.0,-0.01,0.21,0.2,0.01,0.11,-0.01,0.0,-0.81,-0.01,0.02,0.11
54,"Police in Vietnam have charged seven people in connection with the deaths of 39 migrants whose bodies were discovered in the back of a truck near London last year, authorities said late on Thursday. The victims, who included two 15-year-old boys, were mostly …","The 2020 contenders meet on stage on Tuesday with one final chance to halt the momentum of Vermont Sen. Bernie Sanders, days before the South Carolina primary and exactly one week before voters go to the polls in Super Tuesday states.",0.0,217,44,7,15,2,22.0,4.931818181818182,0,28.57142857142857,0.0,0.0,0.0,35,0,0,0,3,0,0,0,0,35,0,0,0,23.0,3.0,4.0,-4.0,-1.0,1.5,0.2,0.0,28.57,0.0,0.0,0.0,7.0,0.0,0.0,0.0,0.0,0.0,0.0,0.0,0.0,7.0,0.0,0.0,0.0,-7.55,-1.42,0.25,-0.59,0.49,-8.49,-0.02,0.0,0.02,0.0,0.06,-0.94,-0.67,0.0,-0.01,0.21,0.24,0.0,0.09,-0.01,0.0,-0.67,-0.01,0.02,0.09
55,"The parents of a two-year-old boy with cancer are facing deportation to Mexico under the Trump administration after their grant of “deferred action” was denied.Damaris Alameda Ramos and her husband Fabian Flores Aguirre applied for the grant, which allows mig…","Democratic strategist James Carville has fired back at Sen. Bernie Sanders after the Vermont independent dismissed him as a ""political hack"" in an interview with CNN.",0.0,221,40,6,18,2,20.5,5.525,0,33.33333333333333,0.0,0.0,2.5,36,0,0,0,0,0,3,0,0,36,0,0,3,80.0,14.0,3.0,8.0,-1.0,7.5,0.1,0.0,33.33,0.0,0.0,-1.35,10.0,0.0,0.0,0.0,0.0,0.0,2.0,0.0,0.0,10.0,0.0,0.0,2.0,-6.57,-1.26,0.26,-0.49,0.48,-8.44,-0.02,0.0,0.4,0.0,0.03,-0.94,-0.51,0.0,-0.01,0.2,0.23,0.0,0.13,-0.01,0.0,-0.51,-0.01,0.02,0.13
56,An appeals court initially blocked the controversial border policy on Friday. But Trump administration lawyers rushed to fight the order and convinced the court later in the day to temporarily pause it.,President Donald Trump's campaign held a background call with reporters Sunday evening where officials laid out their view of the Democratic race and argued that former Vice President Joe Biden and Vermont Sen. Bernie Sanders are interchangeable.,0.0,171,32,5,11,3,16.0,5.34375,0,0.0,0.0,0.0,3.125,24,0,0,0,0,0,0,0,0,24,0,0,0,-39.0,-5.0,0.0,-8.0,0.0,-2.5,-0.33,0.0,-20.0,0.0,0.0,3.12,-9.0,0.0,0.0,0.0,0.0,0.0,-1.0,0.0,0.0,-9.0,0.0,0.0,-1.0,-6.49,-1.26,0.26,-0.52,0.48,-8.47,-0.02,0.0,0.18,0.0,-0.01,-0.92,-0.57,0.0,-0.01,0.2,0.22,0.0,0.12,-0.01,0.0,-0.57,-0.01,0.02,0.12
57,"Some Chinese people are concerned about foreigners taking their jobs and using public welfare resources, the official Xinhua news agency reported on Saturday...","The influential Culinary Union said on Wednesday it has been ""viciously attacked"" after it distributed a flier criticizing Vermont Sen. Bernie Sanders' ""Medicare for All"" plan.",0.0,138,23,5,9,2,23.0,6.0,0,20.0,0.0,0.0,4.3478260869565215,23,0,0,0,0,0,1,0,0,23,0,0,1,-13.0,-3.0,-1.0,-2.0,-1.0,10.0,0.19,0.0,3.33,0.0,-3.85,-3.34,-1.0,0.0,0.0,0.0,0.0,0.0,-1.0,0.0,0.0,-1.0,0.0,0.0,-1.0,-6.99,-1.4,0.25,-0.59,0.47,-8.37,-0.01,0.0,0.31,0.0,-0.04,-0.89,-0.64,0.0,-0.01,0.19,0.21,0.0,0.12,-0.01,0.0,-0.64,-0.01,0.02,0.12
58,"Democrats are freaking out that Sen. Bernie Sanders (I-Vt.), the tentative frontrunner for their party's presidential nomination, may not only lose to President Trump in November, but also reverse their midterm election gains in the suburbs. The latest bit of…","President Donald Trump welcomed members of the 1980 US Olympic hockey team at a Las Vegas rally on Friday, who were celebrating the anniversary of their historic win against the Soviet Union.",0.0,221,40,5,15,4,10.25,5.525,0,20.0,0.0,2.5,7.5,34,0,0,0,0,0,2,0,0,34,0,0,2,61.0,8.0,2.0,-1.0,2.0,-21.75,0.53,0.0,-13.33,0.0,-0.62,7.5,7.0,0.0,0.0,0.0,-1.0,0.0,1.0,0.0,0.0,7.0,0.0,0.0,1.0,-6.07,-1.26,0.25,-0.54,0.5,-8.5,-0.0,0.0,0.44,0.0,-0.03,-0.8,-0.53,0.0,-0.01,0.19,0.19,0.0,0.14,-0.01,0.0,-0.53,-0.01,0.02,0.14
