11,"A bisexual pageant queen in New York has been banned from appearing in a local St Patrick's Day parade, reviving discrimination controversies that have plagued the city's celebrations after LGBT+ groups were notoriously blocked from participating.The night th…","Bill Clinton reflects emotionally in a new documentary about his 1990s affair with Monica Lewinsky, saying that he feels ""terrible"" the affair has defined the former White House intern's life and seeks to explain the sexual relationship as something that he ""…",0.0,223,38,10,16,2,19.5,5.868421052631579,0,20.0,0.0,0.0,5.263157894736842,34,0,0,0,0,0,0,0,0,34,0,0,0,4.0,-4.0,2.0,3.0,1.0,-22.5,0.65,0.0,20.0,0.0,0.0,2.88,1.0,0.0,0.0,0.0,-1.0,0.0,-3.0,0.0,0.0,1.0,0.0,0.0,-3.0,38.14,5.7,1.61,3.48,0.03,-1.47,0.2,0.07,1.53,0.0,-0.88,0.38,5.75,-0.14,-0.05,-0.16,-0.02,0.18,-0.07,0.0,0.0,5.75,0.17,0.01,-0.07
12,"In particular, many took issue with Schock's failure to apologize for making life more difficult for queer Americans during his political career.","Ben Affleck knows full well that people will draw parallels between his life and his role as an alcoholic construction worker turned high school basketball coach in his new film, ""The Way Back.""",0.0,124,22,3,6,2,22.0,5.636363636363637,0,0.0,0.0,0.0,18.181818181818183,20,0,0,1,0,0,1,0,0,20,0,0,1,-38.0,-11.0,-1.0,-8.0,0.0,5.0,0.73,0.0,0.0,0.0,-3.03,18.18,-10.0,0.0,0.0,1.0,0.0,0.0,-2.0,0.0,0.0,-10.0,0.0,0.0,-2.0,33.17,4.7,1.36,2.8,0.01,-1.45,0.22,0.06,0.82,0.0,-0.99,1.59,4.94,-0.14,-0.05,-0.08,-0.04,0.16,-0.08,0.0,0.0,4.94,0.15,0.01,-0.08
13,"It’s not unheard-of for members of Congress to resign their seats because of serious legal trouble. Now Republican House candidate Danielle Stella is trying to achieve the inverse: getting elected to Congress while being wanted by the law. Stella, one of the …",Forget marriage counseling or couples therapy. Harrison Ford has the secret to a long-lasting marriage and it's quite simple.,0.0,218,43,9,13,3,14.333333333333334,5.069767441860465,0,11.11111111111111,0.0,0.0,2.3255813953488373,32,0,1,0,1,0,1,0,0,32,0,0,1,111.0,24.0,7.0,5.0,0.0,4.83,-0.56,0.0,11.11,0.0,-5.26,2.33,15.0,0.0,1.0,0.0,1.0,0.0,1.0,0.0,0.0,15.0,0.0,0.0,1.0,35.62,5.34,1.58,2.72,0.07,-1.98,0.2,0.05,1.0,0.0,-1.09,1.5,5.1,-0.14,0.02,-0.09,0.01,0.14,-0.09,0.0,0.0,5.1,0.14,0.0,-0.09
14,"U.S. Attorney General William Barr warned a group of Christian broadcasters on Wednesday that the decline of religion in America is undermining liberal democracy. In a speech at the National Religious Broadcasters convention in Tennessee, Barr said religion i…",Dog the Bounty Hunter is on a hunt for peace in the midst of his grief.,0.0,222,39,4,21,4,10.0,5.6923076923076925,0,25.0,0.0,0.0,7.6923076923076925,27,0,0,0,0,0,0,0,0,27,0,0,0,166.0,23.0,3.0,14.0,2.0,-6.0,2.19,0.0,-75.0,0.0,-6.25,1.44,13.0,0.0,0.0,0.0,0.0,0.0,-1.0,0.0,0.0,13.0,0.0,0.0,-1.0,38.01,5.64,1.44,3.18,0.19,-2.74,0.22,0.05,2.08,0.0,-1.17,1.78,4.91,-0.14,0.01,-0.09,-0.02,0.13,-0.16,0.0,0.0,4.91,0.13,-0.0,-0.16
15,"(Bloomberg) -- As if the Democratic presidential process weren’t complicated enough, the New Hampshire primary will have another wild card: independent voter...","After almost 23 years of marriage, Sarah Jessica Parker and Matthew Broderick are getting to spend even more time together.",0.0,139,22,3,10,2,22.0,6.318181818181818,0,0.0,0.0,4.545454545454546,9.090909090909092,20,0,0,0,0,0,0,0,0,20,0,0,0,35.0,2.0,0.0,2.0,0.0,2.0,1.12,0.0,-33.33,0.0,4.55,9.09,0.0,0.0,0.0,0.0,-1.0,0.0,0.0,0.0,0.0,0.0,0.0,0.0,0.0,34.91,4.83,1.25,2.9,0.17,-2.64,0.27,0.04,1.46,0.0,-0.95,2.12,4.31,-0.14,0.01,-0.1,-0.04,0.12,-0.22,0.0,0.0,4.31,0.12,-0.01,-0.22
16,"Donald Trump likes to coin disparaging nicknames for his political opponents -- but so far, he hasn't quite hit the mark with rising young Democrat Pete Buttigieg. Is it perhaps that Trump doesn't see ""Mayor Pete"" as a credible opponent?","Their marriage may not have worked out, but that doesn't mean Tarek El Moussa isn't missing his partnership with Christina Anstead.",0.0,198,40,9,12,2,20.0,4.95,1,0.0,0.0,5.0,5.0,38,0,1,0,0,0,3,0,0,38,0,0,3,87.0,19.0,2.0,5.0,0.0,-1.0,-0.34,1.0,0.0,0.0,0.24,5.0,17.0,0.0,1.0,0.0,0.0,0.0,2.0,0.0,0.0,17.0,0.0,0.0,2.0,35.65,5.17,1.44,2.77,0.15,-2.68,0.24,0.1,0.92,0.0,-0.74,2.17,4.83,-0.14,0.07,-0.1,-0.06,0.11,-0.1,0.0,0.0,4.83,0.12,-0.01,-0.1
17,"The investigation into the disappearance of doomsday mom Lori Vallow’s children has exposed a bitter, mudslinging custody battle between her niece and the niece’s ex-husband—with allegations of cult membership, child-stealing, and attempted murder.The fight i…","Queen Elizabeth II's nephew, the Earl of Snowdon, has announced he is to divorce his wife after 26 years of marriage.",0.0,226,35,5,20,2,18.0,6.457142857142857,0,0.0,0.0,0.0,11.428571428571429,29,0,0,0,0,0,2,0,0,29,0,0,2,129.0,14.0,1.0,11.0,0.0,-3.0,1.84,0.0,-25.0,0.0,0.0,11.43,10.0,0.0,0.0,0.0,-1.0,0.0,0.0,0.0,0.0,10.0,0.0,0.0,0.0,37.86,5.2,1.38,3.09,0.14,-2.82,0.3,0.09,0.44,0.0,-0.82,2.57,4.8,-0.14,0.06,-0.1,-0.07,0.1,-0.05,0.0,0.0,4.8,0.11,-0.01,-0.05
18,"It was the question that followed former Mayor Pete Buttigieg everywhere he went when he first announced his presidential campaign: Is the country really ready to send a gay man to the White House?But soon, it seemed, the novelty wore off. Many saw that as a …",Pete Buttigieg turned an attack on Tuesday about his marriage into a pointed knock against President Donald Trump and hush money payments he paid to porn star Stormy Daniels.,0.0,214,47,9,12,2,16.0,4.553191489361702,1,11.11111111111111,0.0,4.25531914893617,0.0,35,0,0,0,0,0,4,0,0,35,0,0,4,68.0,18.0,5.0,-2.0,0.0,-13.0,-0.48,1.0,11.11,0.0,4.26,-6.9,6.0,0.0,0.0,0.0,0.0,0.0,2.0,0.0,0.0,6.0,0.0,0.0,2.0,39.21,5.86,1.54,2.96,0.12,-3.06,0.25,0.14,0.59,0.0,-0.68,2.34,5.09,-0.14,0.05,-0.11,-0.09,0.09,0.11,0.0,0.0,5.09,0.11,-0.02,0.11
19,"Here's the life of Michael Bloomberg so far — including how he made his fortune, his years in politics, and his personal life.",The mother of a Michigan high school student with same-sex parents alleges her daughter's English teacher infringed on her freedom of speech when she rejected a class paper on the topic of same-sex marriage.,0.0,104,23,3,7,2,23.0,4.521739130434782,0,0.0,0.0,4.3478260869565215,0.0,20,0,1,0,0,0,4,0,0,20,0,0,4,-70.0,-11.0,0.0,-6.0,0.0,-11.0,-0.6,0.0,0.0,0.0,1.41,-2.94,-3.0,0.0,1.0,0.0,0.0,0.0,-1.0,0.0,0.0,-3.0,0.0,0.0,-1.0,34.92,5.25,1.39,2.6,0.11,-2.92,0.21,0.13,0.17,0.0,-0.54,2.12,4.6,-0.14,0.1,-0.11,-0.1,0.08,0.24,0.0,0.0,4.6,0.1,-0.02,0.24
20,"They also spoke about the doubts they've experienced in their relationship, and gave an update on how their marriage is doing now. View Entire Post ›",Research shows that talking with a spouse or partner about money increases relationship satisfaction. But many people still don't do it.,0.0,124,26,6,8,2,13.0,4.769230769230769,0,16.666666666666664,0.0,0.0,3.8461538461538463,24,0,0,0,0,0,3,0,0,24,0,0,3,8.0,5.0,2.0,0.0,-1.0,2.5,-0.75,0.0,16.67,0.0,0.0,3.85,3.0,0.0,0.0,-1.0,0.0,0.0,3.0,0.0,0.0,3.0,0.0,0.0,3.0,32.0,4.84,1.39,2.32,0.1,-3.27,0.18,0.13,0.59,0.0,-0.62,2.11,4.34,-0.14,0.09,-0.11,-0.11,0.07,0.32,0.0,0.0,4.34,0.1,-0.02,0.32
21,“If someone said something shit to you at work are you really going to risk losing your house over that?” one lawyer asked. View Entire Post ›,"""Love Is Blind"" finished airing on Netflix on Feb. 27, and everyone's favorite couple Lauren Speed and Cameron Hamilton, ended up getting married.",0.0,116,27,7,11,2,9.333333333333334,4.296296296296297,1,14.285714285714285,0.0,3.7037037037037033,11.11111111111111,23,0,0,0,1,0,3,0,0,23,0,0,3,-8.0,4.0,1.0,1.0,-1.0,-2.17,-1.1,1.0,14.29,0.0,-0.64,11.11,4.0,0.0,0.0,0.0,0.0,0.0,3.0,0.0,0.0,4.0,0.0,0.0,3.0,28.97,4.52,1.44,2.19,0.09,-3.75,0.13,0.16,0.86,0.0,-0.53,2.43,4.06,-0.14,0.08,-0.11,-0.08,0.07,0.39,0.0,0.0,4.06,0.09,-0.02,0.39
22,"A divisive debate over same-sex marriage animated the 2004 presidential election as voters across the country approved constitutional amendments banning such unions. Sixteen years later, with those bans invalidated and his husband by his side, Pete Buttigieg …",Former Republican Rep. Aaron Schock of Illinois on Thursday came out as gay in a statement posted to his Instagram.,0.0,223,38,4,14,2,19.0,5.868421052631579,0,0.0,0.0,0.0,2.631578947368421,34,0,0,0,2,0,2,0,0,34,0,0,2,127.0,18.0,2.0,5.0,-1.0,9.0,1.07,0.0,0.0,0.0,0.0,2.63,14.0,0.0,0.0,0.0,2.0,0.0,1.0,0.0,0.0,14.0,0.0,0.0,1.0,30.86,4.7,1.35,2.21,0.08,-3.77,0.15,0.16,0.48,0.0,-0.61,2.35,4.29,-0.14,0.08,-0.11,-0.0,0.06,0.41,0.0,0.0,4.29,0.09,-0.03,0.41
23,"Several dozen activists protested in front of a Warsaw church guarded by police on Sunday as a Catholic archbishop, criticized for his anti-LGBT language, ce...","Right before Pete Buttigieg ended his presidential campaign Sunday night, his husband, Chasten, told the story of how it began.",0.0,136,25,3,11,2,25.0,5.44,0,0.0,0.0,0.0,8.0,23,0,0,0,0,0,1,0,0,23,0,0,1,28.0,5.0,0.0,3.0,0.0,5.0,0.04,0.0,0.0,0.0,0.0,8.0,5.0,0.0,0.0,0.0,0.0,0.0,-2.0,0.0,0.0,5.0,0.0,0.0,-2.0,28.97,4.33,1.23,2.11,0.07,-3.54,0.16,0.15,0.14,0.0,-0.68,2.5,4.04,-0.14,0.07,-0.12,-0.02,0.05,0.38,0.0,0.0,4.04,0.08,-0.03,0.38
24,Utah lawmakers voted Tuesday to put new regulations on pornography and remove some on polygamy in separate proposals moving quickly through the Legislature in the deeply conservative state. Senators voted unanimously to change state law to remove the threat o…,"An increasing number of people around the world are opting to go solo, but not all of them are lonely. Recent research on happy singles prove there are ways to feel joy at any stage of your love life.",0.0,221,40,7,13,2,20.0,5.525,0,0.0,0.0,0.0,5.0,26,0,0,1,0,0,0,0,0,26,0,0,0,59.0,1.0,0.0,3.0,-1.0,0.5,1.37,0.0,-42.86,0.0,-7.69,2.44,-5.0,0.0,0.0,0.0,0.0,0.0,-2.0,0.0,0.0,-5.0,0.0,0.0,-2.0,30.63,4.58,1.28,2.09,0.06,-3.53,0.16,0.14,-0.18,0.0,-0.74,2.52,3.93,-0.14,0.07,-0.08,-0.03,0.05,0.32,0.0,0.0,3.93,0.08,-0.03,0.32
25,"Brigham Young University in Utah has revised its strict code of conduct to strip a rule that banned any behavior that reflected “homosexual feelings,"" which LGBTQ students and their allies felt created an unfair double standard not imposed on heterosexual cou…","The 2020 Independent Spirit Awards celebrated countless excellent films, from ""The Lighthouse"" and ""Booksmart"" to ""Uncut Gems"" and ""The Farewell.""",0.0,220,41,8,15,1,41.0,5.365853658536586,0,0.0,0.0,0.0,2.4390243902439024,39,0,0,0,0,0,2,0,0,39,0,0,2,93.0,21.0,6.0,7.0,-1.0,30.5,-0.98,0.0,0.0,0.0,-10.0,2.44,23.0,0.0,0.0,0.0,-1.0,0.0,2.0,0.0,0.0,23.0,0.0,0.0,2.0,32.13,4.86,1.36,2.15,0.01,-2.71,0.16,0.14,-0.47,0.0,-0.8,2.44,4.32,-0.14,0.06,-0.08,-0.04,0.05,0.34,0.0,0.0,4.32,0.08,-0.03,0.34
26,British Prime Minister Boris Johnson and his girlfriend Carrie Symonds announced on Saturday they are expecting their first child together and are engaged to be married. The couple have been living together in Downing Street since Johnson became prime ministe…,"The 92nd Academy Awards have the potential to make history on several fronts, depending on which way the best picture race plays out, on a night where the acting honors seem pretty well preordained.",0.0,221,40,11,14,2,20.0,5.525,0,36.36363636363637,0.0,0.0,0.0,32,0,0,0,0,0,2,0,0,32,0,0,2,56.0,6.0,5.0,5.0,0.0,-14.0,0.67,0.0,36.36,0.0,-8.82,0.0,4.0,0.0,0.0,0.0,-1.0,0.0,2.0,0.0,0.0,4.0,0.0,0.0,2.0,33.55,5.07,1.55,2.17,0.01,-2.73,0.17,0.13,0.6,0.0,-0.86,2.28,4.43,-0.14,0.06,-0.08,-0.05,0.04,0.36,0.0,0.0,4.43,0.07,-0.03,0.36
27,(Bloomberg) -- Openly gay Democratic presidential candidate Pete Buttigieg pushed back Sunday against recent comments from conservative radio personalities a...,"President Donald Trump and first lady Melania Trump on Tuesday announced they will host Spain for a state visit in April, the third of the Trump administration.",0.0,141,20,3,7,2,20.0,7.05,0,0.0,0.0,0.0,5.0,20,0,0,0,0,0,0,0,0,20,0,0,0,7.0,-7.0,0.0,-7.0,0.0,-7.0,2.09,0.0,0.0,0.0,0.0,5.0,-2.0,0.0,0.0,0.0,0.0,0.0,0.0,0.0,0.0,-2.0,0.0,0.0,0.0,32.01,4.56,1.44,1.93,0.0,-2.75,0.23,0.13,0.31,0.0,-0.91,2.31,4.1,-0.14,0.05,-0.09,-0.07,0.04,0.31,0.0,0.0,4.1,0.07,-0.03,0.31
28,"President Trump told Fox News host Geraldo Rivera on Thursday that he, personally, would consider voting for a gay president, name-checking Pete Buttigieg, ""but there would certainly be a group that probably wouldn't."" Among that group, evidently, is Rush Lim…","From the start, Buttigieg's sexual orientation and faith set him apart from the standard Democratic presidential hopeful -- and especially his ability to square the two seemingly contradictory aspects of his identity.",0.0,221,40,8,16,2,20.5,5.525,0,25.0,0.0,0.0,0.0,33,0,0,0,0,0,0,0,0,33,0,0,0,35.0,8.0,7.0,6.0,0.0,-11.5,-0.29,0.0,25.0,0.0,-6.25,-3.12,8.0,0.0,0.0,0.0,-1.0,0.0,-3.0,0.0,0.0,8.0,0.0,0.0,-3.0,33.34,4.77,1.51,2.03,-0.0,-2.75,0.23,0.12,0.89,0.0,-0.96,2.16,4.25,-0.14,0.05,-0.09,-0.08,0.03,0.26,0.0,0.0,4.25,0.07,-0.04,0.26
29,(Bloomberg) -- Bernie Sanders scrapped a speech Saturday night that was supposed to make the case for why black voters should support him over Joe Biden afte...,"CNN Original Series ""The Windsors: Inside the Royal Dynasty"" tells the true story behind the world's most famous royal family. Here's what to expect in the six-part series.",0.0,134,27,6,11,2,27.0,4.962962962962963,0,16.666666666666664,0.0,3.7037037037037033,0.0,27,0,0,0,0,0,1,0,0,27,0,0,1,-11.0,-1.0,3.0,1.0,-1.0,13.0,-0.22,0.0,16.67,0.0,0.13,0.0,3.0,0.0,0.0,-1.0,0.0,0.0,1.0,0.0,0.0,3.0,0.0,0.0,1.0,31.67,4.54,1.51,1.95,-0.01,-2.54,0.22,0.12,1.16,0.0,-0.88,2.02,4.18,-0.14,0.05,-0.09,-0.08,0.03,0.24,0.0,0.0,4.18,0.07,-0.04,0.24
30,"The daughter of a Mississippi man on trial in the shooting deaths of eight people testified Monday that he was abusive and beat her frequently. My'Khyiah Godbolt took the stand at a courthouse in Magnolia, the Daily Leader newspaper reported, to testify again…","On the eve of their next presidential primary debate, three Democratic contenders grappled with former New York City Mayor Michael Bloomberg's presence on the stage for the first time.",0.0,218,43,6,16,2,21.5,5.069767441860465,0,16.666666666666664,0.0,0.0,2.3255813953488373,34,0,0,0,1,0,3,0,0,34,0,0,3,62.0,14.0,5.0,4.0,0.0,-7.5,-0.31,0.0,16.67,0.0,0.0,2.33,8.0,0.0,0.0,0.0,0.0,0.0,2.0,0.0,0.0,8.0,0.0,0.0,2.0,32.83,4.83,1.5,2.04,-0.01,-2.51,0.21,0.11,1.4,0.0,-0.92,1.97,4.34,-0.14,0.04,-0.09,-0.06,0.03,0.29,0.0,0.0,4.34,0.06,-0.04,0.29
31,"Former Mayor Pete Buttigieg fell short in his quest for the nomination, but no Democrat this cycle did more to boost his political career.",Americans who experienced life in coronavirus quarantine describe surreal boredom mixed with unease and uncertainty.,0.0,115,24,3,9,2,24.0,4.791666666666667,0,0.0,0.0,4.166666666666666,4.166666666666666,22,0,0,0,0,0,2,0,0,22,0,0,2,13.0,9.0,2.0,2.0,0.0,9.0,-2.01,0.0,0.0,0.0,-2.5,-9.17,7.0,0.0,0.0,0.0,0.0,0.0,2.0,0.0,0.0,7.0,0.0,0.0,2.0,30.69,4.51,1.41,1.9,-0.02,-2.41,0.19,0.11,1.12,0.0,-0.84,1.97,4.12,-0.14,0.04,-0.1,-0.07,0.02,0.31,0.0,0.0,4.12,0.06,-0.04,0.31
32,"In just a little over a week, they're expected to start proposing marriage to someone who they've never seen. On this week's episode of the Original Content podcast, we're joined by TechCrunch marketing director (and reality TV expert) Alexandra Ames to revie…","Just two weeks ago, LGBTQ students at Brigham Young University were cheering after the school deleted a section in its honor code that banned ""homosexual behavior."" But on Wednesday, the Church of Jesus Christ of Latter-day Saints poured cold water on their c…",0.0,219,42,10,15,2,21.0,5.214285714285714,0,0.0,0.0,0.0,0.0,37,0,0,1,0,0,0,0,0,37,0,0,0,1.0,-1.0,5.0,-4.0,0.0,-1.0,0.14,0.0,-20.0,0.0,-2.33,-2.33,0.0,0.0,0.0,1.0,-1.0,0.0,-2.0,0.0,0.0,0.0,0.0,0.0,-2.0,31.84,4.76,1.53,1.95,-0.02,-2.4,0.18,0.1,0.85,0.0,-0.88,1.85,4.37,-0.14,0.04,-0.07,-0.08,0.02,0.27,0.0,0.0,4.37,0.06,-0.04,0.27
33,"Charles and Candace Nelson traded their investment banking careers in Silicon Valley for the sweet sweet life as captains of the cupcake and confectionery chain, Sprinkles. Now they're putting both their consumer and brand development skills and former invest…","""Amazing Stories,"" the anthology series first created by Steven Spielberg 35 years ago, returns to Apple TV+.",0.0,222,39,3,19,2,19.5,5.6923076923076925,0,0.0,0.0,5.128205128205128,0.0,29,0,0,0,0,0,2,0,0,29,0,0,2,129.0,22.0,2.0,10.0,0.0,2.5,0.22,0.0,0.0,0.0,5.13,0.0,12.0,0.0,0.0,0.0,-1.0,0.0,2.0,0.0,0.0,12.0,0.0,0.0,2.0,33.0,4.91,1.44,2.12,-0.02,-2.44,0.19,0.1,0.6,0.0,-0.77,1.74,4.36,-0.14,0.04,-0.07,-0.09,0.02,0.28,0.0,0.0,4.36,0.06,-0.04,0.28
34,"Barely a year after replacing her mentor as head of Germany's CDU party, Annegret Kramp-Karrenbauer has thrown in the towel -- unexpectedly upending Chan...","Going to the movies doesn't exactly come to mind when people think about Netflix. If anything, it's the opposite, since the streaming company and the theater industry have long been at odds over how long its films can be shown at the cineplex.",0.0,133,24,3,10,2,24.0,5.541666666666667,0,0.0,0.0,0.0,4.166666666666666,24,0,0,0,0,0,2,0,0,24,0,0,2,-68.0,-19.0,-9.0,-1.0,-1.0,2.5,0.87,0.0,-16.67,0.0,0.0,4.17,-8.0,0.0,0.0,0.0,0.0,0.0,1.0,0.0,0.0,-8.0,0.0,0.0,1.0,31.56,4.62,1.35,2.02,-0.03,-2.35,0.2,0.1,0.36,0.0,-0.81,1.75,4.22,-0.14,0.03,-0.07,-0.09,0.02,0.3,0.0,0.0,4.22,0.06,-0.04,0.3
35,"WorldView: U.S. drone strikes against Taliban, Putin banning gay marriage CBS News Russia's Vladimir Putin proposes constitutional amendments mentioning God, traditional marriage Fox News Putin says fake coronavirus news reports being sent to Russia to spread…","Definitely not a comedy -- and indeed, the virtual opposite of a Valentine's Day movie -- the film was adapted from the 2014 Swedish title ""Force Majeure"" by Nat Faxon and Jim Rash, in their directing debut, sharing script credit with Jesse Armstrong.",0.0,225,36,8,21,3,12.333333333333334,6.25,0,0.0,0.0,0.0,2.7777777777777777,27,0,0,0,0,0,0,0,0,27,0,0,0,16.0,-7.0,5.0,1.0,1.0,-30.67,1.39,0.0,-33.33,0.0,0.0,2.78,-7.0,0.0,0.0,0.0,-1.0,0.0,-1.0,0.0,0.0,-7.0,0.0,0.0,-1.0,32.75,4.67,1.41,2.23,-0.0,-2.59,0.22,0.09,0.13,0.0,-0.86,1.73,4.16,-0.14,0.03,-0.07,-0.1,0.01,0.26,0.0,0.0,4.16,0.06,-0.04,0.26
36,Putin Forever? - BBC News BBC News 'There will be dad and mum': Putin rules out Russia legalizing gay marriage Reuters Ideas for amending Russian Constitution aired for Putin Washington Post Vladimir Putin says 'marriage is a union of a man and woman' Daily M…,"When an ancient poem appeared on the side of aid packages sent from Japan to China in the fight against the coronavirus outbreak, nobody thought it would help strengthen ties between Tokyo and Beijing.",0.0,216,45,7,24,1,22.5,4.8,1,28.57142857142857,0.0,0.0,0.0,31,0,0,0,0,0,0,0,0,31,0,0,0,48.0,11.0,1.0,11.0,-1.0,-11.5,-0.14,1.0,28.57,0.0,0.0,-2.94,0.0,0.0,0.0,0.0,0.0,0.0,-1.0,0.0,0.0,0.0,0.0,0.0,-1.0,33.64,4.97,1.44,2.51,-0.03,-2.54,0.2,0.12,0.69,0.0,-0.89,1.63,4.22,-0.14,0.03,-0.08,-0.11,0.01,0.22,0.0,0.0,4.22,0.05,-0.04,0.22
37,"Enjoy the videos and music you love, upload original content, and share it all with friends, family, and the world on YouTube.","Padma Lakshimi writes about the long way that countries like India and the US have to go on women's rights. While women have made huge strides towards equality around the globe, they still face gender discrimination at home and at work.",0.0,105,22,2,8,2,22.0,4.7727272727272725,0,0.0,0.0,4.545454545454546,0.0,17,0,0,1,0,0,2,0,0,17,0,0,2,-91.0,-19.0,-4.0,-8.0,-1.0,1.5,-0.01,0.0,0.0,0.0,-0.33,-2.44,-15.0,0.0,0.0,1.0,0.0,0.0,2.0,0.0,0.0,-15.0,0.0,0.0,2.0,31.55,4.65,1.33,2.36,-0.04,-2.51,0.19,0.11,0.47,0.0,-0.81,1.53,3.9,-0.14,0.03,-0.05,-0.11,0.01,0.24,0.0,0.0,3.9,0.05,-0.04,0.24
38,"Sanders, Biden break out as Democratic primary front-runners CBS This Morning 'Outnumbered': Why would Joe Biden do any better against Trump than Hillary Clinton? Fox News Sen. Bernie Sanders addresses supporters on Super Tuesday | ABC News ABC News 'Hillary'…","On International Women's Day, we should take a moment to ask ourselves whether there's more we could be doing to make the world better and more equal for the women we depend on, writes Melinda Gates.",0.0,221,40,5,23,2,13.333333333333334,5.525,1,0.0,0.0,2.5,2.5,33,0,0,0,0,0,0,0,0,33,0,0,0,57.0,4.0,-5.0,15.0,0.0,-22.67,0.97,1.0,-10.0,0.0,-0.28,2.5,6.0,0.0,0.0,0.0,0.0,-3.0,0.0,0.0,0.0,6.0,0.0,-3.0,0.0,32.55,4.8,1.31,2.6,-0.04,-2.7,0.19,0.14,0.25,0.0,-0.79,1.51,4.01,-0.14,0.02,-0.06,-0.12,0.01,0.2,0.0,0.0,4.01,0.05,-0.04,0.2
39,"Hillary Clinton talks about her four part docu-series, 'Hillary' ABC News Hillary Clinton goes after Bernie Sanders again: His campaign is 'just baloney' Fox News Hillary Clinton responds to Sanders on delegates: 'Let's follow the rules' | TheHill The Hill 'M…","Erna Solberg, Katrín Jakobsdóttir, Mette Frederiksen, Sanna Marin and Stefan Löfven write that on International Women's Day, they want to reiterate their joint commitment to the protection and promotion of the rights of women and girls, and more generally of …",0.0,220,41,6,23,1,41.0,5.365853658536586,0,16.666666666666664,0.0,0.0,0.0,31,0,0,0,1,0,2,0,0,31,0,0,2,0.0,0.0,3.0,3.0,0.0,0.0,0.0,0.0,16.67,0.0,-4.88,0.0,1.0,0.0,0.0,-1.0,1.0,0.0,1.0,0.0,0.0,1.0,0.0,0.0,1.0,33.47,4.98,1.31,2.82,-0.07,-2.19,0.19,0.13,0.47,0.0,-0.82,1.42,4.07,-0.14,0.02,-0.06,-0.1,0.0,0.22,0.0,0.0,4.07,0.05,-0.05,0.22
40,Tucker: Joe Biden's success is good news for the Democratic establishment Fox News 'Hillary' Documentary Sets Clinton's Career And Marriage Against Culture War Backdrop NPR 'Outnumbered': Why would Joe Biden do any better against Trump than Hillary Clinton? F…,"Dean Obeidallah writes that Americans could be hearing, ""Please welcome the 46th President of the United States of America, Bernie Sanders,"" come this time next year. While many believe that Bernie has little chance at winning a general election, Obeidallah p…",0.0,222,39,5,24,1,19.5,5.6923076923076925,1,20.0,0.0,7.6923076923076925,0.0,37,0,0,0,0,0,0,0,0,37,0,0,0,2.0,-2.0,-4.0,7.0,-1.0,-1.0,0.33,1.0,8.89,0.0,2.81,0.0,6.0,0.0,0.0,-2.0,-1.0,0.0,0.0,0.0,0.0,6.0,0.0,0.0,0.0,34.4,5.09,1.29,3.06,-0.09,-2.22,0.2,0.15,0.76,0.0,-0.67,1.34,4.27,-0.14,0.02,-0.06,-0.11,0.0,0.18,0.0,0.0,4.27,0.05,-0.05,0.18
41,"Pete Buttigieg's husband on advocacy, supporting the presidential candidate | Nightline ABC News Buttigieg rates Colin Jost's impression of him | TheHill The Hill Trump is macho. Buttigieg is stoic. Who wins the contest of American manliness? The Washington P…","Independent voters, who make up a larger bloc than both Republicans or Democrats, are front and center in the New Hampshire primary, writes John Avlon",0.0,221,40,4,23,3,10.0,5.525,1,50.0,0.0,5.0,0.0,28,0,0,0,0,0,1,0,0,28,0,0,1,95.0,15.0,1.0,13.0,2.0,-15.0,0.49,1.0,16.67,0.0,5.0,0.0,3.0,0.0,0.0,0.0,0.0,0.0,1.0,0.0,0.0,3.0,0.0,0.0,1.0,35.26,5.23,1.25,3.27,-0.07,-2.49,0.2,0.17,1.74,0.0,-0.59,1.26,4.25,-0.14,0.02,-0.06,-0.11,0.0,0.18,0.0,0.0,4.25,0.05,-0.05,0.18
42,"""Parasite"" could become the first South Korean film to win best picture, while Bong Joon Ho could become the first director from the country to take home the...","The '60s style icon tells CNN's Christiane Amanpour about her high-profile relationship with French singer Serge Gainsbourg, as she prepares to pay tribute to his greatest hits on her ""Le Symphonique"" tour.",0.0,133,28,6,9,2,28.0,4.75,0,0.0,0.0,7.142857142857142,0.0,17,0,0,0,0,0,0,0,0,17,0,0,0,-42.0,-4.0,3.0,-6.0,0.0,-4.0,-0.72,0.0,0.0,0.0,4.02,0.0,-11.0,0.0,0.0,0.0,0.0,0.0,-6.0,0.0,0.0,-11.0,0.0,0.0,-6.0,34.03,5.07,1.25,3.14,-0.07,-2.32,0.19,0.17,1.52,0.0,-0.46,1.18,3.97,-0.14,0.02,-0.06,-0.12,-0.0,0.14,0.0,0.0,3.97,0.05,-0.05,0.14
43,Will Ferrell got lost in Switzerland and had to be rescued while filming 'Downhill' Yahoo Entertainment Force Meh: ‘Downhill’ Can’t Hit the Heights of Its Inspiration The Ringer Happy never after? The enduring appeal of the messy marriage movie The Guardian M…,"Scott Braddock writes ahead of Super Tuesday on what to expect in Texas. While opposition to some Republican policies in the state may be driving Democrats to vote for Sanders, ""those same voters may be sorely disappointed come November when Republicans show …",0.0,219,42,8,23,1,21.0,5.214285714285714,1,12.5,0.0,2.380952380952381,4.761904761904762,35,0,0,1,0,0,0,0,0,35,0,0,0,1.0,-1.0,-3.0,10.0,-1.0,-0.5,0.14,1.0,-5.68,0.0,2.38,-2.21,1.0,0.0,0.0,0.0,0.0,0.0,0.0,0.0,0.0,1.0,0.0,0.0,0.0,34.81,5.25,1.3,3.33,-0.09,-2.32,0.18,0.19,1.6,0.0,-0.45,1.22,4.11,-0.14,0.02,-0.04,-0.12,-0.0,0.11,0.0,0.0,4.11,0.05,-0.05,0.11
44,"In an interview with Rolling Stone, a pregnant Grimes officially confirmed that Tesla Inc. (NASDAQ: TSLA) CEO Elon Musk is the father of her child.In January, the 31-year-old Canadian singer, whose real name is Claire Boucher, posted a photoshopped image of a…","On March 8, a series of rallies to mark International Women's Day are scheduled to take place in major cities across Pakistan.",0.0,219,42,4,20,3,14.333333333333334,5.214285714285714,0,50.0,0.0,0.0,0.0,34,0,0,0,0,0,2,0,0,34,0,0,2,114.0,20.0,0.0,11.0,1.0,-7.67,0.44,0.0,25.0,0.0,0.0,0.0,14.0,0.0,0.0,0.0,-1.0,0.0,2.0,0.0,0.0,14.0,0.0,0.0,2.0,35.56,5.41,1.26,3.45,-0.07,-2.46,0.18,0.18,2.5,0.0,-0.49,1.15,4.22,-0.14,0.01,-0.05,-0.13,-0.0,0.13,0.0,0.0,4.22,0.04,-0.05,0.13
