33,"The World Health Organization has hesitated to call the coronavirus outbreak a pandemic, but some health experts say that it is.","If you're a longtime Delta loyalist, or if you're considering flying the airline more often, it's worth understanding which Delta credit cards will serve you best.",0.0,108,21,6,6,2,21.0,5.142857142857143,0,0.0,0.0,0.0,4.761904761904762,21,0,0,1,0,0,1,0,0,21,0,0,1,-30.0,-5.0,-2.0,0.0,0.0,-5.0,-0.16,0.0,0.0,0.0,-7.69,4.76,-1.0,0.0,0.0,1.0,0.0,0.0,0.0,0.0,0.0,-1.0,0.0,0.0,0.0,-26.25,-4.93,-0.02,-0.9,-0.2,-1.02,-0.14,-0.03,-2.33,0.0,-0.56,0.33,-3.4,-0.06,0.06,-0.02,-0.08,-0.24,-0.02,-0.02,-0.02,-3.4,-0.15,-0.2,-0.02
36,"Two recent Indian laws would provide a path to citizenship for several minority groups and foreigners in India, but exclude Muslims.","Jill Filipovic writes that after two rocky debates, Michael Bloomberg did well at his first CNN town hall. Even so, she argues, ""It's telling, though, that even at his best, Bloomberg is a profoundly lacking candidate."" His knowledge on key issues is limited …",0.0,112,21,4,7,2,21.0,5.333333333333333,0,0.0,0.0,0.0,0.0,21,0,0,0,1,0,0,1,0,21,0,0,0,-105.0,-23.0,-2.0,-6.0,-1.0,6.0,0.4,0.0,-33.33,0.0,-6.82,-9.09,-13.0,0.0,0.0,0.0,0.0,0.0,-3.0,1.0,0.0,-13.0,0.0,0.0,-3.0,-29.28,-5.44,-0.1,-1.31,-0.17,-1.46,-0.15,-0.03,-3.25,0.0,-0.51,0.2,-3.81,-0.06,0.05,-0.03,-0.08,-0.24,-0.03,0.01,-0.02,-3.81,-0.15,-0.2,-0.03
37,"The Diamond Princess cruise ship is currently under a 14-day quarantine, where Cheryl and Paul Molesky have been posting regular vlogs.","CNN Underscored partnered with H&R Block to create this content. When you make a purchase, CNN receives revenue. CNN news staff is not involved in the selections or product reviews. For more on what we do and how we do it, visit our About Us page.",0.0,115,21,4,9,2,21.0,5.476190476190476,0,50.0,0.0,0.0,0.0,21,0,0,0,0,0,0,0,0,21,0,0,0,-87.0,-25.0,-5.0,-8.0,-3.0,9.5,1.08,0.0,38.89,0.0,0.0,0.0,-18.0,0.0,0.0,0.0,0.0,-2.0,-1.0,0.0,0.0,-18.0,0.0,-3.0,-1.0,-30.08,-5.65,-0.14,-1.35,-0.17,-1.44,-0.14,-0.03,-2.21,0.0,-0.56,0.13,-3.91,-0.06,0.05,-0.04,-0.1,-0.24,-0.06,0.01,-0.02,-3.91,-0.15,-0.2,-0.06
38,"""Jennifer and I extend our deepest condolences to the family and loved ones affected by this death in Placer County,"" Gov. Gavin Newsom said.","President Donald Trump imposed tariffs on French wine, Italian cheese, and single malt Irish whiskey last year -- and could escalate them by the end of the week.",0.0,118,24,4,11,3,12.0,4.916666666666667,0,0.0,0.0,4.166666666666666,4.166666666666666,22,0,0,0,0,1,0,0,0,22,1,1,0,-16.0,-4.0,1.0,-1.0,1.0,-16.0,0.13,0.0,0.0,0.0,4.17,4.17,-2.0,0.0,0.0,0.0,0.0,1.0,-1.0,0.0,0.0,-2.0,1.0,1.0,-1.0,-30.77,-5.78,-0.18,-1.35,-0.15,-1.65,-0.14,-0.03,-2.51,0.0,-0.51,0.16,-3.98,-0.06,0.05,-0.04,-0.12,-0.22,-0.07,0.01,-0.02,-3.98,-0.13,-0.17,-0.07
39,"In 2010, when I was 16, I came down with the stomach flu while on Royal Caribbean's Oasis of the Seas with my family. The quarantine period came next.","""The Banker"" is a sturdy, old-fashioned film that's been put under the microscope for two unrelated reasons: Not only does it represent Apple's first bite at movies, but allegations involving the subject's children prompted a delay in its release. Setting tha…",0.0,122,29,3,8,3,14.5,4.206896551724138,0,33.33333333333333,0.0,0.0,0.0,21,0,0,0,2,2,0,0,0,21,3,0,0,-98.0,-12.0,-6.0,-5.0,1.0,-6.0,-1.16,0.0,11.11,0.0,-2.44,-4.88,-16.0,0.0,0.0,0.0,1.0,2.0,-2.0,0.0,0.0,-16.0,3.0,0.0,-2.0,-31.32,-5.77,-0.24,-1.42,-0.13,-1.79,-0.16,-0.03,-1.96,0.0,-0.56,0.09,-4.07,-0.06,0.05,-0.05,-0.08,-0.17,-0.09,0.01,-0.02,-4.07,-0.05,-0.17,-0.09
40,"One of the first people to contract the virus had to wait 36 hours at a hospital before he could be tested, Italian media reported.",Airlines and airports could do more to improve our flying experience. Aviation buffs weigh in on nine needed improvements that would better aviation for everyone.,0.0,107,25,6,6,2,25.0,4.28,0,16.666666666666664,0.0,0.0,4.0,21,0,0,0,2,0,1,0,0,21,0,0,1,-31.0,0.0,-1.0,-2.0,-1.0,12.5,-1.24,0.0,16.67,0.0,-12.0,4.0,-4.0,0.0,0.0,0.0,1.0,0.0,1.0,0.0,0.0,-4.0,0.0,-1.0,1.0,-32.22,-5.86,-0.23,-1.54,-0.14,-1.66,-0.18,-0.03,-1.84,0.0,-0.61,0.12,-4.15,-0.06,0.05,-0.05,-0.05,-0.17,-0.09,0.01,-0.02,-4.15,-0.05,-0.17,-0.09
41,"A Democratic donor urged the party to ""get off their yoga mats and understand we're in for a tough election and we've got to stay focused and united.""","New York Governor Andrew Cuomo says this will be the year that his state legalizes recreational cannabis. If those efforts prove successful, New York would become the 12th state to put cannabis laws in place and could quickly become home to the second-biggest…",0.0,123,28,6,6,2,14.5,4.392857142857143,0,0.0,0.0,3.571428571428571,0.0,23,0,0,0,0,0,1,0,0,23,0,0,1,-95.0,-15.0,-4.0,-10.0,0.0,-7.0,-0.68,0.0,-10.0,0.0,1.25,0.0,-7.0,0.0,0.0,0.0,-1.0,0.0,0.0,0.0,0.0,-7.0,0.0,0.0,0.0,-32.69,-5.88,-0.21,-1.65,-0.15,-1.79,-0.19,-0.03,-2.12,0.0,-0.58,0.06,-4.18,-0.06,0.05,-0.05,-0.07,-0.17,-0.08,0.01,-0.02,-4.18,-0.06,-0.17,-0.08
42,"(Bloomberg) -- Bernie Sanders claimed victory in a primary still too close to call in New Hampshire, where he hopes to cement his status as the Democratic frontrunner in a race that remains defined by the divide between progressives and moderates.After polls …","Tom Steyer writes, ""Last month, I announced my plan as president to reform our immigration system in a humane and comprehensive way — to undo the racist policies and unconscionable acts committed by the Trump administration.""",0.0,218,43,7,13,2,22.0,5.069767441860465,0,0.0,0.0,2.3255813953488373,0.0,34,0,0,0,0,0,2,0,0,34,0,0,2,28.0,7.0,2.0,-2.0,0.0,3.5,-0.21,0.0,0.0,0.0,-6.01,-2.78,4.0,0.0,0.0,0.0,0.0,-1.0,2.0,0.0,0.0,4.0,-2.0,-1.0,2.0,-30.92,-5.55,-0.18,-1.59,-0.15,-1.74,-0.19,-0.03,-2.39,0.0,-0.57,-0.0,-3.96,-0.06,0.05,-0.06,-0.08,-0.17,-0.05,0.01,-0.02,-3.96,-0.06,-0.17,-0.05
43,Pangolins are nocturnal mammals than are often poached for their scales. Their meat is also considered a delicacy in China and Vietnam.,"The Bloomberg news organization has been the nation's quirkiest large news organization over the course of its 30-year history and never more in the news than now, writes Merrill Brown.",0.0,114,22,5,7,3,11.0,5.181818181818182,0,60.0,0.0,4.545454545454546,0.0,20,0,0,0,0,0,1,0,0,20,0,0,1,-42.0,-8.0,2.0,-4.0,1.0,-19.0,-0.02,0.0,26.67,0.0,4.55,0.0,-2.0,0.0,0.0,-1.0,0.0,0.0,0.0,0.0,0.0,-2.0,0.0,0.0,0.0,-31.61,-5.7,-0.19,-1.67,-0.14,-1.94,-0.18,-0.03,-1.29,0.0,-0.51,-0.06,-4.06,-0.06,0.05,-0.06,-0.1,-0.17,-0.05,0.01,-0.02,-4.06,-0.06,-0.17,-0.05
44,"During weeks holed up in her grandmother's apartment with 10 relatives and eating a restricted diet, Chinese teenager Li Yuxuan says tempers have frayed. Li and her family are among the millions of people across China's Hubei province, epicenter of the corona…","A growing number of companies are warning that the coronavirus will prevent them from meeting sales or profit targets for the first three months of the year. Some are even getting specific, and putting a number on the financial damage.",0.0,219,42,7,18,2,21.0,5.214285714285714,0,14.285714285714285,0.0,0.0,2.380952380952381,32,0,0,0,1,0,4,0,0,32,0,0,4,23.0,2.0,-2.0,8.0,-1.0,1.0,0.31,0.0,-7.94,0.0,0.0,-2.62,2.0,0.0,0.0,0.0,0.0,0.0,3.0,0.0,0.0,2.0,0.0,0.0,3.0,-29.92,-5.41,-0.16,-1.51,-0.14,-1.91,-0.18,-0.03,-1.24,0.0,-0.56,-0.06,-3.89,-0.06,0.04,-0.06,-0.09,-0.18,0.03,0.01,-0.02,-3.89,-0.06,-0.17,0.03
45,(Bloomberg) -- House Republicans are putting two of Donald Trump’s most outspoken defenders into position to take leading roles in challenging any investigations of the president launched by Democrats between now and Election Day.Representatives Jim Jordan of…,"Welcome to 2020! With just 6 days until the Nevada caucuses and 13 days until the South Carolina primary, the Democratic primary is in full swing. Every Sunday, I outline the 5 BIG storylines you need to know to understand the upcoming week on the campaign tr…",0.0,224,37,6,17,2,19.0,6.054054054054054,0,16.666666666666664,0.0,2.7027027027027026,2.7027027027027026,35,0,0,1,1,0,0,0,0,35,0,0,0,10.0,-10.0,0.0,2.0,0.0,3.33,1.5,0.0,0.0,0.0,2.7,2.7,1.0,0.0,0.0,1.0,-3.0,-1.0,-1.0,0.0,-1.0,1.0,-1.0,0.0,-1.0,-28.21,-5.24,-0.14,-1.37,-0.15,-1.93,-0.15,-0.03,-1.15,0.0,-0.55,-0.06,-3.67,-0.06,0.04,-0.04,-0.08,-0.18,0.01,0.01,-0.02,-3.67,-0.06,-0.18,0.01
46,"(Bloomberg) -- Billionaire Tom Steyer became the seventh candidate to qualify for the Democratic presidential debate Tuesday night in South Carolina, his cam...","At Le Bon Marché department store in Paris, which was founded in 1852 and holds the title of the oldest and longest-running department store in the world, Aristide and Marguerite Boucicaut pioneered retail concepts many probably take for granted.",0.0,138,23,2,11,2,23.0,6.0,0,0.0,0.0,4.3478260869565215,0.0,21,0,0,0,0,0,1,0,0,21,0,0,1,-70.0,-16.0,-4.0,-3.0,0.0,-16.0,0.67,0.0,-16.67,0.0,4.35,0.0,-5.0,0.0,0.0,-1.0,-1.0,0.0,1.0,0.0,0.0,-5.0,0.0,0.0,1.0,-28.39,-5.38,-0.22,-1.37,-0.15,-1.86,-0.13,-0.03,-1.42,0.0,-0.5,-0.11,-3.75,-0.06,0.04,-0.05,-0.1,-0.18,0.01,0.01,-0.02,-3.75,-0.07,-0.18,0.01
47,"(Bloomberg) -- Joe Biden says he isn’t concerned that Donald Trump could refuse to leave office if he loses the November election.Given how he’s treated the military, the intelligence agencies and the FBI, “I have no worry about him being escorted out of the …","What to make of the story of a man arrested and accused of abusing his daughter's friends and former roommates at Sarah Lawrence College? If parents of late adolescents are to take away anything from this, it might be an understanding that while parent-child …",0.0,216,45,13,15,2,23.0,4.8,0,0.0,0.0,2.2222222222222223,8.88888888888889,38,0,0,0,0,0,3,0,0,38,0,0,3,0.0,0.0,5.0,3.0,1.0,0.5,0.0,-1.0,-25.0,0.0,2.22,8.89,1.0,0.0,0.0,0.0,0.0,0.0,1.0,0.0,0.0,1.0,0.0,0.0,1.0,-26.95,-5.05,-0.06,-1.28,-0.16,-1.79,-0.13,-0.03,-1.68,0.0,-0.5,0.02,-3.47,-0.06,0.04,-0.05,-0.11,-0.18,0.06,0.01,-0.02,-3.47,-0.07,-0.18,0.06
48,(Bloomberg) -- Thousands of passengers on two cruise ships that had been held in separate ports in Asia to prevent the spread of the deadly coronavirus are disembarking -- only to face new hurdles on their journeys home.Japan allowed the first 500 guests aboa…,Millions of people across China are heading back to work after the Lunar New Year break turned into an extended quarantine due to the Wuhan coronavirus.,0.0,217,44,11,11,2,22.5,4.931818181818182,0,18.181818181818183,0.0,0.0,2.272727272727273,31,0,0,0,2,0,1,0,0,31,0,0,1,90.0,18.0,8.0,0.0,0.0,-3.5,0.05,0.0,-15.15,0.0,-3.85,-1.57,9.0,0.0,0.0,0.0,2.0,0.0,1.0,0.0,0.0,9.0,0.0,0.0,1.0,-25.54,-4.75,0.05,-1.28,-0.16,-1.74,-0.13,-0.03,-1.55,0.0,-0.54,0.01,-3.35,-0.06,0.04,-0.05,-0.08,-0.18,0.06,0.01,-0.02,-3.35,-0.07,-0.18,0.06
49,"Barack Obama’s vice-president is floundering in the Democratic primary, losing key support as vital votes loomLarry Sabato is an analyst, author and director of the Center for Politics at the University of Virginia. His students are currently embedded in vari…","In the 2010s, India's internet exploded. More than half a billion Indians came online in the 10 years to September 2019, according to the latest government data, and the country now has twice as many internet users as the entire population of the United State…",0.0,221,40,7,17,2,20.0,5.525,0,42.857142857142854,0.0,2.5,5.0,31,0,0,0,0,0,0,0,0,31,0,0,0,5.0,-5.0,3.0,3.0,0.0,-2.5,0.73,0.0,42.86,0.0,2.5,5.0,-2.0,0.0,0.0,-1.0,-4.0,0.0,0.0,0.0,0.0,-2.0,0.0,0.0,0.0,-24.1,-4.55,0.07,-1.16,-0.17,-1.74,-0.12,-0.03,-0.94,0.0,-0.53,0.06,-3.24,-0.06,0.04,-0.06,-0.1,-0.18,0.04,0.0,-0.02,-3.24,-0.07,-0.18,0.04
50,Coronavirus has forced the cruise industry to take measures to keep the outbreak at bay. But how will it impact the industry and cruisers?,"As it turns 20 years old this month, JetBlue Airways is making bold moves: Ordering nearly 150 new state-of-the-art aircraft, shaking up the most valuable international route in the world and going green in a big way.",0.0,115,24,6,8,2,12.0,4.791666666666667,1,0.0,0.0,0.0,4.166666666666666,17,0,0,0,0,0,1,0,0,17,0,0,1,-66.0,-13.0,0.0,-2.0,0.0,-25.0,-0.1,1.0,-16.67,0.0,-5.41,4.17,-16.0,0.0,0.0,-1.0,-2.0,0.0,0.0,0.0,0.0,-16.0,0.0,0.0,0.0,-24.81,-4.66,0.08,-1.22,-0.17,-1.89,-0.13,-0.01,-1.19,0.0,-0.57,0.09,-3.4,-0.06,0.04,-0.06,-0.11,-0.18,0.04,0.0,-0.02,-3.4,-0.07,-0.18,0.04
51,"""He talks about giving every American $1,000 a month but can't give his own campaign staffers severance,"" a staffer said. ""It's infuriating.""","Berkshire Hathaway, the sprawling industrial conglomerate and investor in top US companies run by Warren Buffett, seems to be preparing for the time when Buffett is no longer around.",0.0,120,22,7,5,3,7.666666666666667,5.454545454545454,0,0.0,0.0,0.0,4.545454545454546,20,0,0,0,1,0,1,0,0,20,0,0,1,-34.0,-7.0,1.0,-5.0,1.0,-21.33,0.14,0.0,-33.33,0.0,-3.45,4.55,-7.0,0.0,0.0,0.0,1.0,0.0,1.0,0.0,0.0,-7.0,0.0,0.0,1.0,-25.39,-4.81,0.1,-1.33,-0.16,-2.12,-0.12,-0.01,-1.43,0.0,-0.61,0.12,-3.5,-0.06,0.04,-0.06,-0.1,-0.18,0.05,0.0,-0.02,-3.5,-0.07,-0.18,0.05
52,"(Bloomberg) -- Joe Biden has emerged in Nevada displaying a new passion on the stump, with crisper speeches and a new humility he seemed to lack going into the 2020 Democratic nominating process.But with four days before the Nevada caucuses, keeping his promi…",Mike Bloomberg would like you to forget about last night.,0.0,218,43,8,13,2,22.0,5.069767441860465,0,0.0,0.0,6.976744186046512,4.651162790697675,32,0,0,0,2,0,2,0,0,32,0,0,2,170.0,33.0,5.0,10.0,0.0,12.0,0.27,0.0,0.0,0.0,-3.02,4.65,22.0,0.0,0.0,0.0,2.0,0.0,1.0,0.0,0.0,22.0,0.0,0.0,1.0,-24.09,-4.56,0.14,-1.29,-0.16,-2.08,-0.12,-0.01,-1.67,0.0,-0.52,0.16,-3.36,-0.06,0.04,-0.06,-0.08,-0.19,0.07,0.0,-0.02,-3.36,-0.08,-0.18,0.07
53,"WAUKESHA, Wis. -- The moment President Donald Trump was acquitted in the Senate on Wednesday, Judy Ryan was licking a blueberry ice cream cone in the Brookfield Square shopping mall and feeling happy.Ryan, 74, a retired factory worker, had followed the impeac…","President Trump's budget, which was released last month, outlines several moonshots that are unlikely to pass a divided Congress. But there's one in particular that both Republicans and Democrats should support wholeheartedly: the $25.2 billion request to fun…",0.0,219,42,7,22,3,14.333333333333334,5.214285714285714,0,28.57142857142857,0.0,0.0,0.0,33,0,0,0,1,0,0,0,0,33,0,0,0,-4.0,4.0,-2.0,13.0,0.0,1.33,-0.65,0.0,6.35,0.0,-5.26,-2.63,-1.0,0.0,0.0,0.0,-2.0,0.0,0.0,0.0,0.0,-1.0,0.0,0.0,0.0,-22.83,-4.34,0.17,-1.09,-0.15,-2.17,-0.11,-0.01,-1.36,0.0,-0.56,0.11,-3.22,-0.06,0.04,-0.07,-0.07,-0.19,0.05,0.0,-0.02,-3.22,-0.08,-0.18,0.05
54,"On the craps table of this campaign, there's a $500 million chip sitting on ""Super Tuesday."" The bettor's name is mike - small ""m,"" according to the visual design of his campaign, like he's your modest neighbour from the split-level down the block instead of …","Fearing the US economy would fall into a recession due to the coronavirus, the Fed pushed through an emergency rate cut for the first time since the 2008 financial crisis.",0.0,215,46,5,14,2,23.5,4.673913043478261,0,20.0,0.0,4.3478260869565215,2.1739130434782608,37,0,0,0,2,0,2,0,0,37,0,0,2,73.0,16.0,1.0,4.0,0.0,-6.5,-0.06,0.0,20.0,0.0,4.35,-11.16,12.0,0.0,0.0,0.0,1.0,0.0,2.0,0.0,0.0,12.0,0.0,0.0,2.0,-21.69,-4.05,0.15,-1.03,-0.15,-2.1,-0.12,-0.01,-1.22,0.0,-0.52,0.1,-3.01,-0.06,0.04,-0.07,-0.05,-0.19,0.07,0.0,-0.02,-3.01,-0.08,-0.18,0.07
55,The evidence just simply doesn't support the hand-wringing from moderate Democrats that a Sanders nomination would cost the House majority.,"Elizabeth Whelan had a packed three-day schedule for her visit to Washington, DC. But it wasn't a pleasure trip. Whelan's journey to the nation's capital -- her second this year -- had a very serious purpose: to bring attention -- and hopefully spur action --…",0.0,120,20,4,7,2,20.0,6.0,0,0.0,0.0,5.0,0.0,18,0,0,0,0,0,0,0,0,18,0,0,0,-96.0,-25.0,0.0,-10.0,-1.0,5.0,1.2,0.0,0.0,0.0,2.78,0.0,-14.0,0.0,0.0,0.0,0.0,0.0,-5.0,0.0,0.0,-14.0,0.0,0.0,-5.0,-22.28,-4.24,0.12,-1.11,-0.16,-2.09,-0.1,-0.01,-1.45,0.0,-0.47,0.05,-3.14,-0.06,0.04,-0.07,-0.06,-0.19,0.06,0.0,-0.02,-3.14,-0.08,-0.18,0.06
56,"French startup Le Wagon has raised its first round of funding after many years of bootstrapping. “We’ve always bootstrapped since 2013, and we’ve always been profitable since day one,” Le Wagon co-founder and COO Romain Paillard told me. Le Wagon is an intere…","From Mexico City to Beijing, religious buildings have changed gods; gladiatorial arenas have become political rallying grounds, theaters or rock venues; and buildings celebrating fallen kings and leaders have been repurposed for surprising new roles. Visit so…",0.0,218,43,9,17,3,14.333333333333334,5.069767441860465,0,22.22222222222222,0.0,0.0,0.0,29,0,0,3,2,0,1,0,0,29,0,0,1,-6.0,6.0,-1.0,0.0,1.0,-4.17,-0.98,0.0,12.22,0.0,0.0,-2.7,-1.0,0.0,0.0,3.0,2.0,0.0,1.0,0.0,0.0,-1.0,0.0,0.0,1.0,-21.13,-4.02,0.18,-1.0,-0.15,-2.18,-0.1,-0.01,-1.27,0.0,-0.5,0.01,-3.08,-0.06,0.04,-0.02,-0.04,-0.19,0.06,0.0,-0.02,-3.08,-0.08,-0.18,0.06
57,"Bookshlf has created a new way for people to recommend media — whether it's music, videos, articles, podcasts or even tweets — to their friends and to the rest of the world. The New York-based startup is officially launching its web and iOS app this week and …","In Trump, politically conservative America has a once-in-a-generation opportunity to fundamentally alter the direction of the nation, writes Merrill Brown.",0.0,213,48,7,19,2,24.0,4.4375,0,14.285714285714285,0.0,2.083333333333333,0.0,38,0,0,0,0,0,2,0,0,38,0,0,2,77.0,28.0,4.0,12.0,0.0,4.0,-2.36,0.0,14.29,0.0,2.08,-5.0,20.0,0.0,0.0,0.0,0.0,0.0,2.0,0.0,0.0,20.0,0.0,0.0,2.0,-20.11,-3.72,0.2,-0.87,-0.15,-2.11,-0.11,-0.01,-1.24,0.0,-0.51,-0.04,-2.86,-0.06,0.03,-0.02,-0.05,-0.19,0.08,0.0,-0.02,-2.86,-0.08,-0.18,0.08
58,"Today Microsoft said that it will continue paying all vendor hourly service providers in Puget Sound and Northern California their usual wage, even if their work hour are reduced. The announcement specifically refers to Microsoft workers in the Puget Sound re…","Between sticky notes, pens and notebooks, it's too easy to have a cluttered desk. So we asked experts for their tips (and favorite products) for making things neat again.",0.0,220,41,6,19,2,20.5,5.365853658536586,0,16.666666666666664,0.0,2.4390243902439024,0.0,31,0,0,1,0,0,3,0,0,31,0,0,3,78.0,12.0,2.0,11.0,-1.0,6.0,0.47,0.0,16.67,0.0,-7.91,-3.45,4.0,0.0,0.0,1.0,0.0,-1.0,2.0,0.0,0.0,4.0,0.0,-1.0,2.0,-19.01,-3.55,0.2,-0.74,-0.15,-2.09,-0.1,-0.01,-1.17,0.0,-0.5,-0.08,-2.77,-0.06,0.03,-0.01,-0.06,-0.19,0.11,0.0,-0.02,-2.77,-0.08,-0.18,0.11
59,"Last night, in a move that all companies should look to emulate, Microsoft announced that it would continue to pay hourly workers impacted by office closures as the company responds to the coronavirus outbreak in the U.S. Concerns about the COVID-19 have also…","Two decades ago, Pete Buttigieg composed a nearly 1,000-word tribute to Bernie Sanders.",0.0,218,43,10,14,3,14.666666666666666,5.069767441860465,0,0.0,0.0,0.0,2.3255813953488373,32,0,0,1,0,0,1,0,0,32,0,0,1,143.0,30.0,9.0,8.0,1.0,1.67,-0.7,0.0,0.0,0.0,0.0,2.33,19.0,0.0,0.0,1.0,-1.0,0.0,1.0,0.0,0.0,19.0,0.0,0.0,1.0,-17.97,-3.35,0.27,-0.7,-0.14,-2.17,-0.1,-0.01,-1.38,0.0,-0.54,-0.09,-2.67,-0.06,0.03,0.0,-0.07,-0.19,0.12,0.0,-0.02,-2.67,-0.08,-0.18,0.12
60,"This morning Airbase, a startup that sells spend and budgeting software for companies, announced a $23.5 million extension to its Series A. TechCrunch covered the company's first Series A tranche last year when it put together a $7 million round. Bain Capital…","Colleges and universities across the US are bracing for a possible pandemic while weighing potential campus closures, program cancellations and dips in enrollment.",0.0,219,42,5,18,4,10.75,5.214285714285714,0,0.0,0.0,0.0,0.0,35,0,0,0,4,0,2,0,0,35,0,0,2,78.0,19.0,2.0,8.0,2.0,-12.25,-0.92,0.0,-33.33,0.0,0.0,0.0,14.0,0.0,0.0,0.0,4.0,0.0,2.0,0.0,0.0,14.0,0.0,0.0,2.0,-16.96,-3.17,0.25,-0.59,-0.11,-2.31,-0.1,-0.01,-1.58,0.0,-0.57,-0.13,-2.52,-0.06,0.03,-0.0,-0.02,-0.19,0.13,0.0,-0.02,-2.52,-0.09,-0.18,0.13
61,Tips for what you'll need if you're forced to work from home during the coronavirus outbreak.,"Wooden towers -- sometimes dubbed ""plyscrapers"" -- were once the preserve of conceptual designers. But thanks to changes in lowered costs and shifting attitudes towards the material, they are quickly becoming a reality.",0.0,78,16,5,4,2,16.0,4.875,0,0.0,0.0,6.25,6.25,16,0,0,0,0,0,0,0,0,16,0,0,0,-109.0,-17.0,0.0,-6.0,-1.0,-0.5,-0.79,0.0,-40.0,0.0,6.25,6.25,-13.0,0.0,0.0,0.0,0.0,0.0,0.0,0.0,0.0,-13.0,0.0,0.0,0.0,-18.25,-3.42,0.24,-0.71,-0.12,-2.37,-0.1,-0.01,-1.78,0.0,-0.5,-0.07,-2.68,-0.06,0.03,-0.0,-0.03,-0.19,0.12,0.0,-0.02,-2.68,-0.09,-0.18,0.12
62,"Nubank, the Brazilian digital bank valued at $10 billion, is launching its Nu credit card in Mexico – a country where the unbanked population counts 36 million people. The Sao Paulo-based fintech company, known for its fully-mobile digital bank and credit car…","President Donald Trump made 31 false claims last week and 55 the week before, including 22 at a campaign rally in Des Moines, Iowa, in late January and 13 in an official speech at a community college in Charlotte, North Carolina, in early February.",0.0,219,42,6,15,2,21.0,5.214285714285714,0,16.666666666666664,0.0,0.0,0.0,32,0,0,0,4,0,2,0,0,32,0,0,2,14.0,-2.0,4.0,-4.0,0.0,-23.0,0.56,0.0,16.67,0.0,0.0,-2.27,1.0,0.0,0.0,0.0,0.0,0.0,2.0,0.0,0.0,1.0,0.0,0.0,2.0,-17.26,-3.24,0.24,-0.66,-0.12,-2.34,-0.1,-0.01,-1.7,0.0,-0.54,-0.11,-2.58,-0.06,0.03,-0.01,0.02,-0.19,0.13,0.0,-0.02,-2.58,-0.09,-0.18,0.13
63,"GM revealed Wednesday a new electric architecture that will be the foundation of the automaker's future EV plans and support a wide range of products across its brands, including compact cars, work trucks, large premium SUVs, performance vehicles and a new Bo…","The best travel credit cards earn travel rewards that can make your next vacation easier, more enjoyable and — dare we say it — even almost free.",0.0,219,42,5,18,1,42.0,5.214285714285714,0,20.0,0.0,7.142857142857142,0.0,31,0,0,0,0,0,1,0,0,31,0,0,1,100.0,15.0,0.0,11.0,-1.0,15.0,0.81,0.0,20.0,0.0,-7.67,0.0,8.0,0.0,0.0,0.0,0.0,-1.0,-1.0,0.0,0.0,8.0,0.0,-1.0,-1.0,-16.3,-3.08,0.22,-0.56,-0.14,-1.99,-0.09,-0.01,-1.58,0.0,-0.46,-0.15,-2.5,-0.06,0.03,-0.01,0.01,-0.2,0.13,0.0,-0.02,-2.5,-0.09,-0.18,0.13
64,"""Today’s big tech companies have too much power — too much power over our economy, our society, and our democracy,” Warren wrote at the time. Warren favored unwinding tech's biggest acquisitions, including separating Amazon from Whole Foods, Facebook from Wha…","President Donald Trump made 115 false claims over the last two weeks of February, during which he faced a growing crisis over the coronavirus pandemic, visited India, held four campaign rallies and addressed the Conservative Political Action Conference.",0.0,221,40,5,22,2,20.0,5.525,0,0.0,0.0,2.5,0.0,27,0,0,0,0,0,0,0,0,27,0,3,0,5.0,2.0,-1.0,7.0,0.0,-18.0,-0.16,0.0,0.0,0.0,2.5,-5.26,-6.0,0.0,0.0,0.0,-3.0,0.0,-1.0,0.0,0.0,-6.0,0.0,3.0,-1.0,-15.34,-2.95,0.21,-0.4,-0.15,-1.98,-0.09,-0.01,-1.77,0.0,-0.45,-0.18,-2.48,-0.06,0.03,-0.01,-0.0,-0.2,0.12,0.0,-0.02,-2.48,-0.09,-0.14,0.12
65,"Bloomberg Seeks Redemption... (First column, 2nd story, link ) Related stories: TONIGHT: BERNIE FACES FIRE IN DEM DEBATE... Prepares media onslaught... Vandalism Hits Campaign Offices... WILL OBAMAS MOVE TO STOP SANDERS? Cardiology director: Bernie not disclo…","Since Italy suspended schools in an effort to prevent a further spread of the novel coronavirus, many parents have had to rethink their routines. Some have been forced to work from home or turn to grandparents for help, and women are taking on much of the chi…",0.0,225,36,3,30,5,6.0,6.25,1,0.0,0.0,0.0,2.7777777777777777,36,0,0,0,1,0,0,0,0,36,0,0,0,11.0,-11.0,-8.0,17.0,3.0,-17.5,1.7,1.0,-18.18,0.0,-2.13,2.78,-1.0,0.0,0.0,-1.0,1.0,0.0,-1.0,0.0,0.0,-1.0,0.0,0.0,-1.0,-14.35,-2.88,0.17,-0.12,-0.11,-2.19,-0.07,0.0,-1.95,0.0,-0.49,-0.18,-2.33,-0.06,0.03,-0.02,0.0,-0.2,0.11,0.0,-0.02,-2.33,-0.09,-0.14,0.11
66,"Poised to Leave With 2020 Muddled? (Top headline, 4th story, link ) Related stories: Bloomberg sweeps town's midnight vote as write-in... Klobuchar early lead... Nothing set in stone in Granite State... 'Every Democrat is depressed'... Drudge Report Feed need…","Elizabeth Warren is dropping out of the presidential race, a source familiar with her plans tells CNN, following another round of disappointing finishes in primary contests across the country on Super Tuesday.",0.0,222,39,7,20,5,6.5,5.6923076923076925,1,14.285714285714285,0.0,2.564102564102564,2.564102564102564,37,0,0,0,2,0,0,0,0,37,0,0,0,44.0,7.0,3.0,8.0,3.0,-25.5,0.13,1.0,-10.71,0.0,2.56,-0.56,9.0,0.0,0.0,0.0,2.0,0.0,-2.0,0.0,0.0,9.0,0.0,0.0,-2.0,-13.43,-2.77,0.18,-0.0,-0.07,-2.38,-0.06,0.01,-1.91,0.0,-0.48,-0.18,-2.17,-0.06,0.03,-0.02,0.02,-0.2,0.09,-0.0,-0.02,-2.17,-0.09,-0.14,0.09
67,"Gripping a scalpel, Vladislav Zaitsev makes an incision in the fold of skin between his client's thumb and index finger and pushes in a small glass cylin...","Chinese restaurants in Australia and elsewhere have been suffering for nearly two months, with many reporting a drop in business due to public fears over the novel coronavirus outbreak.",0.0,130,27,2,13,2,27.0,4.814814814814815,0,0.0,0.0,0.0,0.0,21,0,0,0,0,0,1,0,0,21,0,0,1,-27.0,-2.0,-2.0,5.0,0.0,-2.0,-0.6,0.0,-25.0,0.0,0.0,-10.34,-6.0,0.0,0.0,-1.0,-1.0,0.0,1.0,0.0,0.0,-6.0,0.0,0.0,1.0,-13.89,-2.84,0.13,0.01,-0.07,-2.27,-0.06,0.01,-2.09,0.0,-0.51,-0.21,-2.25,-0.06,0.03,-0.02,0.01,-0.2,0.09,-0.0,-0.02,-2.25,-0.09,-0.14,0.09
