,Text,Reference,Label,# of Characters,# of Words,# of Verbs,# of Noun,# of Sentence,Average # of Words per Sentence,Average # of Characters per Words,# of Question Marks,% of Subjective Verbs,% of Passive Voice,% of Positive Words,% of Negative Words,# of Unique Wrods/Terms,# of Misspelled Words,# of Causation Terms,% of generalizing terms,% of # and quantifiers,1st person pronouns,2nd and 3rd person pronouns,Exclusive term,# of exclamation marks,Lexical,Singular pronouns(1st person),Group ref pronouns(1st person),2nd 3rd pronouns,# of Characters- sub,# of Words- sub,# of Verbs- sub,# of Noun- sub,# of Sentence- sub,Average # of Words per Sentence- sub,Average # of Characters per Words- sub,# of Question Marks- sub,% of Subjective Verbs- sub,% of Passive Voice- sub,% of Positive Words- sub,% of Negative Words- sub,# of Unique Wrods/Terms- sub,# of Misspelled Words- sub,# of Causation Terms- sub,% of generalizing terms- sub,% of # and quantifiers- sub,1st person pronouns- sub,2nd and 3rd person pronouns- sub,Exclusive term- sub,# of exclamation marks- sub,Lexical- sub,Singular pronouns(1st person)- sub,Group ref pronouns(1st person)- sub,2nd 3rd pronouns- sub,# of Characters- avg sub,# of Words- avg sub,# of Verbs- avg sub,# of Noun- avg sub,# of Sentence- avg sub,Average # of Words per Sentence- avg sub,Average # of Characters per Words- avg sub,# of Question Marks- avg sub,% of Subjective Verbs- avg sub,% of Passive Voice- avg sub,% of Positive Words- avg sub,% of Negative Words- avg sub,# of Unique Wrods/Terms- avg sub,# of Misspelled Words- avg sub,# of Causation Terms- avg sub,% of generalizing terms- avg sub,% of # and quantifiers- avg sub,1st person pronouns- avg sub,2nd and 3rd person pronouns- avg sub,Exclusive term- avg sub,# of exclamation marks- avg sub,Lexical- avg sub,Singular pronouns(1st person)- avg sub,Group ref pronouns(1st person)- avg sub,2nd 3rd pronouns- avg sub
0,"In 1989 astronaut Fred Gregory made history when he became the first African American to command a NASA mission, but he paid little attention to the headlines that he made.","After 328 days in space, NASA astronaut Christina Koch received an adorable greeting from her four-legged pet.",1.0,143.0,30.0,5.0,9.0,2.0,30.0,4.766666666666667,0.0,0.0,0.0,0.0,0.0,23.0,0.0,0.0,0.0,1.0,0.0,3.0,0.0,0.0,23.0,0.0,0.0,3.0,49.0,13.0,3.0,2.0,0.0,13.0,-0.76,0.0,0.0,0.0,-5.88,0.0,6.0,0.0,0.0,0.0,0.0,0.0,1.0,0.0,0.0,6.0,0.0,0.0,1.0,-12.98,-0.78,0.23,-2.06,-0.31,8.2,-0.35,-0.04,-15.22,0.0,-2.88,-1.29,-3.2,-0.05,-0.06,-0.13,0.28,-0.06,2.25,0.0,0.0,-3.2,-0.04,-0.13,2.25
1,"Following the news that scientists discovered a fast radio burst from deep space that is ""repeating"" every 16 days, experts are increasing their efforts to look for alien life.","New York City's largely obsolete payphones will start being pulled in order to free up sidewalk space, according to New York City Council Speaker Corey Johnson.",1.0,148.0,29.0,7.0,9.0,2.0,29.0,5.103448275862069,0.0,28.57142857142857,0.0,3.4482758620689653,0.0,27.0,0.0,0.0,0.0,1.0,0.0,1.0,0.0,0.0,27.0,0.0,0.0,1.0,13.0,3.0,1.0,-4.0,0.0,3.0,-0.09,0.0,28.57,0.0,-0.4,-3.85,7.0,0.0,0.0,0.0,1.0,0.0,1.0,0.0,0.0,7.0,0.0,0.0,1.0,-10.48,-1.28,1.23,-2.06,-0.31,7.7,-0.18,-0.04,-0.94,0.0,-1.15,-1.29,-1.2,-0.05,-0.06,-0.13,0.28,-0.06,1.25,0.0,0.0,-1.2,-0.04,-0.13,1.25
2,"You’ve heard of the “big bang” theory regarding the start of the universe? Scientists say they recently detected a similar deep-space explosion, up to five times more powerful than any such blast observed previously.",The mystery of the contents of a purse found in the space between a locker and a wall in an Ohio middle school have been revealed. The dust-covered purse was discovered by a custodian.,1.0,183.0,34.0,5.0,12.0,2.0,17.0,5.382352941176471,1.0,0.0,0.0,2.941176470588235,0.0,29.0,0.0,0.0,0.0,1.0,0.0,0.0,0.0,0.0,29.0,0.0,0.0,0.0,32.0,0.0,-1.0,2.0,-1.0,0.0,0.94,1.0,-33.33,0.0,2.94,-2.94,9.0,0.0,0.0,0.0,1.0,0.0,0.0,0.0,0.0,9.0,0.0,0.0,0.0,2.02,0.22,0.89,-1.06,-0.31,3.53,-0.03,0.29,-5.7,0.0,-0.75,-1.29,0.14,-0.05,-0.06,-0.13,0.28,-0.06,0.58,0.0,0.0,0.14,-0.04,-0.13,0.58
3,Scientists think if there is life on Mars it's likely to be hidden in deep underground caves.,"As my wife, daughters and I hiked through the woods at one of the many state parks near our home, I explained to them how we were doing three things that were simultaneously boosting our happiness at that moment.",1.0,77.0,17.0,5.0,4.0,2.0,17.0,4.529411764705882,0.0,40.0,0.0,0.0,0.0,17.0,0.0,0.0,0.0,0.0,0.0,0.0,0.0,0.0,17.0,0.0,0.0,0.0,-97.0,-22.0,-1.0,-5.0,0.0,-22.0,0.07,0.0,6.67,0.0,-2.56,0.0,-10.0,0.0,0.0,-1.0,-2.0,-3.0,-1.0,0.0,0.0,-10.0,-3.0,-3.0,-1.0,-18.23,-3.28,0.73,-2.56,-0.31,1.45,-0.17,0.21,1.92,0.0,-1.28,-1.29,-2.2,-0.05,-0.06,-0.13,0.03,-0.06,0.25,0.0,0.0,-2.2,-0.04,-0.13,0.25
4,"A ""potentially hazardous asteroid"" that whizzed past Earth earlier this month is so large it has its own ""moon.""","""Thank God it's over,"" writes Nevadan Edwin Lyngar, who helped count votes in his precinct -- and was delighted to see it go unashamedly progressive. ""I think we are such a strong representation of America as a whole,"" he writes of his state.",1.0,94.0,19.0,3.0,4.0,2.0,10.0,4.947368421052632,0.0,33.33333333333333,0.0,0.0,5.263157894736842,19.0,0.0,1.0,0.0,0.0,0.0,2.0,0.0,0.0,19.0,0.0,0.0,2.0,-106.0,-24.0,-8.0,-7.0,-1.0,-11.5,0.3,0.0,15.15,0.0,-9.3,5.26,-16.0,0.0,1.0,0.0,0.0,-1.0,-2.0,0.0,0.0,-16.0,0.0,-1.0,-2.0,-26.98,-4.98,0.23,-3.46,-0.31,-1.2,-0.17,0.16,5.16,0.0,-1.6,-0.23,-3.2,-0.05,0.14,-0.13,-0.12,-0.06,0.45,0.0,0.0,-3.2,-0.04,-0.13,0.45
5,"A Q&A with the Department of Energy's Under Secretary for Science, Paul Dabbar.","How bad will it get? That was the question this week, but it applied to several things: the spread of COVID-19 coronavirus around the world, the resulting stock market plunge and the concern about whether America's political leaders are up to the challenge.",1.0,67.0,13.0,1.0,8.0,2.0,13.0,5.153846153846154,0.0,0.0,0.0,0.0,0.0,13.0,0.0,0.0,0.0,0.0,0.0,0.0,0.0,0.0,13.0,0.0,0.0,0.0,-148.0,-30.0,-5.0,-6.0,0.0,-8.5,0.15,-1.0,-33.33,0.0,0.0,-4.65,-20.0,0.0,0.0,0.0,0.0,0.0,-2.0,0.0,0.0,-20.0,0.0,0.0,-2.0,-37.31,-7.12,-0.44,-3.4,-0.31,-2.47,-0.13,0.13,1.76,0.0,-1.81,-0.41,-4.86,-0.05,0.1,-0.13,-0.22,-0.06,0.25,0.0,0.0,-4.86,-0.04,-0.13,0.25
6,Jupiter's Great Red Spot just got a makeover.,"The term ""cruise ship"" evokes images of luxury and well-being, but that is far from what a dream vacation has become for thousands of passengers now trapped on several cruise ships by the sudden emergence of the Wuhan coronavirus.",1.0,38.0,8.0,1.0,5.0,2.0,8.0,4.75,0.0,0.0,0.0,0.0,0.0,8.0,0.0,0.0,0.0,0.0,0.0,0.0,0.0,0.0,8.0,0.0,0.0,0.0,-154.0,-31.0,-3.0,-11.0,0.0,-31.0,-0.17,0.0,-25.0,0.0,-5.13,-2.56,-26.0,0.0,0.0,0.0,0.0,0.0,0.0,0.0,0.0,-26.0,0.0,0.0,0.0,-48.84,-9.35,-0.92,-3.78,-0.31,-4.09,-0.17,0.1,-0.67,0.0,-1.96,-0.53,-6.77,-0.05,0.08,-0.13,-0.29,-0.06,0.1,0.0,0.0,-6.77,-0.04,-0.13,0.1
7,NASA released a stunningly detailed panorama of Mars this week.,"As an outbreak of a novel coronavirus has swept through Hubei province, China, the US Centers for Disease Control and Prevention has been preparing for its worst case scenario -- a widespread outbreak of illnesses in the United States.",1.0,54.0,10.0,1.0,4.0,2.0,10.0,5.4,0.0,0.0,0.0,10.0,0.0,10.0,0.0,0.0,0.0,0.0,0.0,0.0,0.0,0.0,10.0,0.0,0.0,0.0,-143.0,-29.0,-4.0,-12.0,0.0,-29.0,0.35,0.0,-20.0,0.0,10.0,-7.69,-17.0,0.0,0.0,0.0,0.0,0.0,-1.0,0.0,0.0,-17.0,0.0,0.0,-1.0,-55.48,-10.78,-1.27,-4.19,-0.31,-5.05,-0.11,0.08,-2.49,0.0,-0.83,-0.63,-7.95,-0.05,0.06,-0.13,-0.35,-0.06,-0.0,0.0,0.0,-7.95,-0.04,-0.13,-0.0
8,"The Vatican is set to open the secret archives of Pope Pius XII, the World War II-era pope whose record during the Holocaust has come under intense scrutiny.","The religious practices of Shincheonji are in the public eye because the movement appears to be the source of South Korea's growing novel coronavirus outbreak that has infected more than 5,000 people there.",1.0,130.0,28.0,5.0,12.0,2.0,28.0,4.642857142857143,0.0,20.0,0.0,0.0,3.571428571428571,25.0,0.0,0.0,0.0,0.0,0.0,0.0,0.0,0.0,25.0,0.0,0.0,0.0,-44.0,-5.0,-1.0,2.0,0.0,-5.0,-0.63,0.0,-13.33,0.0,0.0,-2.49,-3.0,0.0,-1.0,0.0,-1.0,0.0,0.0,0.0,0.0,-3.0,0.0,0.0,0.0,-52.2,-9.89,-1.11,-3.62,-0.31,-3.8,-0.15,0.07,-1.68,0.0,-1.05,-0.3,-7.2,-0.05,0.05,-0.13,-0.39,-0.06,-0.09,0.0,0.0,-7.2,-0.04,-0.13,-0.09
9,Bears are mammals that belong to the family Ursidae.,"Another long weekend, another set of sales to shop — and these deals are worthy of the highest office in the land. Presidents Day weekend means dozens of discounts on everything you've been waiting to buy, from mattresses and kitchen appliances to fashion, fu…",1.0,44.0,9.0,2.0,4.0,2.0,9.0,4.888888888888889,0.0,50.0,0.0,0.0,0.0,9.0,0.0,0.0,0.0,0.0,0.0,0.0,0.0,0.0,9.0,0.0,0.0,0.0,-173.0,-35.0,-6.0,-13.0,0.0,-13.0,-0.04,0.0,25.0,0.0,-2.27,0.0,-25.0,0.0,0.0,0.0,0.0,0.0,0.0,0.0,0.0,-25.0,0.0,0.0,0.0,-58.18,-11.08,-1.27,-3.96,-0.31,-4.7,-0.16,0.06,1.97,0.0,-1.24,-0.4,-8.2,-0.05,0.04,-0.13,-0.42,-0.06,-0.15,0.0,0.0,-8.2,-0.04,-0.13,-0.15
10,MPs are being asked to make some important choices about the decade-long renovation of the Centre Block of Parliament Hill — choices that could have a significant impact on how Canadians experience the nation's capital. But experts with knowledge of the proje…,"The Solar Orbiter, built by NASA and ESA, launched from Cape Canaveral and began its journey to get a close, unprecedented look at the sun.",1.0,219.0,42.0,7.0,16.0,2.0,21.0,5.214285714285714,0.0,14.285714285714285,0.0,4.761904761904762,0.0,33.0,0.0,0.0,1.0,0.0,0.0,0.0,0.0,0.0,33.0,0.0,0.0,0.0,104.0,17.0,3.0,6.0,0.0,-4.0,0.61,0.0,14.29,0.0,4.76,0.0,10.0,0.0,0.0,1.0,0.0,0.0,-1.0,0.0,0.0,10.0,0.0,0.0,-1.0,-47.16,-9.06,-0.96,-3.15,-0.31,-4.35,-0.13,0.05,1.7,0.0,-0.95,-0.48,-6.83,-0.05,0.03,-0.04,-0.45,-0.06,-0.21,0.0,0.0,-6.83,-0.04,-0.13,-0.21
11,The Teck Frontier project didn't deserve to be framed as a do-or-die test of political attitudes towards the energy sector and climate change. The fact that it was shows just how little progress we've made in this country in reconciling economic and environme…,"Space weather has more implications than causing glitches in Earth's satellite-based communications -- it can also strand gray whales, according to a new study. Typically, space weather is created when solar storms occur on the sun and stream out toward Earth…",1.0,218.0,43.0,8.0,12.0,2.0,21.5,5.069767441860465,0.0,25.0,0.0,2.3255813953488373,0.0,37.0,0.0,0.0,0.0,0.0,0.0,1.0,0.0,0.0,37.0,0.0,0.0,1.0,-2.0,2.0,0.0,-3.0,0.0,1.0,-0.3,0.0,12.5,0.0,2.33,-2.44,-2.0,0.0,0.0,0.0,0.0,0.0,0.0,0.0,0.0,-2.0,0.0,0.0,0.0,-38.06,-7.28,-0.61,-2.81,-0.31,-4.01,-0.13,0.04,2.38,0.0,-0.92,-0.55,-5.36,-0.05,0.02,-0.05,-0.47,-0.06,-0.17,0.0,0.0,-5.36,-0.04,-0.13,-0.17
12,"Bob McDonald's science blog: New finds of the remains of Homo erectus and their stone tools reveals a culture that developed new ideas, but didn't abandon old ones","If you've always dreamed of exploring space, here's your chance.",1.0,136.0,28.0,5.0,13.0,1.0,28.0,4.857142857142857,0.0,0.0,0.0,0.0,0.0,26.0,0.0,0.0,0.0,0.0,0.0,1.0,0.0,0.0,26.0,0.0,0.0,1.0,81.0,18.0,1.0,11.0,-1.0,18.0,-0.64,0.0,0.0,0.0,0.0,0.0,16.0,0.0,0.0,-1.0,0.0,0.0,0.0,0.0,0.0,16.0,0.0,0.0,0.0,-36.67,-6.94,-0.54,-2.45,-0.39,-3.22,-0.14,0.04,1.02,0.0,-1.07,-0.61,-4.97,-0.05,0.02,-0.06,-0.49,-0.06,-0.14,0.0,0.0,-4.97,-0.04,-0.13,-0.14
13,"Advances in missile technology by both the Russians and the Chinese have the potential to paralyze leaders and decision-makers in a crisis, Canada's top military commander warned in a speech Wednesday.",Satellite images released by NASA and the European Space Agency reveal that air pollution over China has gone down since the coronavirus outbreak.,1.0,171.0,31.0,3.0,12.0,2.0,31.0,5.516129032258065,0.0,0.0,0.0,3.225806451612903,6.451612903225806,21.0,0.0,0.0,0.0,0.0,0.0,0.0,0.0,0.0,21.0,0.0,0.0,0.0,47.0,8.0,-1.0,2.0,0.0,8.0,0.12,0.0,0.0,0.0,3.23,2.1,0.0,0.0,0.0,0.0,0.0,0.0,0.0,0.0,0.0,0.0,0.0,0.0,0.0,-32.98,-6.43,-0.63,-2.2,-0.38,-2.34,-0.1,0.03,-0.14,0.0,-0.97,-0.19,-4.98,-0.05,0.01,-0.06,-0.51,-0.06,-0.18,0.0,0.0,-4.98,-0.04,-0.13,-0.18
14,RCMP have begun their enforcement of a B.C. Supreme Court injunction in the traditional territory of the Wet'suwet'en Nation at the fourth site along a forest service road that Coastal Gaslink and its contractors have been prevented from accessing for weeks.,Johnson was among a group of black women mathematicians who helped power NASA's space travel in the early 1960s when the agency was still segregated.,1.0,218.0,41.0,6.0,16.0,4.0,14.0,5.317073170731708,0.0,16.666666666666664,0.0,0.0,0.0,32.0,0.0,0.0,0.0,0.0,0.0,2.0,0.0,0.0,32.0,0.0,0.0,2.0,93.0,16.0,2.0,7.0,2.0,-11.0,0.32,0.0,-33.33,0.0,-4.0,0.0,11.0,0.0,0.0,0.0,-1.0,0.0,2.0,0.0,0.0,11.0,0.0,0.0,2.0,-26.65,-5.32,-0.51,-1.73,-0.24,-2.7,-0.08,0.03,-0.03,0.0,-1.1,-0.27,-4.26,-0.05,0.0,-0.07,-0.52,-0.06,-0.09,0.0,0.0,-4.26,-0.04,-0.13,-0.09
15,"Plastics made from fossil fuels generate a lot of greenhouse gas emissions and waste. 'Bioplastics,' especially compostable plastics made from plants, have been touted as a greener alternative. But what are they really? And are they really more environmentall…","Virgin Galactic, the ambitious space tourism startup founded by British entrepreneur Richard Branson, posted a net loss of $73 million for the fourth quarter.",1.0,222.0,39.0,8.0,11.0,3.0,9.75,5.6923076923076925,1.0,37.5,0.0,0.0,5.128205128205128,29.0,0.0,0.0,0.0,0.0,0.0,0.0,0.0,0.0,29.0,0.0,0.0,0.0,87.0,15.0,6.0,1.0,1.0,-14.25,0.07,1.0,37.5,0.0,-4.17,0.96,7.0,0.0,0.0,0.0,-2.0,0.0,0.0,0.0,0.0,7.0,0.0,0.0,0.0,-20.85,-4.47,-0.27,-1.62,-0.18,-3.29,-0.04,0.08,1.36,0.0,-1.21,-0.01,-3.82,-0.05,0.0,-0.07,-0.53,-0.06,-0.13,0.0,0.0,-3.82,-0.04,-0.13,-0.13
17,"The fallout from Teck's decision to pull the plug on the Frontier oilsands project in northern Alberta has significant political, economic and environmental ramifications. We take a look at who benefits from the decision and who could take a hit.","Visitors to Rome have long enjoyed visiting a host of ancient architectural sites, from the fascinating Coliseum to the grandeur of the Pantheon.",1.0,207.0,40.0,5.0,13.0,3.0,20.0,5.175,0.0,0.0,0.0,5.0,2.5,25.0,0.0,0.0,0.0,0.0,0.0,0.0,0.0,0.0,25.0,0.0,0.0,0.0,84.0,17.0,0.0,7.0,1.0,-3.0,-0.17,0.0,0.0,0.0,-8.04,2.5,9.0,0.0,0.0,0.0,0.0,0.0,0.0,0.0,0.0,9.0,0.0,0.0,0.0,-12.65,-2.89,-0.22,-1.01,-0.09,-3.09,-0.03,0.07,0.63,0.0,-0.71,0.12,-3.08,-0.05,-0.01,-0.08,-0.5,-0.06,-0.2,0.0,0.0,-3.08,-0.04,-0.13,-0.2
18,RCMP have begun their enforcement of a B.C. Supreme Court injunction in the traditional territory of the Wet'suwet'en Nation at the fourth site along a forest service road that Coastal Gaslink and its contractors have been prevented from accessing for weeks.,"Osaka's airport has just improved its facilities -- but not for its human travelers. A world-class dog rest area, which includes shower facilities and a ""pee pole"" that cleans itself, will open at Osaka International Airport this week.",1.0,218.0,41.0,6.0,16.0,4.0,14.0,5.317073170731708,0.0,16.666666666666664,0.0,0.0,0.0,32.0,0.0,0.0,0.0,0.0,0.0,2.0,0.0,0.0,32.0,0.0,0.0,2.0,20.0,3.0,0.0,3.0,1.0,-5.0,0.11,0.0,16.67,0.0,-2.63,0.0,-2.0,0.0,0.0,0.0,0.0,0.0,0.0,0.0,0.0,-2.0,0.0,0.0,0.0,-8.72,-2.2,-0.14,-0.69,0.01,-3.34,-0.01,0.06,0.67,0.0,-0.82,0.05,-2.62,-0.05,-0.01,-0.08,-0.51,-0.06,-0.12,0.0,0.0,-2.62,-0.04,-0.13,-0.12
19,Sales of Canadian authored books have fallen fast. But no one can agree on why — or what to do about it.,"Russia's influence campaign is driven by a desire to ""watch us tear ourselves apart,"" a senior FBI official said Monday, comments that come after details of a classified briefing to lawmakers became public in news reports, including a claim by the intelligenc…",1.0,83.0,22.0,6.0,4.0,3.0,11.0,3.772727272727273,0.0,0.0,0.0,4.545454545454546,4.545454545454546,22.0,0.0,0.0,0.0,0.0,0.0,0.0,0.0,0.0,22.0,0.0,0.0,0.0,-136.0,-20.0,-2.0,-11.0,2.0,-31.0,-1.44,0.0,-12.5,0.0,4.55,4.55,-12.0,0.0,0.0,0.0,0.0,0.0,0.0,0.0,0.0,-12.0,0.0,-1.0,0.0,-11.93,-2.53,-0.07,-1.01,0.04,-3.71,-0.08,0.06,-0.12,0.0,-0.7,0.21,-2.7,-0.05,-0.01,-0.08,-0.52,-0.06,-0.15,0.0,0.0,-2.7,-0.04,-0.13,-0.15
20,"With little fanfare, the Senate of Canada voted today to suspend Lynn Beyak for the remainder of this parliamentary session because she failed to complete the anti-racism training she was directed to undergo the last time she was temporarily kicked out of the…","For years, some of the most towering figures in Silicon Valley have pulled off a feat that's equal parts impressive and head-scratching: running two or more sizable companies at the same time. Now, it's coming under scrutiny.",1.0,218.0,43.0,9.0,12.0,1.0,43.0,5.069767441860465,0.0,22.22222222222222,0.0,2.3255813953488373,2.3255813953488373,28.0,0.0,1.0,0.0,0.0,0.0,3.0,0.0,0.0,28.0,0.0,0.0,3.0,29.0,6.0,3.0,3.0,-2.0,24.5,-0.04,0.0,22.22,0.0,-3.08,2.33,-7.0,0.0,1.0,-2.0,-1.0,0.0,3.0,0.0,0.0,-7.0,0.0,0.0,3.0,-8.41,-1.83,0.13,-0.92,-0.02,-2.53,-0.08,0.05,0.22,0.0,-0.69,0.25,-2.48,-0.05,0.03,-0.09,-0.53,-0.06,-0.04,0.0,0.0,-2.48,-0.04,-0.13,-0.04
21,RCMP are poised to enforce a B.C. Supreme Court injunction in the traditional territory of the Wet’suwet’en Nation at the fourth site along a forest service road that Coastal Gaslink and its contractors have been prevented from accessing for weeks.,"Between the ruffles and the thigh-high slits, the sequins and the classic glam silhouettes of the many dresses seen on the 92nd Academy Awards red carpet Sunday night, two design details seemed to have the biggest (quite literally) fashion moment: capes and s…",1.0,209.0,40.0,8.0,17.0,4.0,13.666666666666666,5.225,0.0,25.0,0.0,2.5,0.0,35.0,1.0,0.0,0.0,0.0,0.0,1.0,0.0,0.0,35.0,0.0,0.0,1.0,-9.0,-3.0,4.0,0.0,3.0,-29.33,0.16,0.0,25.0,0.0,0.17,0.0,2.0,1.0,0.0,-1.0,-2.0,0.0,1.0,0.0,0.0,2.0,0.0,0.0,1.0,-5.62,-1.33,0.27,-0.61,0.05,-2.78,-0.07,0.05,0.65,0.0,-0.68,0.18,-1.97,-0.01,0.03,-0.09,-0.54,-0.06,-0.03,0.0,0.0,-1.97,-0.04,-0.13,-0.03
22,"Canadian passengers from the quarantined Diamond Princess cruise ship in Japan who have not tested positive for COVID-19 are on a charter flight that is expected to arrive in Trenton, Ont., in the wee hours of Friday morning.","Not long after Valentine's Day ends, a massive asteroid estimated to be between 1,443 feet and 3,248 feet long will pass by Earth around 6:05 a.m. ET on Saturday. Based on the size range, it could be anywhere between the size of a suspension bridge to taller …",1.0,188.0,38.0,6.0,15.0,3.0,19.5,4.947368421052632,0.0,33.33333333333333,0.0,2.631578947368421,0.0,33.0,0.0,0.0,0.0,0.0,0.0,0.0,0.0,0.0,33.0,0.0,0.0,0.0,-25.0,-10.0,-3.0,0.0,-1.0,7.25,0.51,0.0,11.11,0.0,2.63,0.0,3.0,0.0,0.0,0.0,-3.0,0.0,-1.0,0.0,0.0,3.0,0.0,0.0,-1.0,-3.98,-0.96,0.31,-0.41,0.08,-2.76,-0.07,0.05,1.41,0.0,-0.66,0.12,-1.59,-0.01,0.03,-0.09,-0.55,-0.06,-0.06,0.0,0.0,-1.59,-0.04,-0.13,-0.06
23,"Almost a quarter-century ago, Canada had a comprehensive plan to repair the Crown-Indigenous relationship. Is it time to revisit the final report of the Royal Commission on Aboriginal Peoples?","More than a year after NASA's New Horizons mission closely flew by a small, distant Kuiper Belt Object, researchers have been able to sift through the data and learn intriguing new details about this fossil from the formation of the solar system. Located four…",1.0,164.0,29.0,4.0,10.0,2.0,14.5,5.655172413793103,1.0,0.0,0.0,3.4482758620689653,0.0,22.0,0.0,0.0,0.0,0.0,0.0,1.0,0.0,0.0,22.0,0.0,0.0,1.0,-53.0,-15.0,-3.0,-5.0,0.0,-7.5,0.72,1.0,-14.29,0.0,1.18,0.0,-17.0,0.0,0.0,0.0,0.0,0.0,1.0,0.0,0.0,-17.0,0.0,0.0,1.0,-3.48,-0.99,0.27,-0.44,0.07,-2.95,-0.05,0.08,0.72,0.0,-0.61,0.06,-1.7,-0.01,0.02,-0.09,-0.55,-0.06,-0.04,0.0,0.0,-1.7,-0.04,-0.13,-0.04
24,"Betelgeuse just keeps on getting weirder. After an unprecedented dimming, followed by the detection of a gravitational wave, the star seems to have changed shape.","At daybreak on the shores of the island nation of São Tomé e Príncipe, Sunny Dolat transformed into a high priest. Before an intimate audience at the 2019 N'golá Biennial of Arts and Culture, and joined by 46 models, the Kenyan creative director and fashion c…",1.0,138.0,25.0,6.0,7.0,3.0,12.5,5.52,0.0,0.0,0.0,0.0,0.0,23.0,0.0,0.0,0.0,0.0,0.0,0.0,0.0,0.0,23.0,0.0,0.0,0.0,-77.0,-21.0,4.0,-14.0,1.0,-10.5,0.85,0.0,0.0,0.0,-4.35,0.0,-13.0,0.0,0.0,0.0,-2.0,0.0,0.0,0.0,0.0,-13.0,0.0,0.0,0.0,-4.06,-1.18,0.31,-0.58,0.09,-3.2,-0.03,0.08,0.08,0.0,-0.7,0.0,-1.76,-0.01,0.02,-0.09,-0.56,-0.06,-0.07,0.0,0.0,-1.76,-0.04,-0.13,-0.07
25,Canadian passengers aboard the quarantined Diamond Princess cruise ship in Japan who have not tested positive for COVID-19 are expected to disembark today ahead of a charter flight that's scheduled to leave Tokyo on Friday.,"In the foothills of the Sierra de los Órganos Mountains, more than two hours west of Havana, a trickle of riders on horseback descends a reddish-brown mountain in a serpentine line. They smile as they pass a group of hikers and continue on their ride.",1.0,189.0,35.0,8.0,12.0,2.0,35.0,5.4,0.0,12.5,0.0,2.857142857142857,0.0,33.0,0.0,0.0,0.0,0.0,0.0,0.0,0.0,0.0,33.0,0.0,0.0,0.0,-18.0,-10.0,4.0,-1.0,-1.0,12.5,0.8,0.0,12.5,0.0,0.63,0.0,0.0,-2.0,0.0,0.0,-1.0,0.0,-2.0,0.0,0.0,0.0,0.0,0.0,-2.0,-2.63,-0.98,0.42,-0.52,0.08,-2.57,-0.02,0.07,-0.03,0.0,-0.67,-0.05,-1.43,-0.01,0.02,-0.1,-0.57,-0.06,-0.1,0.0,0.0,-1.43,-0.04,-0.13,-0.1
26,Canadian passengers aboard the quarantined Diamond Princess cruise ship in Japan who have not tested positive for COVID-19 were allowed off the ship today ahead of a charter flight that's scheduled to leave Tokyo on Friday.,"Over the past year, a handful of surprising auction house press releases have graced my inbox. ""Sotheby's Partners with The Strokes' Fabrizio Moretti For Special Old Masters Exhibition & Auction,"" one proclaimed, while another proudly boasted: ""Christie's to …",1.0,188.0,36.0,7.0,13.0,2.0,36.0,5.222222222222222,0.0,14.285714285714285,0.0,2.7777777777777777,0.0,32.0,0.0,0.0,0.0,0.0,0.0,0.0,0.0,0.0,32.0,0.0,0.0,0.0,-34.0,-3.0,2.0,-5.0,0.0,16.5,-0.47,0.0,14.29,0.0,2.78,0.0,-7.0,0.0,0.0,0.0,-1.0,0.0,0.0,0.0,0.0,-7.0,-1.0,0.0,0.0,-1.35,-0.75,0.49,-0.43,0.06,-1.95,-0.01,0.07,-0.06,0.0,-0.65,-0.09,-1.16,-0.01,0.01,-0.1,-0.57,-0.06,-0.12,0.0,0.0,-1.16,-0.04,-0.13,-0.12
27,"The decision to quarantine some 3,700 people on board the Diamond Princess cruise ship in Japan amid an outbreak of coronavirus is unprecedented. But experts say it's also likely doing more harm than good.","In a city where new bars and restaurants open all the time, the old, revered favorites take on a different meaning. Explore CNN Travel's picks for dimly lit nooks, shiny bartops and cavernous corners worth returning to again and again.",1.0,172.0,34.0,5.0,12.0,3.0,17.0,5.0588235294117645,0.0,20.0,0.0,2.941176470588235,5.88235294117647,34.0,0.0,0.0,1.0,1.0,0.0,0.0,0.0,0.0,34.0,0.0,0.0,0.0,-24.0,-6.0,2.0,-1.0,0.0,-3.0,0.16,0.0,20.0,0.0,-2.06,5.88,1.0,0.0,0.0,0.0,1.0,0.0,0.0,0.0,0.0,1.0,0.0,0.0,0.0,-0.73,-0.6,0.48,-0.38,0.08,-2.05,-0.01,0.07,0.11,0.0,-0.62,0.08,-0.84,-0.02,0.01,-0.06,-0.54,-0.06,-0.15,0.0,0.0,-0.84,-0.04,-0.13,-0.15
28,The Trudeau government has made its case for why a country like Canada should win a seat on the United Nations Security Council. There hasn't been any discussion of the drawbacks.,"Arthur Conan Doyle's 1912 saga ""The Lost World"" was inspired by reports from three little-known European colonies at the top of South America. Today the independent nations of Guyana and Suriname and the French territory of Guyane are finally stepping out fro…",1.0,149.0,31.0,6.0,12.0,3.0,15.5,4.806451612903226,0.0,16.666666666666664,0.0,6.451612903225806,3.225806451612903,27.0,0.0,0.0,0.0,0.0,0.0,1.0,0.0,0.0,27.0,0.0,0.0,1.0,-70.0,-11.0,1.0,-5.0,1.0,-5.5,-0.41,0.0,-23.33,0.0,4.07,0.84,-7.0,0.0,0.0,0.0,-2.0,0.0,1.0,0.0,0.0,-7.0,0.0,0.0,1.0,-0.94,-0.58,0.5,-0.34,0.1,-2.2,-0.02,0.06,0.16,0.0,-0.48,0.14,-0.78,-0.02,0.01,-0.07,-0.55,-0.06,-0.13,0.0,0.0,-0.78,-0.04,-0.13,-0.13
29,Florida police investigate after 'several' tongues preserved in jars found in crawl space: reports Fox News Jars of human tongues discovered under Florida man’s home WSAV-TV Jars of preserved human tongues found in Florida home New York Post UF: Gainesville h…,"President Donald Trump made 56 false claims last week -- repeating one of his conspiracy theories about the 2016 election, promoting new fiction about impeachment witness Lt. Col. Alexander Vindman, and inflating his accomplishments and his standing in the po…",1.0,220.0,41.0,6.0,26.0,1.0,41.0,5.365853658536586,0.0,0.0,0.0,0.0,0.0,20.0,0.0,0.0,0.0,0.0,0.0,0.0,0.0,0.0,20.0,0.0,0.0,0.0,-1.0,1.0,2.0,9.0,-2.0,27.67,-0.16,0.0,0.0,0.0,-2.5,-7.5,-11.0,0.0,0.0,0.0,-3.0,0.0,-3.0,0.0,0.0,-11.0,0.0,0.0,-3.0,1.22,-0.22,0.53,0.17,0.06,-1.49,-0.02,0.06,-0.36,0.0,-0.56,0.09,-0.96,-0.02,0.0,-0.07,-0.55,-0.06,-0.15,0.0,0.0,-0.96,-0.04,-0.13,-0.15
30,The 'Junior Astronaut Program' provides STEM and skills training for hopeful space cadets.,Los astronautas de la Estación Espacial Internacional podrían recibir algunos visitantes el próximo año.,1.0,78.0,13.0,2.0,6.0,2.0,13.0,6.0,0.0,0.0,0.0,7.6923076923076925,0.0,13.0,0.0,0.0,0.0,0.0,0.0,0.0,0.0,0.0,13.0,0.0,0.0,0.0,-13.0,-1.0,0.0,-2.0,0.0,-1.0,-0.5,0.0,0.0,0.0,7.69,0.0,-1.0,-3.0,0.0,0.0,0.0,0.0,0.0,0.0,0.0,-1.0,0.0,0.0,0.0,-1.33,-0.78,0.42,0.0,0.05,-1.72,0.01,0.06,-0.84,0.0,-0.39,0.05,-1.36,-0.02,0.0,-0.07,-0.56,-0.06,-0.17,0.0,0.0,-1.36,-0.04,-0.13,-0.17
