68,Sparta Science's partnership with the NFL helps the league collect data on players at the Scouting Combine which can be used to predict and prevent future injuries.,"Hidden away in a dead-end alley, The Misanthrope Society is a quirky addition to Taipei's bar scene that serves up creative cocktails, black humor and a dislike of humankind.",1.0,138.0,27.0,6.0,11.0,2.0,27.0,5.111111111111111,0.0,16.666666666666664,0.0,0.0,0.0,24.0,0.0,0.0,0.0,0.0,0.0,0.0,0.0,0.0,24.0,0.0,0.0,0.0,-8.0,-2.0,4.0,-1.0,0.0,-2.0,0.08,0.0,-33.33,0.0,-6.9,-3.45,-2.0,0.0,0.0,0.0,0.0,0.0,0.0,0.0,0.0,-2.0,0.0,0.0,0.0,-8.44,-2.02,0.17,-0.38,0.2,-2.56,0.02,0.0,-0.3,0.0,-0.79,0.51,-2.18,-0.04,-0.02,-0.02,-0.26,-0.03,-0.19,0.0,0.0,-2.18,-0.01,-0.1,-0.19
69,"U.S. stock futures, in a highly volatile overnight session, were actually pointing to a steady Wall Street open Wednesday.","Riot Games, the video game studio behind one of the world's biggest PC games, ""League of Legends,"" is revealing more details about its first shooter game.",1.0,104.0,19.0,2.0,7.0,4.0,6.666666666666667,5.473684210526316,0.0,50.0,0.0,5.263157894736842,5.263157894736842,17.0,0.0,0.0,0.0,0.0,0.0,0.0,0.0,0.0,17.0,0.0,0.0,0.0,-25.0,-7.0,0.0,-6.0,2.0,-19.33,0.51,0.0,0.0,0.0,5.26,5.26,-5.0,0.0,0.0,0.0,-1.0,0.0,-1.0,0.0,0.0,-5.0,0.0,0.0,-1.0,-9.07,-2.16,0.12,-0.43,0.22,-2.74,0.03,0.0,0.2,0.0,-0.74,0.56,-2.28,-0.04,-0.02,-0.02,-0.27,-0.03,-0.2,0.0,0.0,-2.28,-0.01,-0.1,-0.2
70,"According to John Sculley, who served as Apple's CEO from 1983 to 1993 and currently serves as chairman of pharmacy benefit management company RxAdvance, low prices and the convenience of providing healthcare at a well-known location is going to cause a 'cons…","Risk Takers, a special series by CNN Business, spotlights 20 strategic bets designed to push global business forward.",1.0,219.0,42.0,7.0,15.0,1.0,42.0,5.214285714285714,0.0,14.285714285714285,0.0,7.142857142857142,0.0,31.0,0.0,1.0,0.0,2.0,0.0,0.0,0.0,0.0,31.0,0.0,0.0,0.0,119.0,24.0,4.0,8.0,-1.0,24.0,-0.34,0.0,14.29,0.0,7.14,0.0,13.0,0.0,1.0,0.0,1.0,0.0,0.0,0.0,0.0,13.0,0.0,0.0,0.0,-8.05,-1.97,0.15,-0.37,0.2,-2.42,0.03,0.0,0.19,0.0,-0.67,0.53,-2.18,-0.04,-0.0,-0.02,-0.25,-0.03,-0.21,0.0,0.0,-2.18,-0.01,-0.1,-0.21
71,"In addition to complying with safety guidelines from sources such as the Centers for Disease Control and Prevention, experts say these are some of the ways employers can support their workers amid the coronavirus outbreak.","The complete guide to American Express Centurion Lounges, including which airports have them, how to get in and a look at the new LAX location.",1.0,188.0,35.0,5.0,14.0,2.0,35.0,5.371428571428571,0.0,20.0,0.0,2.857142857142857,2.857142857142857,32.0,0.0,0.0,1.0,0.0,0.0,1.0,0.0,0.0,32.0,0.0,0.0,1.0,69.0,10.0,2.0,5.0,0.0,10.0,0.61,0.0,20.0,0.0,2.86,2.86,9.0,0.0,0.0,1.0,0.0,0.0,1.0,0.0,0.0,9.0,0.0,0.0,1.0,-7.49,-1.88,0.15,-0.32,0.2,-2.2,0.03,0.0,0.25,0.0,-0.66,0.55,-2.07,-0.04,-0.01,-0.01,-0.25,-0.03,-0.2,0.0,0.0,-2.07,-0.01,-0.1,-0.2
72,"If your airline cancels your flight, your employer restricts business travel or an organization cancels its scheduled conference, your decision about whether to travel will be made for you. But if you're in the wait-and-see mode or decide to pack your bags an…",Fast food chains are rushing to launch meatless and plant-based options. Not Dunkin' Donuts.,1.0,218.0,43.0,10.0,11.0,2.0,21.5,5.069767441860465,0.0,10.0,0.0,0.0,0.0,30.0,0.0,0.0,0.0,0.0,0.0,6.0,0.0,0.0,30.0,0.0,0.0,6.0,139.0,29.0,7.0,5.0,-1.0,14.5,-0.57,0.0,-23.33,0.0,0.0,0.0,16.0,0.0,0.0,0.0,0.0,0.0,6.0,0.0,0.0,16.0,0.0,0.0,6.0,-6.54,-1.69,0.22,-0.32,0.19,-2.18,0.03,0.0,0.18,0.0,-0.69,0.52,-1.99,-0.04,-0.01,-0.01,-0.26,-0.03,-0.13,0.0,0.0,-1.99,-0.01,-0.1,-0.13
73,"Bryce Dishongh bought his first home, a $140,000 condo in Austin, Texas, in 2017 and renovated the entire place himself. But he spends the majority of his time renting it out on Airbnb and living in the solar-powered camper he built in the back of his truck.","This is a prime opportunity to give our children — both girls and boys — a toy, book or game that pays tributes to the brave ladies who have changed the world.",1.0,212.0,47.0,5.0,14.0,3.0,23.5,4.51063829787234,0.0,0.0,0.0,0.0,0.0,30.0,0.0,0.0,0.0,2.0,0.0,6.0,0.0,0.0,30.0,0.0,0.0,6.0,84.0,15.0,-3.0,4.0,1.0,-8.5,0.51,0.0,-12.5,0.0,-3.12,0.0,6.0,0.0,0.0,0.0,2.0,0.0,6.0,0.0,0.0,6.0,0.0,-1.0,6.0,-5.7,-1.45,0.22,-0.28,0.19,-2.13,0.02,-0.0,-0.03,0.0,-0.72,0.5,-1.91,-0.04,-0.01,-0.01,-0.24,-0.03,-0.05,0.0,0.0,-1.91,-0.01,-0.11,-0.05
74,"Saving the first few dollars are quick and easy. But once you hit your 30s, generating the amount of income you need to retire early will only get harder and harder.","When it comes to home décor, nothing is more important than a good sofa. And these 12 picks aren't just beloved by Wayfair shoppers, but all cost less than $800.",1.0,135.0,31.0,8.0,3.0,3.0,15.5,4.354838709677419,0.0,12.5,0.0,3.225806451612903,0.0,25.0,0.0,0.0,1.0,1.0,0.0,3.0,0.0,0.0,25.0,0.0,0.0,3.0,3.0,1.0,3.0,-4.0,0.0,0.5,-0.05,0.0,-7.5,0.0,-6.77,0.0,-3.0,0.0,0.0,0.0,-1.0,0.0,2.0,0.0,0.0,-3.0,0.0,0.0,2.0,-5.9,-1.43,0.26,-0.38,0.2,-2.18,0.01,-0.0,-0.07,0.0,-0.71,0.47,-1.9,-0.04,-0.01,0.0,-0.23,-0.03,-0.02,0.0,0.0,-1.9,-0.01,-0.11,-0.02
75,"While Americans work roughly 25% longer than their European peers, residents in some parts of the U.S. lead the pack. Here is a list of the 10 hardest-working cities in America.","The nine-ounce MoonArk will be attached to a small lunar rover so that one day it may be picked up by lunar explorers sometime in the future. It was developed by faculty at Carnegie Mellon University, along with collaborators from around the world.",1.0,147.0,31.0,3.0,10.0,5.0,8.0,4.741935483870968,0.0,33.33333333333333,0.0,6.451612903225806,0.0,24.0,0.0,0.0,1.0,2.0,0.0,1.0,0.0,0.0,24.0,0.0,0.0,1.0,-59.0,-12.0,-5.0,-3.0,2.0,-13.5,-0.05,0.0,-4.17,0.0,6.45,0.0,-11.0,0.0,-1.0,1.0,1.0,0.0,0.0,0.0,0.0,-11.0,0.0,0.0,0.0,-5.94,-1.4,0.24,-0.39,0.23,-2.33,0.01,-0.0,0.17,0.0,-0.65,0.45,-1.9,-0.04,-0.01,0.01,-0.21,-0.03,-0.02,0.0,0.0,-1.9,-0.01,-0.11,-0.02
76,"The market for flying cars, or electric air taxis, is expected to continue growth this decade, soaring to $1.5 trillion globally by 2040, according to a Morgan Stanley Research study.","The flight was supposed to be quick and painless. Instead, it turned into what one passenger described as a painful assault -- and a lightning rod for what constitutes proper airline etiquette.",1.0,154.0,30.0,6.0,10.0,3.0,15.5,5.133333333333334,0.0,16.666666666666664,0.0,0.0,0.0,27.0,0.0,0.0,0.0,3.0,0.0,0.0,0.0,0.0,27.0,0.0,0.0,0.0,-8.0,-2.0,0.0,3.0,0.0,-0.5,0.07,0.0,-16.67,0.0,-6.25,-6.25,1.0,0.0,0.0,0.0,2.0,0.0,-1.0,0.0,0.0,1.0,0.0,0.0,-1.0,-5.89,-1.4,0.25,-0.4,0.24,-2.39,0.01,-0.0,0.19,0.0,-0.68,0.43,-1.87,-0.04,-0.01,0.01,-0.18,-0.04,-0.03,0.0,0.0,-1.87,-0.01,-0.11,-0.03
77,What are the best credit cards for remodeling a home? We analyzed popular credit cards using an average American's annual spending budget and dug into each card's perks and drawbacks to find out.,"The essence of masculinity is at the center of a new exhibition at London's Barbican Art Gallery, showcasing diverse images of male lives from the 1950s to the present.",1.0,163.0,33.0,5.0,11.0,2.0,16.5,4.9393939393939394,1.0,20.0,0.0,6.0606060606060606,3.0303030303030303,27.0,0.0,0.0,0.0,0.0,0.0,0.0,0.0,0.0,27.0,0.0,0.0,0.0,23.0,4.0,3.0,1.0,0.0,-12.5,0.11,1.0,-30.0,0.0,6.06,3.03,6.0,0.0,0.0,0.0,-1.0,0.0,0.0,0.0,0.0,6.0,0.0,0.0,0.0,-5.72,-1.35,0.25,-0.39,0.23,-2.42,0.01,0.01,0.25,0.0,-0.63,0.45,-1.83,-0.04,-0.01,0.01,-0.19,-0.04,-0.04,0.0,0.0,-1.83,-0.02,-0.11,-0.04
78,"Residents of Moria, a village on the Greek island of Lesvos — a holding station for refugees from the Middle East and Africa seeking asylum in the EU — are fearing their safety as living conditions deteriorate and crime escalates due to a backlog of cases and…","From SD cards and network attached storage drives to internal SSD drives, Amazon is discounting practically every kind of storage device you can think of, for one day only.",1.0,214.0,47.0,6.0,22.0,1.0,47.0,4.553191489361702,0.0,16.666666666666664,0.0,0.0,4.25531914893617,34.0,0.0,0.0,0.0,0.0,0.0,1.0,0.0,0.0,34.0,0.0,0.0,1.0,70.0,18.0,1.0,10.0,-1.0,18.0,-0.41,0.0,-3.33,0.0,0.0,4.26,7.0,0.0,0.0,0.0,-1.0,0.0,0.0,0.0,0.0,7.0,0.0,0.0,0.0,-4.92,-1.13,0.26,-0.25,0.21,-2.07,-0.0,0.01,0.26,0.0,-0.66,0.48,-1.71,-0.04,-0.01,0.01,-0.19,-0.04,-0.03,0.0,0.0,-1.71,-0.02,-0.11,-0.03
79,"In Finland, the cost of giving birth is next to nothing. In the U.S., recent studies suggest that the out-of-pocket spending for maternity care costs $4,500 on average, meanwhile maternal mortality rates are increasing. Here, experts explain the broader impli…","One hundred floors up, and 1,100 feet in the air, Edge has built-in bragging rights: It is, after all, the highest outdoor observation deck in the Western Hemisphere. Take that One World Observatory and Willis Tower.",1.0,221.0,40.0,7.0,14.0,5.0,8.4,5.525,0.0,28.57142857142857,0.0,0.0,0.0,34.0,0.0,0.0,0.0,1.0,0.0,0.0,0.0,0.0,34.0,0.0,0.0,0.0,40.0,4.0,2.0,0.0,2.0,-9.6,0.5,0.0,28.57,0.0,0.0,0.0,7.0,0.0,0.0,0.0,-2.0,0.0,0.0,0.0,0.0,7.0,0.0,0.0,0.0,-4.04,-1.0,0.29,-0.21,0.24,-2.21,0.0,0.01,0.42,0.0,-0.69,0.46,-1.59,-0.04,-0.01,0.01,-0.19,-0.04,-0.04,0.0,0.0,-1.59,-0.02,-0.11,-0.04
80,"Hundreds of thousands of people fleeing a Russian-backed Syrian offensive are being squeezed into ever smaller areas near Turkey's border ""under horrendous conditions"" in freezing temperatures that are killing babies and young children, the UN humanitarian ch…","You could be exposed to dangerous chemicals from tobacco via thirdhand smoke, which comes from the bodies or clothing of smokers even if they are not actively smoking, a new study says.",1.0,224.0,37.0,7.0,13.0,1.0,37.0,6.054054054054054,0.0,28.57142857142857,0.0,0.0,13.513513513513514,33.0,0.0,0.0,0.0,0.0,0.0,0.0,0.0,0.0,33.0,0.0,0.0,0.0,70.0,5.0,0.0,5.0,-1.0,5.0,1.24,0.0,0.0,0.0,0.0,7.26,3.0,0.0,0.0,0.0,0.0,0.0,0.0,0.0,0.0,3.0,0.0,0.0,0.0,-3.15,-0.91,0.31,-0.18,0.23,-2.0,0.02,0.01,0.58,0.0,-0.72,0.6,-1.49,-0.04,-0.01,0.0,-0.19,-0.04,-0.05,0.0,0.0,-1.49,-0.02,-0.11,-0.05
81,"The red carpet is out, the votes are tallied and the stars are gathering in Hollywood for the 92nd annual Academy Awards. Here's a quick catch-up about this year's show.",Photographer Kyle Weeks wants to help re-write preconceived narratives about African men by focusing on young creatives.,1.0,140.0,30.0,6.0,9.0,3.0,15.0,4.666666666666667,0.0,50.0,0.0,0.0,0.0,25.0,0.0,0.0,0.0,1.0,0.0,0.0,0.0,0.0,25.0,0.0,0.0,0.0,36.0,13.0,2.0,3.0,1.0,-2.0,-1.45,0.0,50.0,0.0,0.0,0.0,8.0,0.0,0.0,0.0,1.0,0.0,0.0,0.0,0.0,8.0,0.0,0.0,0.0,-3.31,-0.91,0.32,-0.21,0.23,-2.06,0.01,0.01,1.0,0.0,-0.74,0.58,-1.49,-0.04,-0.01,0.0,-0.19,-0.04,-0.06,0.0,0.0,-1.49,-0.02,-0.11,-0.06
82,"Employees at Port Alberni’s only aquarium say the space is vital to providing education in the community, in the midst of climate change. But it's Board of Directors says it only has a month left before it'll close.",UK firm Beemcar has signed an agreement to develop driverless pods that would operate above the city traffic.,1.0,178.0,38.0,10.0,13.0,3.0,19.0,4.684210526315789,0.0,10.0,0.0,0.0,0.0,29.0,0.0,0.0,0.0,0.0,0.0,1.0,0.0,0.0,29.0,0.0,0.0,1.0,86.0,20.0,5.0,6.0,1.0,1.0,-0.43,0.0,10.0,0.0,0.0,0.0,11.0,0.0,0.0,0.0,0.0,0.0,1.0,0.0,0.0,11.0,0.0,0.0,1.0,-3.0,-0.81,0.38,-0.18,0.24,-2.07,0.0,0.01,0.93,0.0,-0.77,0.56,-1.43,-0.04,-0.01,0.0,-0.19,-0.04,-0.06,0.0,0.0,-1.43,-0.02,-0.11,-0.06
83,"Indigenous youth entering their third straight day gathered on the steps of the B.C. Legislature repeated a series of demands Wednesday, saying they will continue to hold the space at least until the calls are met.","One surefire way to know that spring is fast approaching? Tons of outdoor furniture, decor and more are now on sale at Wayfair.",1.0,179.0,36.0,9.0,10.0,4.0,12.333333333333334,4.972222222222222,0.0,11.11111111111111,0.0,0.0,0.0,30.0,0.0,0.0,0.0,0.0,0.0,1.0,0.0,0.0,30.0,0.0,0.0,1.0,74.0,13.0,5.0,2.0,2.0,0.83,0.41,-1.0,-38.89,0.0,-4.35,0.0,7.0,0.0,0.0,0.0,-1.0,0.0,1.0,0.0,0.0,7.0,0.0,0.0,1.0,-2.69,-0.74,0.43,-0.19,0.25,-2.16,0.0,0.01,0.87,0.0,-0.79,0.53,-1.37,-0.04,-0.01,-0.0,-0.2,-0.04,-0.05,0.0,0.0,-1.37,-0.02,-0.11,-0.05
84,Langley RCMP’s top officer says he’s extremely concerned about public safety following the second deadly shooting in a busy public space in his Metro Vancouver community in recent months.,"When you think of George Washington, do you think washers and dryers, refrigerators and pressure cookers? Presidents Day weekend may have originally meant honoring America's top leaders, but it has come to also signify serious appliance sales. We've rounded u…",1.0,159.0,29.0,4.0,11.0,2.0,29.0,5.482758620689655,0.0,0.0,0.0,3.4482758620689653,6.896551724137931,24.0,0.0,0.0,0.0,0.0,0.0,1.0,0.0,0.0,24.0,0.0,0.0,1.0,-62.0,-11.0,-8.0,-4.0,0.0,15.67,-0.04,-1.0,0.0,0.0,-1.55,6.9,-10.0,0.0,0.0,0.0,0.0,0.0,-2.0,0.0,0.0,-10.0,0.0,0.0,-2.0,-2.63,-0.75,0.41,-0.19,0.25,-2.05,0.01,0.01,0.68,0.0,-0.78,0.59,-1.38,-0.04,-0.01,-0.0,-0.21,-0.04,-0.05,0.0,0.0,-1.38,-0.02,-0.11,-0.05
85,"Judith Sayers, president of the Nuu-chah-nulth Tribal Council, is calling for a three to six month moratorium to encourage honest dialogue between government and Indigenous leaders.",Here's a look at some of our favorite Presidents Day furniture sales.,1.0,156.0,26.0,3.0,11.0,2.0,26.0,6.0,0.0,33.33333333333333,0.0,7.6923076923076925,0.0,24.0,0.0,0.0,0.0,2.0,0.0,0.0,0.0,0.0,24.0,0.0,0.0,0.0,98.0,14.0,1.0,7.0,0.0,14.0,1.17,0.0,33.33,0.0,-0.64,0.0,12.0,0.0,0.0,-1.0,2.0,0.0,0.0,0.0,0.0,12.0,0.0,-1.0,0.0,-2.6,-0.8,0.39,-0.19,0.24,-1.97,0.02,0.01,0.88,0.0,-0.71,0.57,-1.39,-0.04,-0.01,-0.0,-0.19,-0.04,-0.06,0.0,0.0,-1.39,-0.02,-0.11,-0.06
86,The Regional District of Nanaimo has updated its park bylaws following a Supreme Court of B.C. ruling saying individuals have the right to sleep and erect shelters in public spaces and parks.,"If you're in the market for a new phone, well lucky you, because companies just keep churning them out. After Samsung's recent unveiling of four new smartphones ----  S20, S20+, S20 Ultra and Z Flip ---- it's now LG's turn with the new V60 ThinQ. Thankfully, …",1.0,160.0,32.0,8.0,13.0,4.0,11.0,5.0,0.0,0.0,0.0,3.125,0.0,28.0,0.0,0.0,0.0,0.0,0.0,1.0,0.0,0.0,28.0,0.0,0.0,1.0,-53.0,-15.0,4.0,-5.0,1.0,-4.67,0.47,0.0,0.0,0.0,-1.13,0.0,-13.0,0.0,-1.0,0.0,-1.0,0.0,0.0,0.0,0.0,-13.0,0.0,0.0,0.0,-2.52,-0.77,0.42,-0.16,0.26,-2.07,0.02,0.01,0.69,0.0,-0.7,0.55,-1.35,-0.04,-0.02,-0.01,-0.2,-0.04,-0.05,0.0,0.0,-1.35,-0.02,-0.11,-0.05
87,Tiko Kerr is a longtime friend and coworker of Judson Beaumont. He spoke to CBC about the void Beaumont's death will create in the local arts community.,"Even before Tesla revealed the Cybertruck last November, other companies — both brand-new start ups and long-established automakers — had already announced plans for electric pickup trucks of their own.",1.0,126.0,27.0,5.0,11.0,3.0,13.5,4.666666666666667,0.0,20.0,0.0,0.0,3.7037037037037033,25.0,0.0,0.0,0.0,0.0,0.0,0.0,0.0,0.0,25.0,0.0,0.0,0.0,-47.0,-3.0,2.0,1.0,1.0,-16.5,-1.1,0.0,20.0,0.0,-3.33,3.7,-3.0,0.0,0.0,0.0,0.0,0.0,-1.0,0.0,0.0,-3.0,0.0,0.0,-1.0,-2.83,-0.81,0.42,-0.16,0.26,-2.14,0.01,0.0,0.74,0.0,-0.73,0.57,-1.35,-0.04,-0.02,-0.01,-0.2,-0.04,-0.06,0.0,0.0,-1.35,-0.02,-0.11,-0.06
88,Coquitlam search and rescue members have joined the search for a missing New Westminster woman who was last seen by her family late Sunday.,"Joe Coulombe, founder of the popular Trader Joe's grocery chain that brought affordable wine and exotic food to millions of Americans, has died at his home in Pasadena, California. He was 89-years-old.",1.0,116.0,24.0,5.0,10.0,2.0,24.0,4.833333333333333,0.0,20.0,0.0,0.0,0.0,22.0,0.0,0.0,0.0,0.0,0.0,2.0,0.0,0.0,22.0,0.0,0.0,2.0,-54.0,-8.0,1.0,-4.0,-1.0,8.0,-0.48,0.0,-5.0,0.0,-6.25,-3.12,-8.0,0.0,0.0,0.0,0.0,0.0,1.0,0.0,0.0,-8.0,0.0,0.0,1.0,-3.25,-0.88,0.42,-0.17,0.26,-2.1,0.01,0.0,0.79,0.0,-0.75,0.55,-1.38,-0.04,-0.02,-0.01,-0.21,-0.04,-0.05,0.0,0.0,-1.38,-0.02,-0.11,-0.05
89,"The Métis Experience promises to be fun, but the demonstrations of language, history and jigging are set against a backdrop of a culture that organizers say is slowly disappearing.","When Samsung announced its new 4K and 8K TV lines at the 2020 Consumer Electronics Show in January, enhanced picture quality definitely stood out, but affordability took center stage. Now, Samsung is releasing further details on exact sizing and pricing acros…",1.0,152.0,29.0,6.0,9.0,2.0,29.0,5.241379310344827,0.0,50.0,0.0,6.896551724137931,3.4482758620689653,25.0,0.0,0.0,0.0,0.0,0.0,0.0,0.0,0.0,25.0,0.0,0.0,0.0,-68.0,-12.0,0.0,-8.0,0.0,8.5,-0.12,0.0,33.33,0.0,4.46,3.45,-12.0,0.0,0.0,0.0,-3.0,0.0,-1.0,0.0,0.0,-12.0,0.0,0.0,-1.0,-3.26,-0.89,0.42,-0.19,0.25,-1.99,0.01,0.0,1.16,0.0,-0.7,0.57,-1.38,-0.04,-0.02,-0.01,-0.21,-0.04,-0.06,0.0,0.0,-1.38,-0.02,-0.11,-0.06
90,"Pride House was not just an education centre, but also a safe and welcoming venue for gay and lesbian athletes, coaches, friends and families.","We're officially dubbing the new Galaxy S20 Ultra the ""kitchen sink phone,"" because Samsung seems to have thrown everything it has at the device. There's a 6.9-inch display with a buttery-smooth refresh rate, four cameras (including a wide-angle lens) and hic…",1.0,119.0,24.0,1.0,10.0,2.0,24.0,4.958333333333333,0.0,100.0,0.0,4.166666666666666,0.0,21.0,0.0,0.0,0.0,0.0,0.0,0.0,0.0,0.0,21.0,0.0,0.0,0.0,-101.0,-17.0,-7.0,-4.0,-1.0,10.0,-0.41,0.0,100.0,0.0,1.73,-2.44,-14.0,0.0,-1.0,0.0,-1.0,0.0,-1.0,0.0,0.0,-14.0,0.0,0.0,-1.0,-3.63,-0.95,0.38,-0.2,0.24,-1.95,0.01,0.0,2.08,0.0,-0.67,0.55,-1.42,-0.04,-0.02,-0.01,-0.22,-0.04,-0.06,0.0,0.0,-1.42,-0.02,-0.11,-0.06
91,A group of young Indigenous people appear to have been arrested after occupying an office in the B.C. legislature on Wednesday night.,"Gideon Lewin, who worked with famed photographer Richard Avedon for 16 years, recounts his experiences in a new book.",1.0,112.0,22.0,5.0,7.0,4.0,7.666666666666667,5.090909090909091,0.0,20.0,0.0,0.0,0.0,22.0,0.0,0.0,0.0,0.0,0.0,0.0,0.0,0.0,22.0,0.0,0.0,0.0,13.0,3.0,3.0,-1.0,2.0,-11.33,-0.12,0.0,20.0,0.0,-10.53,0.0,3.0,0.0,0.0,0.0,-1.0,0.0,-1.0,0.0,0.0,3.0,0.0,0.0,-1.0,-4.07,-1.04,0.38,-0.25,0.26,-2.08,0.01,0.0,2.11,0.0,-0.7,0.53,-1.45,-0.04,-0.02,-0.01,-0.22,-0.04,-0.07,0.0,0.0,-1.45,-0.02,-0.11,-0.07
92,"The province is defending its decision to invite protesters inside the B.C. Legislature for a meeting that resulted in a sit-in and multiple arrests, as supporters of those arrested gathered in front of the building again Thursday morning.",Airlines and airports could do more to improve our flying experience. Aviation buffs weigh in on nine needed improvements that would better aviation for everyone.,1.0,202.0,38.0,6.0,12.0,4.0,13.0,5.315789473684211,0.0,16.666666666666664,0.0,0.0,0.0,30.0,0.0,0.0,0.0,0.0,0.0,1.0,0.0,0.0,30.0,0.0,0.0,1.0,64.0,13.0,-1.0,4.0,1.0,0.5,-0.2,0.0,16.67,0.0,-12.0,0.0,5.0,0.0,0.0,0.0,-1.0,0.0,1.0,0.0,0.0,5.0,0.0,-1.0,1.0,-3.53,-0.95,0.39,-0.23,0.27,-2.15,0.01,0.0,2.1,0.0,-0.72,0.51,-1.4,-0.04,-0.02,-0.01,-0.23,-0.04,-0.07,0.0,0.0,-1.4,-0.02,-0.11,-0.07
93,The Vancouver Public Library says circulation of its Indigenous collection tripled between 2018 and 2019. Libraries and publishers across Canada say they have seen a similar rise in readership.,"Many designers over the five-day period tightened their formats with faster-paced, sensory-driven shows in a possible bid to see off any concerns about the event's staying power. Here are the best moments.",1.0,165.0,29.0,5.0,11.0,3.0,14.5,5.689655172413793,0.0,0.0,0.0,0.0,0.0,27.0,0.0,0.0,0.0,2.0,0.0,1.0,0.0,0.0,27.0,0.0,0.0,1.0,-9.0,-3.0,1.0,2.0,0.0,-1.5,0.25,0.0,-25.0,0.0,-3.12,-3.12,-2.0,0.0,0.0,0.0,2.0,0.0,0.0,0.0,0.0,-2.0,0.0,0.0,0.0,-3.39,-0.96,0.38,-0.23,0.28,-2.21,0.01,0.0,1.92,0.0,-0.75,0.49,-1.37,-0.04,-0.02,-0.02,-0.21,-0.04,-0.06,0.0,0.0,-1.37,-0.02,-0.11,-0.06
94,Conversations on Indigenous justice at the centre of the Victoria Urban Reconciliation Dialogue event in Saanich Fairgrounds on Friday and Saturday on Vancouver Island.,"If you're looking to stay healthy during the flu season, ensure you take these critical steps.",1.0,145.0,24.0,1.0,14.0,2.0,24.0,6.041666666666667,0.0,0.0,0.0,0.0,0.0,19.0,0.0,0.0,0.0,0.0,0.0,0.0,0.0,0.0,19.0,0.0,0.0,0.0,66.0,8.0,-4.0,11.0,0.0,8.0,1.1,0.0,0.0,0.0,-6.25,-6.25,3.0,0.0,0.0,0.0,0.0,0.0,-1.0,0.0,0.0,3.0,0.0,0.0,-1.0,-3.47,-1.02,0.34,-0.2,0.27,-2.16,0.02,0.0,1.74,0.0,-0.77,0.47,-1.44,-0.04,-0.02,-0.02,-0.22,-0.04,-0.07,0.0,0.0,-1.44,-0.02,-0.11,-0.07
96,"Transport Minister Marc Garneau says the federal Liberal government is ""very concerned"" about growing anti-pipeline protests that are crippling parts of the country's transport network, including one of the country's main rail arteries in southern Ontario.",Secretary of State Mike Pompeo in an interview Sunday did not reveal any details of a potential historic meeting between President Donald Trump and leaders of the Taliban.,1.0,221.0,36.0,6.0,14.0,2.0,36.0,6.138888888888889,0.0,33.33333333333333,0.0,0.0,11.11111111111111,29.0,0.0,0.0,0.0,1.0,0.0,0.0,0.0,0.0,29.0,0.0,0.0,0.0,77.0,8.0,4.0,1.0,0.0,8.0,1.0,0.0,33.33,0.0,0.0,11.11,4.0,0.0,0.0,0.0,1.0,0.0,0.0,0.0,0.0,4.0,0.0,0.0,0.0,-3.1,-1.01,0.34,-0.16,0.26,-1.95,0.03,0.0,1.73,0.0,-0.77,0.59,-1.4,-0.04,-0.02,-0.01,-0.22,-0.04,-0.09,0.0,0.0,-1.4,-0.02,-0.11,-0.09
97,"After three years, Island Health has decided not to renew the contract for the Comox Valley's only safe injection site. The site will cease its witnessed injection services on March 31.","Ulay, the pioneering and provocative performance artist and photographer best known for his works with his like-minded former partner Marina Abramovic, has died aged 76, it was announced on Monday.",1.0,155.0,31.0,5.0,12.0,3.0,15.5,5.0,0.0,0.0,0.0,3.225806451612903,0.0,27.0,0.0,0.0,0.0,2.0,0.0,1.0,0.0,0.0,27.0,0.0,0.0,1.0,-13.0,1.0,-1.0,2.0,1.0,-14.5,-0.6,0.0,-16.67,0.0,-3.44,-6.67,1.0,0.0,0.0,0.0,1.0,0.0,-2.0,0.0,0.0,1.0,0.0,0.0,-2.0,-3.08,-1.0,0.34,-0.15,0.27,-1.99,0.03,0.0,1.56,0.0,-0.76,0.57,-1.38,-0.04,-0.02,-0.01,-0.2,-0.04,-0.08,0.0,0.0,-1.38,-0.02,-0.11,-0.08
98,"For many students in B.C., the last day of school before spring break is March 13. When the final bell rings, they're off for two weeks. For working parents it can require some out-of-the-box thinking when it comes to child care.","The Nintendo Play Station, perhaps the last copy of a video game console that never came to market, sold for $360,000 at auction.",1.0,189.0,41.0,7.0,13.0,6.0,8.6,4.609756097560975,0.0,14.285714285714285,0.0,0.0,2.4390243902439024,35.0,0.0,0.0,2.0,2.0,0.0,2.0,0.0,0.0,35.0,0.0,0.0,2.0,82.0,18.0,5.0,4.0,4.0,-14.4,-0.04,0.0,14.29,0.0,0.0,2.44,12.0,0.0,0.0,1.0,1.0,0.0,2.0,0.0,0.0,12.0,0.0,0.0,2.0,-2.72,-0.89,0.36,-0.13,0.3,-2.1,0.03,-0.0,1.54,0.0,-0.78,0.58,-1.27,-0.04,-0.02,0.01,-0.19,-0.04,-0.07,0.0,0.0,-1.27,-0.02,-0.11,-0.07
0,Limiting people’s movements through quarantines to stop the spread of coronavirus seems to have also limited nitrogen dioxide emissions in China.,"After 328 days in space, NASA astronaut Christina Koch received an adorable greeting from her four-legged pet.",0.0,125.0,21.0,5.0,11.0,2.0,21.0,5.9523809523809526,0.0,0.0,0.0,0.0,4.761904761904762,19.0,0.0,0.0,0.0,0.0,0.0,0.0,0.0,0.0,19.0,0.0,0.0,0.0,31.0,4.0,3.0,4.0,0.0,4.0,0.42,0.0,0.0,0.0,-5.88,4.76,2.0,0.0,0.0,0.0,-1.0,0.0,-2.0,0.0,0.0,2.0,0.0,0.0,-2.0,-30.98,-9.78,0.23,-0.06,-0.31,-0.8,0.84,-0.04,-15.22,0.0,-2.88,3.48,-7.2,-0.05,-0.06,-0.13,-0.72,-0.06,-0.75,0.0,0.0,-7.2,-0.04,-0.13,-0.75
1,"Amazon has knocked $300 off the cost of Apple’s 2019 MacBook Air with 256GB of solid-state storage. This is the best price we’ve seen on this model, as deals are usually limited to the base model with 128GB of storage.","New York City's largely obsolete payphones will start being pulled in order to free up sidewalk space, according to New York City Council Speaker Corey Johnson.",0.0,179.0,40.0,7.0,14.0,3.0,20.0,4.475,0.0,28.57142857142857,0.0,2.5,2.5,30.0,0.0,0.0,1.0,4.0,0.0,0.0,0.0,0.0,30.0,0.0,0.0,0.0,44.0,14.0,1.0,1.0,1.0,-6.0,-0.72,0.0,28.57,0.0,-1.35,-1.35,10.0,0.0,0.0,1.0,4.0,0.0,0.0,0.0,0.0,10.0,0.0,0.0,0.0,-3.98,-0.28,1.23,1.44,0.19,-1.3,0.1,-0.04,-0.94,0.0,-1.63,2.35,-1.7,-0.05,-0.06,0.37,1.28,-0.06,-0.75,0.0,0.0,-1.7,-0.04,-0.13,-0.75
2,"Jeff Bezos’ aerospace company Blue Origin has completed the first payload of its future orbital rocket, the New Glenn. The cavernous nose cone has a diameter of 7 meters, or 22 feet, and it’s so giant that it can completely house Blue Origin’s smaller New She…",The mystery of the contents of a purse found in the space between a locker and a wall in an Ohio middle school have been revealed. The dust-covered purse was discovered by a custodian.,0.0,215.0,46.0,6.0,24.0,2.0,23.0,4.673913043478261,0.0,0.0,0.0,0.0,0.0,36.0,0.0,1.0,0.0,2.0,0.0,2.0,0.0,0.0,36.0,0.0,0.0,2.0,64.0,12.0,0.0,14.0,-1.0,6.0,0.23,0.0,-33.33,0.0,0.0,-2.94,16.0,0.0,1.0,0.0,2.0,0.0,2.0,0.0,0.0,16.0,0.0,0.0,2.0,17.02,4.88,1.23,5.27,0.02,-0.47,-0.08,-0.04,-5.7,0.0,-2.04,1.14,2.14,-0.05,0.27,0.2,1.28,-0.06,-0.09,0.0,0.0,2.14,-0.04,-0.13,-0.09
